State,StateAbbr,Year,Client,Lobbyist1,Lobbyist2,Lobbyist3,Lobbyist4,Lobbyist5,Lobbyist6,Lobbyist7,Lobbyist8,Lobbyist9,Lobbyist10,Lobbyist11,Lobbyist12
North Dakote,ND,2016,AARP GOVERNMENT AFFAIRS,ELAINE RYAN
North Dakote,ND,2016,AARP NORTH DAKOTA,MICHAEL J TOMASKO,DOREEN RIEDMAN,JANIS CHENEY,JOSH ASKVIG,LYLE HALVORSON,BEAU CUMMINGS
North Dakote,ND,2016,"ACT ASPIRE, LLC",JIM MORRIS
North Dakote,ND,2016,"ACT, INC.",TAMARA IBACH
North Dakote,ND,2016,"ADVANCED ENGINEERING AND ENVIRONMENTAL SERVICES, INC.",STEVE L BURIAN,ROCKY T SCHNEIDER,CORY CHORNE,LOREN HOFFMAN,CHARLES VEIN
North Dakote,ND,2016,AFLAC,PATRICK J WARD,JOHN E WARD
North Dakote,ND,2016,AIA NORTH DAKOTA,BONNIE STAIGER,STACY KRUMWIEDE STAIGER
North Dakote,ND,2016,"ALLETE, INC.",MARGARET HODNIK
North Dakote,ND,2016,ALLIANCE OF AUTOMOBILE MANUFACTURERS,JOEL GILBERTSON,LEVI ANDRIST
North Dakote,ND,2016,ALLIANCE PIPELINE INC.,TODD D. KRANDA
North Dakote,ND,2016,ALLSTATE INSURANCE COMPANY,PATRICK J WARD,JOHN E WARD
North Dakote,ND,2016,"ALZHEIMER'S DISEASE AND RELATED DISORDERS ASSOCIATION, INC.",ERICA J CERMAK,NIKKI HEINERT
North Dakote,ND,2016,AMAZON.COM,JOEL GILBERTSON,LEVI ANDRIST
North Dakote,ND,2016,AMERICA'S HEALTH INSURANCE PLANS,JACK MCDONALD
North Dakote,ND,2016,"AMERICAN CANCER SOCIETY CANCER ACTION NETWORK, INC.",DEBORAH J KNUTH
North Dakote,ND,2016,"AMERICAN CIVIL LIBERTIES UNION, INC.",JENNIFER COOK
North Dakote,ND,2016,AMERICAN COUNCIL OF LIFE INSURANCE,JOEL GILBERTSON,LEVI ANDRIST
North Dakote,ND,2016,AMERICAN EXPRESS COMPANY,JOEL GILBERTSON,LEVI ANDRIST
North Dakote,ND,2016,"AMERICAN HEART ASSOCIATION, DAKOTA AFFILIATE, INC.",BONNIE STAIGER,STACY KRUMWIEDE STAIGER
North Dakote,ND,2016,AMERICAN INTERNATIONAL GROUP INC,JOEL GILBERTSON,LEVI ANDRIST
North Dakote,ND,2016,AMERICAN LUNG ASSOCIATION,KRISTIE WOLFF
North Dakote,ND,2016,ANNE CARLSEN CENTER,JOEL GILBERTSON,ERIC M. MONSON,LEVI ANDRIST
North Dakote,ND,2016,"APT, INC.",KEN TUPA,BRUCE D MURRY,WILLIAM KALANEK,ERICA J CERMAK
North Dakote,ND,2016,ARCHER DANIELS MIDLAND COMPANY,GREGORY WEBB
North Dakote,ND,2016,ASSOCIATED BUILDERS AND CONTRACTORS OF MN/ND,BRENDA ELMER
North Dakote,ND,2016,ASSOCIATED GENERAL CONTRACTORS OF NORTH DAKOTA,RUSSELL L HANSON,MARK DOUGHERTY
North Dakote,ND,2016,ASSOCIATION FOR PUBLIC EMPLOYEES,KEN TUPA,BRUCE D MURRY,WILLIAM KALANEK,ERICA J CERMAK
North Dakote,ND,2016,ASSOCIATION OF NORTH DAKOTA INSURERS,PATRICK J WARD,JOHN E WARD
North Dakote,ND,2016,AT&T,JOEL GILBERTSON,LEVI ANDRIST,CHERYL RILEY
North Dakote,ND,2016,"AUTO CLUB SERVICES, INC.",EUGENE LADOUCER
North Dakote,ND,2016,AUTOMOBILE DEALERS ASSOCIATION OF NORTH DAKOTA,MATTHEW LARSGAARD
North Dakote,ND,2016,AUX SABLE MIDSTREAM LLC,TODD D. KRANDA
North Dakote,ND,2016,"BADLANDS NGL'S, LLC",CORY FONG,SHANE GOETTLE,LACEE ANDERSON
North Dakote,ND,2016,BASIN COOPERATIVE SERVICES,STEVE TOMAC,DALE NIEZWAAG,MIKE EGGL,CHRISTOPHER VANDEVENTER,JEAN SCHAFER
North Dakote,ND,2016,BASIN ELECTRIC POWER COOPERATIVE,STEVE TOMAC,DALE NIEZWAAG,MIKE EGGL,CHRISTOPHER VANDEVENTER,JEAN SCHAFER
North Dakote,ND,2016,"BASIN TELECOMMUNICATIONS, INC.",STEVE TOMAC,DALE NIEZWAAG,MIKE EGGL,CHRISTOPHER VANDEVENTER,JEAN SCHAFER
North Dakote,ND,2016,BAYER CORPORATION,CRAIG MISCHO
North Dakote,ND,2016,"BEYOND SHELTER, INC.",DANIEL MADLER
North Dakote,ND,2016,BIOSCIENCE ASSOCIATION OF NORTH DAKOTA,JOEL GILBERTSON,LEVI ANDRIST
North Dakote,ND,2016,BIOTECHNOLOGY INDUSTRY ORGANIZATION,JOEL GILBERTSON,LEVI ANDRIST
North Dakote,ND,2016,BISMARCK-MANDAN AREA CHAMBER OF COMMERCE,KELVIN L HULLET
North Dakote,ND,2016,"BISMARCK-MANDAN HOME BUILDERS ASSOCIATION, INC.",DOT FRANK
North Dakote,ND,2016,BLUE CROSS BLUE SHIELD OF NORTH DAKOTA,PAM GULLESON,JACK MCDONALD,MEGAN HOUN
North Dakote,ND,2016,"BNI COAL, LTD.",RYAN KELLY,REBECCA KLETT,MARGARET HODNIK
North Dakote,ND,2016,BNSF RAILWAY COMPANY,JOHN OLSON
North Dakote,ND,2016,BOBCAT COMPANY,CORY FONG,SHANE GOETTLE,LACEE ANDERSON
North Dakote,ND,2016,BOTTINEAU ECONOMIC DEVELOPMENT CORPORATION,NICOLLETTE R WEISSMAN
North Dakote,ND,2016,BRISTOL-MYERS SQUIBB COMPANY,JOHN MARCHANT
North Dakote,ND,2016,CASS COUNTY ELECTRIC COOPERATIVE INC.,SCOTT HANDY,MARSHAL ALBRIGHT
North Dakote,ND,2016,CAWS NORTH DAKOTA,JANELLE MOOS
North Dakote,ND,2016,CENTER MUTUAL INSURANCE COMPANY,PATRICK J WARD,JOHN E WARD
North Dakote,ND,2016,CENTURY LINK,KENT BLICKENSDERFER
North Dakote,ND,2016,CHARITABLE GAMING ASSOCIATION OF NORTH DAKOTA,TODD D. KRANDA
North Dakote,ND,2016,CHS,JACOB HAMLIN
North Dakote,ND,2016,CITY OF HARVEY,NICOLLETTE R WEISSMAN
North Dakote,ND,2016,CITY OF MINOT,SHANE GOETTLE
North Dakote,ND,2016,CITY OF WILLISTON,JOEL GILBERTSON
North Dakote,ND,2016,COMMUNITY HEALTHCARE ASSOCIATION OF THE DAKOTAS,DANA SCHAAR JAHNER
North Dakote,ND,2016,"COMMUNITY OPTIONS FOR RESIDENTIAL AND EMPLOYMENT SERVICES, INC.",TRINA FAY GRESS
North Dakote,ND,2016,CONSUMER AND FAMILY NETWORK (CFN),CARLOTTA MCCLEARY
North Dakote,ND,2016,"CONTINENTAL RESOURCES, INC.",BLU HULSEY,JAMES ROGER KELLEY
North Dakote,ND,2016,CONVENTION OF STATES ACTION,DAVID SCHNEIDER
North Dakote,ND,2016,CORRECTIONS CORPORATION OF AMERICA,JERRY LANKFORD
North Dakote,ND,2016,CREDIT UNION ASSOCIATION OF THE DAKOTAS,JEFFREY OLSON
North Dakote,ND,2016,CREDIT UNION ASSOCIATION OF THE DAKOTAS,GREGORY TSCHIDER
North Dakote,ND,2016,CYSTIC FIBROSIS ASSOCIATION OF NORTH DAKOTA,KENNETH KARLS
North Dakote,ND,2016,DAKOTA COAL COMPANY,STEVE TOMAC,DALE NIEZWAAG,MIKE EGGL,CHRISTOPHER VANDEVENTER,JEAN SCHAFER
North Dakote,ND,2016,DAKOTA GASIFICATION COMPANY,STEVE TOMAC,DALE NIEZWAAG,MIKE EGGL,CHRISTOPHER VANDEVENTER,JEAN SCHAFER
North Dakote,ND,2016,"DESIGNER GENES OF NORTH DAKOTA, INC.",ROXANE ROMANICK
North Dakote,ND,2016,"DUCKS UNLIMITED, INC.",CARMEN MILLER,ERIC LINDSTROM,MICHAEL FINDLAY
North Dakote,ND,2016,ECONOMIC DEVELOPMENT ASSOCIATION OF NORTH DAKOTA,DANA L BOHN,KEITH LUND,CONNIE OVA,ELLEN HUBER
North Dakote,ND,2016,ELI LILLY AND COMPANY,SUSAN LANDWEHR
North Dakote,ND,2016,ELLINGSON COMPANIES,LEVI OTIS
North Dakote,ND,2016,EMPLOYERS MUTUAL CASUALTY COMPANY,PATRICK J WARD,JOHN E WARD
North Dakote,ND,2016,"ENABLE MIDSTREAM PARTNERS, LP",CORY FONG,SHANE GOETTLE,LACEE ANDERSON
North Dakote,ND,2016,"ENBRIDGE ENERGY COMPANY, INC.",CORY FONG,SHANE GOETTLE,LACEE ANDERSON
North Dakote,ND,2016,"ENERGY TRANSFER PARTNERS GP, L.P.",JOEL GILBERTSON,LEVI ANDRIST
North Dakote,ND,2016,ESSENTIA HEALTH,MICHAEL J. MAHONEY,ANDREW L. ASKEW
North Dakote,ND,2016,EXPRESS SCRIPTS HOLDING CO,PATRICK J WARD,JOHN E WARD,DAVID M. DEDERICHS
North Dakote,ND,2016,EXXON MOBIL CORPORATION,KEN TUPA,BRUCE D MURRY,WILLIAM KALANEK,ERICA J CERMAK,GREGORY PULLIAM
North Dakote,ND,2016,FARMERS UNION MUTUAL INSURANCE COMPANY,PATRICK J WARD,KRISTI SCHLOSSER CARLSON,JOHN E WARD
North Dakote,ND,2016,"FARMERS UNION SERVICE ASSOCIATION, LTD.",KRISTI SCHLOSSER CARLSON
North Dakote,ND,2016,FIRE FIGHTERS LOCAL 642,WILLIAM BUSH,MIKE AMBROSE
North Dakote,ND,2016,GARRISON DIVERSION CONSERVANCY DISTRICT,JOHN OLSON
North Dakote,ND,2016,GENERAL MOTORS LLC,THOMAS D. KELSCH
North Dakote,ND,2016,"GERONIMO ENERGY, LLC",JUSTIN PICKAR
North Dakote,ND,2016,GILLETTE CHILDREN'S SPECIALTY HEALTHCARE,MARNIE FALK
North Dakote,ND,2016,GRAND SKY DEVELOPMENT COMPANY,CORY FONG,SHANE GOETTLE,LACEE ANDERSON
North Dakote,ND,2016,GREAT RIVER ENERGY,JOHN WEEDA,AL CHRISTIANSON,RACHEL RETTERATH
North Dakote,ND,2016,GREATER NORTH DAKOTA CHAMBER,ANDY PETERSON,JON GODFREAD
North Dakote,ND,2016,HARTLAND MUTUAL INSURANCE COMPANY,PATRICK J WARD,JOHN E WARD
North Dakote,ND,2016,"HDR ENGINEERING, INC.",JOEL GILBERTSON,LEVI ANDRIST
North Dakote,ND,2016,HEALTH POLICY CONSORTIUM,JOEL GILBERTSON,LEVI ANDRIST,DANIEL HANNAHER
North Dakote,ND,2016,HESS CORPORATION,JOEL NOYES
North Dakote,ND,2016,HOME BUILDERS ASSOCIATION OF FARGO-MOORHEAD,BRYCE JOHNSON
North Dakote,ND,2016,HORSE RACE NORTH DAKOTA,LEVI OTIS
North Dakote,ND,2016,INDEPENDENT COMMUNITY BANKS OF NORTH DAKOTA,JACK MCDONALD,BARRY HAUGEN
North Dakote,ND,2016,INDEPENDENT WATER PROVIDERS,DUANE A SAND
North Dakote,ND,2016,"INDIVIOR, PLC",ELIZABETH ARIANO
North Dakote,ND,2016,INFORMATION TECHNOLOGY COUNCIL OF NORTH DAKOTA,DEANA M WIESE
North Dakote,ND,2016,J. E. DUNN CONSTRUCTION COMPANY,THOMAS D. KELSCH
North Dakote,ND,2016,JOHN MIDDLETON CO.,JOHN OLSON,GARTH ALSTON
North Dakote,ND,2016,KLJ SOLUTIONS CO.,SANDI TABOR
North Dakote,ND,2016,"KOCH COMPANIES PUBLIC SECTOR, LLC",MATTHEW LEMKE
North Dakote,ND,2016,LABORERS LOCAL 563,PAMELA LINK
North Dakote,ND,2016,LIGNITE ENERGY COUNCIL,JASON BOHRER,TYLER HAMMAN
North Dakote,ND,2016,"LINDALE PIPELINE, LLC",ANDREW WAMBSGANSS
North Dakote,ND,2016,MARCH OF DIMES FOUNDATION,REBA MATHERN-JACOBSON
North Dakote,ND,2016,"MDU RESOURCES GROUP, INC.",CORY FONG,SHANE GOETTLE,LACEE ANDERSON
North Dakote,ND,2016,MEDICA,KATHERINE JOHANSEN
North Dakote,ND,2016,MENTAL HEALTH ADVOCACY NETWORK (MHAN),CARLOTTA MCCLEARY
North Dakote,ND,2016,MENTAL HEALTH AMERICA OF NORTH DAKOTA,CARLOTTA MCCLEARY
North Dakote,ND,2016,MINNESOTA POWER,RYAN KELLY,REBECCA KLETT,MARGARET HODNIK
North Dakote,ND,2016,MISSOURI RIVER ENERGY SERVICES,TODD D. KRANDA
North Dakote,ND,2016,MNDAK UPSTREAM COALITION,RAE ANN KELSCH
North Dakote,ND,2016,MOTION PICTURE ASSOCIATION OF AMERICA,PATRICK J WARD,JOHN E WARD
North Dakote,ND,2016,NATIONAL FEDERATION OF INDEPENDENT BUSINESS,RAE ANN KELSCH
North Dakote,ND,2016,NATIONAL RIFLE ASSOCIATION OF AMERICA,CHRISTOPHER KOPACKI
North Dakote,ND,2016,NATIONWIDE MUTUAL INSURANCE COMPANY,MARK BEHRENS,MATTHEW WATKINS,FREDERICK SCHAEFER,RANDALL KRAMER
North Dakote,ND,2016,NEXTERA ENERGY RESOURCES,JOHN OLSON
North Dakote,ND,2016,NODAK MUTUAL INSURANCE COMPANY,PATRICK J WARD,JOHN E WARD
North Dakote,ND,2016,NORTH DAKOTA AFL-CIO,WAYLON HEDEGAARD
North Dakote,ND,2016,NORTH DAKOTA AMERICAN COUNCIL OF ENGINEERING COMPANIES,BONNIE STAIGER,STACY KRUMWIEDE STAIGER
North Dakote,ND,2016,NORTH DAKOTA ASSOCIATION FOR JUSTICE,ALAN AUSTAD
North Dakote,ND,2016,"NORTH DAKOTA ASSOCIATION FOR THE DISABLED, INC.",KEN TUPA
North Dakote,ND,2016,NORTH DAKOTA ASSOCIATION OF BUILDERS,KIMBERLEE SCHNEIDER
North Dakote,ND,2016,NORTH DAKOTA ASSOCIATION OF COUNTIES RESOURCES GROUP,MARK A JOHNSON,TERRY O TRAYNOR
North Dakote,ND,2016,"NORTH DAKOTA ASSOCIATION OF COUNTIES, INC.",MARK A JOHNSON,TERRY O TRAYNOR,MARY H KORSMO,AARON BIRST,DONNELL PRESKEY
North Dakote,ND,2016,"NORTH DAKOTA ASSOCIATION OF NONPROFIT ORGANIZATIONS, INC.",MURRAY G SAGSVEEN,DANA SCHAAR JAHNER
North Dakote,ND,2016,NORTH DAKOTA ASSOCIATION OF NURSE ANESTHETISTS,KEN TUPA,BRUCE D MURRY,WILLIAM KALANEK,ERICA J CERMAK
North Dakote,ND,2016,NORTH DAKOTA ASSOCIATION OF OIL AND GAS PRODUCING COUNTIES,BRENT BOGAR
North Dakote,ND,2016,NORTH DAKOTA ASSOCIATION OF REALTORS,JILL BECK,NANCY WILLIS
North Dakote,ND,2016,NORTH DAKOTA ASSOCIATION OF RURAL ELECTRIC COOPERATIVES,DENNIS A HILL,ROBERT GRANT,ZACHARY SMITH
North Dakote,ND,2016,NORTH DAKOTA ASSOCIATION OF TELECOMMUNICATIONS COOPERATIVES,DAVID J. CROTHERS
North Dakote,ND,2016,NORTH DAKOTA ASSOCIATION OF THE BLIND,ALLAN C PETERSON
North Dakote,ND,2016,NORTH DAKOTA BANKERS ASSOCIATION,RICK CLAYBURGH,MARILYN FOSS
North Dakote,ND,2016,"NORTH DAKOTA BAR FOUNDATION, INC.",ANTHONY J WEILER
North Dakote,ND,2016,NORTH DAKOTA BEER WHOLESALERS ASSOCIATION,JANET SEAWORTH,JOEL GILBERTSON,LEVI ANDRIST
North Dakote,ND,2016,NORTH DAKOTA BREWERS GUILD,NICK D HOLWEGNER
North Dakote,ND,2016,"NORTH DAKOTA BROADCASTERS ASSOCIATION, INC.",JACK MCDONALD
North Dakote,ND,2016,NORTH DAKOTA CATHOLIC CONFERENCE,CHRSTOPHER DODSON,STACEY PFLIIGER
North Dakote,ND,2016,NORTH DAKOTA CENTER FOR NURSING,PATRICIA MOULTON
North Dakote,ND,2016,NORTH DAKOTA CORN GROWERS ASSOCIATION,JOEL GILBERTSON,LEVI ANDRIST
North Dakote,ND,2016,NORTH DAKOTA COUNCIL OF EDUCATIONAL LEADERS,RAE ANN KELSCH,AIMEE COPAS
North Dakote,ND,2016,NORTH DAKOTA DENTAL ASSOCIATION,RAE ANN KELSCH,BRENT L. HOLMAN
North Dakote,ND,2016,"NORTH DAKOTA DENTAL HYGIENISTS' ASSOCIATION, INC.",ROD ST AUBYN,RACHELLE GUSTAFSON,JUDY BERNAT
North Dakote,ND,2016,NORTH DAKOTA DISTRICT JUDGES ASSOCIATION,JACK MCDONALD
North Dakote,ND,2016,NORTH DAKOTA ETHANOL PRODUCERS ASSOCIATION,JOEL GILBERTSON
North Dakote,ND,2016,NORTH DAKOTA ETHANOL PRODUCERS ASSOCIATION,DEANA M WIESE
North Dakote,ND,2016,NORTH DAKOTA ETHANOL PRODUCERS ASSOCIATION,LEVI ANDRIST
North Dakote,ND,2016,NORTH DAKOTA FAMILY ALLIANCE,TOM D FREIER
North Dakote,ND,2016,NORTH DAKOTA FARM BUREAU,JEFFREY MISSLING,PETER F HANEBUTT
North Dakote,ND,2016,NORTH DAKOTA FARMERS UNION,KAYLA J PULVERMACHER,MARK A WATNE,KRISTI SCHLOSSER CARLSON,DANE BRAUN,ROBERT KUYLEN
North Dakote,ND,2016,NORTH DAKOTA FEDERATION OF FAMILIES FOR CHILDREN'S MENTAL HEALTH,CARLOTTA MCCLEARY
North Dakote,ND,2016,NORTH DAKOTA FUNERAL DIRECTORS ASSOCIATION,BONNIE STAIGER,STACY KRUMWIEDE STAIGER
North Dakote,ND,2016,NORTH DAKOTA GRAIN DEALERS ASSOCIATION,STUART LETCHER
North Dakote,ND,2016,NORTH DAKOTA GRAIN GROWERS ASSOCIATION,DANIEL K WOGSLAND
North Dakote,ND,2016,NORTH DAKOTA GROCERS ASSOCIATION,TOM E WOODMANSEE
North Dakote,ND,2016,NORTH DAKOTA HOSPITAL ASSOCIATION,JERRY JURENA,TIM BLASL
North Dakote,ND,2016,NORTH DAKOTA HOSPITALITY ASSOCIATION,RUDIE MARTINSON
North Dakote,ND,2016,NORTH DAKOTA IMPLEMENT DEALERS ASSOCIATION,MATTHEW LARSGAARD
North Dakote,ND,2016,NORTH DAKOTA LAND TITLE ASSOCIATION,PATRICK J WARD,JOHN E WARD
North Dakote,ND,2016,NORTH DAKOTA LEAGUE OF CITIES,JERALD A HJELMSTAD,JACK MCDONALD,R. BLAKE CROSBY
North Dakote,ND,2016,NORTH DAKOTA LONG TERM CARE ASSOCIATION,SHELLY PETERSON
North Dakote,ND,2016,NORTH DAKOTA MEDICAL ASSOCIATION,COURTNEY KOEBELE
North Dakote,ND,2016,NORTH DAKOTA MOTOR CARRIERS ASS'N INC,ARIK SPENCER
North Dakote,ND,2016,NORTH DAKOTA NEWSPAPER ASSOCIATION,JACK MCDONALD,STEVE ANDRIST
North Dakote,ND,2016,NORTH DAKOTA NURSE PRACTITIONER ASSOCIATION,CHERYL RISING
North Dakote,ND,2016,"NORTH DAKOTA OCCUPATIONAL THERAPY ASSOCIATION, INC.",JOEL GILBERTSON,LEVI ANDRIST
North Dakote,ND,2016,NORTH DAKOTA OPTOMETRIC ASSOCIATION,NANCY KOPP
North Dakote,ND,2016,"NORTH DAKOTA ORAL HEALTH COALITION, INC.",CHERYL UNDERHILL
North Dakote,ND,2016,"NORTH DAKOTA PETROLEUM COUNCIL, INC.",RON NESS,KARI CUTTING,ALEXIS BRINKMAN-BAXLEY
North Dakote,ND,2016,NORTH DAKOTA PETROLEUM MARKETERS ASSOCIATION,MIKE RUD
North Dakote,ND,2016,NORTH DAKOTA PHARMACISTS ASSOCIATION,MICHAEL D SCHWAB,STEVE BOEHNING,KYLE DEMONTIGNY
North Dakote,ND,2016,NORTH DAKOTA PHARMACY SERVICE CORPORATION,MICHAEL D SCHWAB,DAVID OLIG
North Dakote,ND,2016,"NORTH DAKOTA PHYSICAL THERAPY ASSOCIATION, INCORPORATED",JACK MCDONALD
North Dakote,ND,2016,NORTH DAKOTA PROPANE GAS ASSOCIATION,MIKE RUD
North Dakote,ND,2016,NORTH DAKOTA PSYCHIATRIC SOCIETY,COURTNEY KOEBELE
North Dakote,ND,2016,"NORTH DAKOTA RECREATION AND PARKS ASSOCIATION, INC.",DANA SCHAAR JAHNER
North Dakote,ND,2016,NORTH DAKOTA RETAIL ASSOCIATION,MIKE RUD
North Dakote,ND,2016,NORTH DAKOTA RETIRED TEACHERS ASSOCIATION,KEN TUPA,BRUCE D MURRY,WILLIAM KALANEK,ERICA J CERMAK
North Dakote,ND,2016,NORTH DAKOTA RIGHT TO LIFE ASSOCIATION,BROCK SCHMELING
North Dakote,ND,2016,"NORTH DAKOTA RURAL WATER SYSTEMS ASSOCIATION, INC.",ERIC VOLK
North Dakote,ND,2016,NORTH DAKOTA SCHOOL BOARDS ASSOCIATION,L. ANITA THOMAS
North Dakote,ND,2016,NORTH DAKOTA SOCIETY FOR RESPIRATORY CARE,JACK MCDONALD
North Dakote,ND,2016,"NORTH DAKOTA SOYBEAN GROWERS ASSOCIATION, INC.",JOEL GILBERTSON,SCOTT RISING,LEVI ANDRIST
North Dakote,ND,2016,NORTH DAKOTA STATE BOARD OF ARCHITECTURE,BONNIE STAIGER,STACY KRUMWIEDE STAIGER
North Dakote,ND,2016,NORTH DAKOTA STOCKMEN'S ASSOCIATION,JULIE ELLINGSON
North Dakote,ND,2016,NORTH DAKOTA UNITED,CHAD OBAN
North Dakote,ND,2016,NORTH DAKOTA VETERINARY MEDICAL ASSOCIATION,NANCY KOPP
North Dakote,ND,2016,NORTH DAKOTA WILDLIFE FEDERATION,MICHAEL J DONAHUE
North Dakote,ND,2016,NORTH DAKOTA WOMEN'S NETWORK,RENEE STROMME
North Dakote,ND,2016,NORTHWEST LANDOWNERS ASSOCIATION,MYRON HANSON,THOMAS WHEELER,ROBERT N GRANT,GALAN PETERSON,TROY COONS
North Dakote,ND,2016,NOVARTIS PHARMACEUTICALS CORPORATION,DEE DODGE GEORGE
North Dakote,ND,2016,NU MARK LLC,JOHN OLSON,GARTH ALSTON
North Dakote,ND,2016,"ONEOK, INC.",DANETTE WELSH
North Dakote,ND,2016,OTTER TAIL CORPORATION,JOHN OLSON,LOREN LAUGTUG,MARK BRING,JEREMY RHAM
North Dakote,ND,2016,OTTER TAIL POWER COMPANY,JOHN OLSON,LOREN LAUGTUG,MARK BRING,JEREMY RHAM
North Dakote,ND,2016,PFIZER INC.,KEN TUPA,BRUCE D MURRY,WILLIAM KALANEK,ERICA J CERMAK
North Dakote,ND,2016,PHARMACEUTICAL CARE MANAGEMENT ASSOCIATION (PCMA),ROD ST AUBYN
North Dakote,ND,2016,PHARMACEUTICAL RESEARCH AND MANUFACTURERS OF AMERICA,JOEL GILBERTSON,LEVI ANDRIST
North Dakote,ND,2016,PHILIP MORRIS USA INC.,JOHN OLSON,GARTH ALSTON
North Dakote,ND,2016,"PRAIRIE PUBLIC BROADCASTING, INC.",JACK MCDONALD
North Dakote,ND,2016,PREVENT CHILD ABUSE NORTH DAKOTA,SANDRA TIBKE
North Dakote,ND,2016,PRIME THERAPEUTICS LLC,JACK MCDONALD,DAVID ROOT,ABIGAIL STODDARD
North Dakote,ND,2016,PROFESSIONAL SOIL CLASSIFIERS ASSOCIATION OF NORTH DAKOTA,JACK MCDONALD
North Dakote,ND,2016,PROPERTY CASUALTY INSURERS ASSOCIATION OF AMERICA,PATRICK J WARD,JOHN E WARD
North Dakote,ND,2016,"QEP RESOURCES, INC.",KELLEY HUEMOELLER
North Dakote,ND,2016,RAI SERVICES COMPANY,RAE ANN KELSCH,ALLAN STENEHJEM
North Dakote,ND,2016,SAKAKAWEA MEDICAL CENTER,DARROLD BERTSCH
North Dakote,ND,2016,SANFORD HEALTH,JOHN OLSON,JOEL GILBERTSON,CRAIG LAMBRECHT,LEVI ANDRIST,MARNIE WALTH,DANIEL HANNAHER
North Dakote,ND,2016,SANFORD HEALTH PLAN,LISA CARLSON
North Dakote,ND,2016,SISTERS OF MARY OF THE PRESENTATION HEALTH SYSTEM,SR MARGARET ROSE PFEIFER
North Dakote,ND,2016,SMART TRANSPORTATION DIVISION,JIM CHASE
North Dakote,ND,2016,SOERGEL GROUP INC.,DAVID SOERGEL
North Dakote,ND,2016,STATE ASSOCIATION OF NON PUBLIC SCHOOLS,ROD BACKMAN
North Dakote,ND,2016,STATE BAR ASSOCIATION OF NORTH DAKOTA,ANTHONY J WEILER
North Dakote,ND,2016,STATE FARM INSURANCE COMPANIES,PATRICK J WARD,JOHN E WARD
North Dakote,ND,2016,STATE HISTORICAL SOCIETY OF NORTH DAKOTA,GINA BUCHHOLTZ,VIRGINIA A NELSEN,JON MCMILLAN,MARLO SVEEN,KARL LEMBKE
North Dakote,ND,2016,SUNOVION PHARMACEUTICALS INC.,NANCY MCKEE
North Dakote,ND,2016,SURETY LIFE AND CASUALTY INSURANCE COMPANY,PATRICK J WARD,JOHN E WARD
North Dakote,ND,2016,TARGA RESOURCES CORP,JOEL GILBERTSON,LEVI ANDRIST
North Dakote,ND,2016,TEACHERS INSURANCE AND ANNUITY ASSOCIATION (TIAA),RODERICK CRANE,MARTIN NOVEN
North Dakote,ND,2016,THE ARC OF BISMARCK,NICOLE PESKE
North Dakote,ND,2016,"THE ARC OF NORTH DAKOTA, INC.",NICOLE PESKE
North Dakote,ND,2016,THE COLLEGE BOARD,ASHLEY GIBSON
North Dakote,ND,2016,THE HUMANE SOCIETY OF THE UNITED STATES,TJ JERKE
North Dakote,ND,2016,THE NORTH DAKOTA COUNTY COMMISSIONER'S ASSOCIATION INCORPORATED,MARK A JOHNSON,TERRY O TRAYNOR,AARON BIRST,DONNELL PRESKEY
North Dakote,ND,2016,"THE NORTH DAKOTA HUMANITIES COUNCIL, INCORPORATED",STACY SCHAFFER,BRENNA GERHARDT
North Dakote,ND,2016,THE NORTH DAKOTA PSYCHOLOGICAL ASSOCIATION,BONNIE STAIGER,STACY KRUMWIEDE STAIGER
North Dakote,ND,2016,THE PEW CHARITABLE TRUSTS,JOEL GILBERTSON,CORY FONG,LEVI ANDRIST,SHANE GOETTLE,NATHAN MYSZKA
North Dakote,ND,2016,THE STAIGER CONSULTING GROUP,BONNIE STAIGER,STACY KRUMWIEDE STAIGER
North Dakote,ND,2016,THEODORE ROOSEVELT EXPRESSWAY ASSOCIATION,CAL KLEWIN
North Dakote,ND,2016,TRANSCANADA CORPORATION,TODD D. KRANDA
North Dakote,ND,2016,U.S. SMOKELESS TOBACCO CO,JOHN OLSON,GARTH ALSTON
North Dakote,ND,2016,UBER TECHNOLOGIES INC,SAGAR SHAH
North Dakote,ND,2016,UNIVERSITY OF JAMESTOWN,ROD BACKMAN
North Dakote,ND,2016,UNIVERSITY OF MARY,ROD BACKMAN
North Dakote,ND,2016,UTILITY SHAREHOLDERS OF NORTH DAKOTA,CARLEE MCLEOD
North Dakote,ND,2016,VALLEY PROSPERITY PARTNERSHIP,JOEL GILBERTSON,LEVI ANDRIST
North Dakote,ND,2016,"VERENDRYE ELECTRIC COOPERATIVE, INC.",TOM RAFFERTY
North Dakote,ND,2016,VERIZON COMMUNICATIONS,TODD D. KRANDA
North Dakote,ND,2016,"WAL-MART STORES, INC.",LISA NELSON
North Dakote,ND,2016,"WASTE MANAGEMENT OF NORTH DAKOTA, INC.",TODD D. KRANDA
North Dakote,ND,2016,"WITT O'BRIEN'S, LLC",CORY FONG,SHANE GOETTLE,LACEE ANDERSON
North Dakote,ND,2016,XCEL ENERGY INC.,KATHLEEN A. AAS,MARK R. NISBET
North Dakote,ND,2016,"XEROX BUSINESS SERVICES, LLC",ROD BACKMAN
North Dakote,ND,2016,YMCAS OF NORTH DAKOTA,JACK MCDONALD
North Dakote,ND,2016,3M COMPANY,THOMAS D. KELSCH
North Dakote,ND,2016,AARP GOVERNMENT AFFAIRS,ELAINE RYAN
North Dakote,ND,2016,AARP NORTH DAKOTA,MICHAEL J TOMASKO,DOREEN RIEDMAN,JANIS CHENEY,JOSH ASKVIG,LYLE HALVORSON,BEAU CUMMINGS
North Dakote,ND,2016,"ACT ASPIRE, LLC",JIM MORRIS
North Dakote,ND,2016,"ACT, INC.",TAMARA IBACH
North Dakote,ND,2016,"ADVANCED ENGINEERING AND ENVIRONMENTAL SERVICES, INC.",STEVE L BURIAN,ROCKY T SCHNEIDER,CORY CHORNE,LOREN HOFFMAN,CHARLES VEIN
North Dakote,ND,2016,AFLAC,PATRICK J WARD,JOHN E WARD
North Dakote,ND,2016,AIA NORTH DAKOTA,BONNIE STAIGER,STACY KRUMWIEDE STAIGER
North Dakote,ND,2016,"ALLETE, INC.",MARGARET HODNIK
North Dakote,ND,2016,ALLIANCE OF AUTOMOBILE MANUFACTURERS,JOEL GILBERTSON,LEVI ANDRIST
North Dakote,ND,2016,ALLIANCE PIPELINE INC.,TODD D. KRANDA
North Dakote,ND,2016,ALLSTATE INSURANCE COMPANY,PATRICK J WARD,JOHN E WARD
North Dakote,ND,2016,"ALZHEIMER'S DISEASE AND RELATED DISORDERS ASSOCIATION, INC.",ERICA J CERMAK,NIKKI HEINERT
North Dakote,ND,2016,AMAZON.COM,JOEL GILBERTSON,LEVI ANDRIST
North Dakote,ND,2016,AMERICA'S HEALTH INSURANCE PLANS,JACK MCDONALD
North Dakote,ND,2016,"AMERICAN CANCER SOCIETY CANCER ACTION NETWORK, INC.",DEBORAH J KNUTH
North Dakote,ND,2016,"AMERICAN CIVIL LIBERTIES UNION, INC.",JENNIFER COOK
North Dakote,ND,2016,AMERICAN COUNCIL OF LIFE INSURANCE,JOEL GILBERTSON,LEVI ANDRIST
North Dakote,ND,2016,AMERICAN EXPRESS COMPANY,JOEL GILBERTSON,LEVI ANDRIST
North Dakote,ND,2016,"AMERICAN HEART ASSOCIATION, DAKOTA AFFILIATE, INC.",BONNIE STAIGER,STACY KRUMWIEDE STAIGER
North Dakote,ND,2016,AMERICAN INTERNATIONAL GROUP INC,JOEL GILBERTSON,LEVI ANDRIST
North Dakote,ND,2016,AMERICAN LUNG ASSOCIATION,KRISTIE WOLFF
North Dakote,ND,2016,ANNE CARLSEN CENTER,JOEL GILBERTSON,ERIC M. MONSON,LEVI ANDRIST
North Dakote,ND,2016,"APT, INC.",KEN TUPA,BRUCE D MURRY,WILLIAM KALANEK,ERICA J CERMAK
North Dakote,ND,2016,ARCHER DANIELS MIDLAND COMPANY,GREGORY WEBB
North Dakote,ND,2016,ASSOCIATED BUILDERS AND CONTRACTORS OF MN/ND,BRENDA ELMER
North Dakote,ND,2016,ASSOCIATED GENERAL CONTRACTORS OF NORTH DAKOTA,RUSSELL L HANSON,MARK DOUGHERTY
North Dakote,ND,2016,ASSOCIATION FOR PUBLIC EMPLOYEES,KEN TUPA,BRUCE D MURRY,WILLIAM KALANEK,ERICA J CERMAK
North Dakote,ND,2016,ASSOCIATION OF NORTH DAKOTA INSURERS,PATRICK J WARD,JOHN E WARD
North Dakote,ND,2016,AT&T,JOEL GILBERTSON,LEVI ANDRIST,CHERYL RILEY
North Dakote,ND,2016,"AUTO CLUB SERVICES, INC.",EUGENE LADOUCER
North Dakote,ND,2016,AUTOMOBILE DEALERS ASSOCIATION OF NORTH DAKOTA,MATTHEW LARSGAARD
North Dakote,ND,2016,AUX SABLE MIDSTREAM LLC,TODD D. KRANDA
North Dakote,ND,2016,"BADLANDS NGL'S, LLC",CORY FONG,SHANE GOETTLE,LACEE ANDERSON
North Dakote,ND,2016,BASIN COOPERATIVE SERVICES,STEVE TOMAC,DALE NIEZWAAG,MIKE EGGL,CHRISTOPHER VANDEVENTER,JEAN SCHAFER
North Dakote,ND,2016,BASIN ELECTRIC POWER COOPERATIVE,STEVE TOMAC,DALE NIEZWAAG,MIKE EGGL,CHRISTOPHER VANDEVENTER,JEAN SCHAFER
North Dakote,ND,2016,"BASIN TELECOMMUNICATIONS, INC.",STEVE TOMAC,DALE NIEZWAAG,MIKE EGGL,CHRISTOPHER VANDEVENTER,JEAN SCHAFER
North Dakote,ND,2016,BAYER CORPORATION,CRAIG MISCHO
North Dakote,ND,2016,"BEYOND SHELTER, INC.",DANIEL MADLER
North Dakote,ND,2016,BIOSCIENCE ASSOCIATION OF NORTH DAKOTA,JOEL GILBERTSON,LEVI ANDRIST
North Dakote,ND,2016,BIOTECHNOLOGY INDUSTRY ORGANIZATION,JOEL GILBERTSON,LEVI ANDRIST
North Dakote,ND,2016,BISMARCK-MANDAN AREA CHAMBER OF COMMERCE,KELVIN L HULLET
North Dakote,ND,2016,"BISMARCK-MANDAN HOME BUILDERS ASSOCIATION, INC.",DOT FRANK
North Dakote,ND,2016,BLUE CROSS BLUE SHIELD OF NORTH DAKOTA,PAM GULLESON,JACK MCDONALD,MEGAN HOUN
North Dakote,ND,2016,"BNI COAL, LTD.",RYAN KELLY,REBECCA KLETT,MARGARET HODNIK
North Dakote,ND,2016,BNSF RAILWAY COMPANY,JOHN OLSON
North Dakote,ND,2016,BOBCAT COMPANY,CORY FONG,SHANE GOETTLE,LACEE ANDERSON
North Dakote,ND,2016,BOTTINEAU ECONOMIC DEVELOPMENT CORPORATION,NICOLLETTE R WEISSMAN
North Dakote,ND,2016,BRISTOL-MYERS SQUIBB COMPANY,JOHN MARCHANT
North Dakote,ND,2016,CASS COUNTY ELECTRIC COOPERATIVE INC.,SCOTT HANDY,MARSHAL ALBRIGHT
North Dakote,ND,2016,CAWS NORTH DAKOTA,JANELLE MOOS
North Dakote,ND,2016,CENTER MUTUAL INSURANCE COMPANY,PATRICK J WARD,JOHN E WARD
North Dakote,ND,2016,CENTURY LINK,KENT BLICKENSDERFER
North Dakote,ND,2016,CHARITABLE GAMING ASSOCIATION OF NORTH DAKOTA,TODD D. KRANDA
North Dakote,ND,2016,CHS,JACOB HAMLIN
North Dakote,ND,2016,CITY OF HARVEY,NICOLLETTE R WEISSMAN
North Dakote,ND,2016,CITY OF MINOT,SHANE GOETTLE
North Dakote,ND,2016,CITY OF WILLISTON,JOEL GILBERTSON
North Dakote,ND,2016,COMMUNITY HEALTHCARE ASSOCIATION OF THE DAKOTAS,DANA SCHAAR JAHNER
North Dakote,ND,2016,"COMMUNITY OPTIONS FOR RESIDENTIAL AND EMPLOYMENT SERVICES, INC.",TRINA FAY GRESS
North Dakote,ND,2016,CONSUMER AND FAMILY NETWORK (CFN),CARLOTTA MCCLEARY
North Dakote,ND,2016,"CONTINENTAL RESOURCES, INC.",BLU HULSEY,JAMES ROGER KELLEY
North Dakote,ND,2016,CONVENTION OF STATES ACTION,DAVID SCHNEIDER
North Dakote,ND,2016,CORRECTIONS CORPORATION OF AMERICA,JERRY LANKFORD
North Dakote,ND,2016,CREDIT UNION ASSOCIATION OF THE DAKOTAS,JEFFREY OLSON
North Dakote,ND,2016,CREDIT UNION ASSOCIATION OF THE DAKOTAS,GREGORY TSCHIDER
North Dakote,ND,2016,CYSTIC FIBROSIS ASSOCIATION OF NORTH DAKOTA,KENNETH KARLS
North Dakote,ND,2016,DAKOTA COAL COMPANY,STEVE TOMAC,DALE NIEZWAAG,MIKE EGGL,CHRISTOPHER VANDEVENTER,JEAN SCHAFER
North Dakote,ND,2016,DAKOTA GASIFICATION COMPANY,STEVE TOMAC,DALE NIEZWAAG,MIKE EGGL,CHRISTOPHER VANDEVENTER,JEAN SCHAFER
North Dakote,ND,2016,"DESIGNER GENES OF NORTH DAKOTA, INC.",ROXANE ROMANICK
North Dakote,ND,2016,"DUCKS UNLIMITED, INC.",CARMEN MILLER,ERIC LINDSTROM,MICHAEL FINDLAY
North Dakote,ND,2016,ECONOMIC DEVELOPMENT ASSOCIATION OF NORTH DAKOTA,DANA L BOHN,KEITH LUND,CONNIE OVA,ELLEN HUBER
North Dakote,ND,2016,ELI LILLY AND COMPANY,SUSAN LANDWEHR
North Dakote,ND,2016,ELLINGSON COMPANIES,LEVI OTIS
North Dakote,ND,2016,EMPLOYERS MUTUAL CASUALTY COMPANY,PATRICK J WARD,JOHN E WARD
