North Dakote,ND,2016,NORTH DAKOTA ETHANOL PRODUCERS ASSOCIATION,DEANA M WIESE
North Dakote,ND,2016,NORTH DAKOTA ETHANOL PRODUCERS ASSOCIATION,LEVI ANDRIST
North Dakote,ND,2016,NORTH DAKOTA FAMILY ALLIANCE,TOM D FREIER
North Dakote,ND,2016,NORTH DAKOTA FARM BUREAU,JEFFREY MISSLING,PETER F HANEBUTT
North Dakote,ND,2016,NORTH DAKOTA FARMERS UNION,KAYLA J PULVERMACHER,MARK A WATNE,KRISTI SCHLOSSER CARLSON,DANE BRAUN,ROBERT KUYLEN
North Dakote,ND,2016,NORTH DAKOTA FEDERATION OF FAMILIES FOR CHILDREN'S MENTAL HEALTH,CARLOTTA MCCLEARY
North Dakote,ND,2016,NORTH DAKOTA FUNERAL DIRECTORS ASSOCIATION,BONNIE STAIGER,STACY KRUMWIEDE STAIGER
North Dakote,ND,2016,NORTH DAKOTA GRAIN DEALERS ASSOCIATION,STUART LETCHER
North Dakote,ND,2016,NORTH DAKOTA GRAIN GROWERS ASSOCIATION,DANIEL K WOGSLAND
North Dakote,ND,2016,NORTH DAKOTA GROCERS ASSOCIATION,TOM E WOODMANSEE
North Dakote,ND,2016,NORTH DAKOTA HOSPITAL ASSOCIATION,JERRY JURENA,TIM BLASL
North Dakote,ND,2016,NORTH DAKOTA HOSPITALITY ASSOCIATION,RUDIE MARTINSON
North Dakote,ND,2016,NORTH DAKOTA IMPLEMENT DEALERS ASSOCIATION,MATTHEW LARSGAARD
North Dakote,ND,2016,NORTH DAKOTA LAND TITLE ASSOCIATION,PATRICK J WARD,JOHN E WARD
North Dakote,ND,2016,NORTH DAKOTA LEAGUE OF CITIES,JERALD A HJELMSTAD,JACK MCDONALD,R. BLAKE CROSBY
North Dakote,ND,2016,NORTH DAKOTA LONG TERM CARE ASSOCIATION,SHELLY PETERSON
North Dakote,ND,2016,NORTH DAKOTA MEDICAL ASSOCIATION,COURTNEY KOEBELE
North Dakote,ND,2016,NORTH DAKOTA MOTOR CARRIERS ASS'N INC,ARIK SPENCER
North Dakote,ND,2016,NORTH DAKOTA NEWSPAPER ASSOCIATION,JACK MCDONALD,STEVE ANDRIST
North Dakote,ND,2016,NORTH DAKOTA NURSE PRACTITIONER ASSOCIATION,CHERYL RISING
North Dakote,ND,2016,"NORTH DAKOTA OCCUPATIONAL THERAPY ASSOCIATION, INC.",JOEL GILBERTSON,LEVI ANDRIST
North Dakote,ND,2016,NORTH DAKOTA OPTOMETRIC ASSOCIATION,NANCY KOPP
North Dakote,ND,2016,"NORTH DAKOTA ORAL HEALTH COALITION, INC.",CHERYL UNDERHILL
North Dakote,ND,2016,"NORTH DAKOTA PETROLEUM COUNCIL, INC.",RON NESS,KARI CUTTING,ALEXIS BRINKMAN-BAXLEY
North Dakote,ND,2016,NORTH DAKOTA PETROLEUM MARKETERS ASSOCIATION,MIKE RUD
North Dakote,ND,2016,NORTH DAKOTA PHARMACISTS ASSOCIATION,MICHAEL D SCHWAB,STEVE BOEHNING,KYLE DEMONTIGNY
North Dakote,ND,2016,NORTH DAKOTA PHARMACY SERVICE CORPORATION,MICHAEL D SCHWAB,DAVID OLIG
North Dakote,ND,2016,"NORTH DAKOTA PHYSICAL THERAPY ASSOCIATION, INCORPORATED",JACK MCDONALD
North Dakote,ND,2016,NORTH DAKOTA PROPANE GAS ASSOCIATION,MIKE RUD
North Dakote,ND,2016,NORTH DAKOTA PSYCHIATRIC SOCIETY,COURTNEY KOEBELE
North Dakote,ND,2016,"NORTH DAKOTA RECREATION AND PARKS ASSOCIATION, INC.",DANA SCHAAR JAHNER
North Dakote,ND,2016,NORTH DAKOTA RETAIL ASSOCIATION,MIKE RUD
North Dakote,ND,2016,NORTH DAKOTA RETIRED TEACHERS ASSOCIATION,KEN TUPA,BRUCE D MURRY,WILLIAM KALANEK,ERICA J CERMAK
North Dakote,ND,2016,NORTH DAKOTA RIGHT TO LIFE ASSOCIATION,BROCK SCHMELING
North Dakote,ND,2016,"NORTH DAKOTA RURAL WATER SYSTEMS ASSOCIATION, INC.",ERIC VOLK
North Dakote,ND,2016,NORTH DAKOTA SCHOOL BOARDS ASSOCIATION,L. ANITA THOMAS
North Dakote,ND,2016,NORTH DAKOTA SOCIETY FOR RESPIRATORY CARE,JACK MCDONALD
North Dakote,ND,2016,"NORTH DAKOTA SOYBEAN GROWERS ASSOCIATION, INC.",JOEL GILBERTSON,SCOTT RISING,LEVI ANDRIST
North Dakote,ND,2016,NORTH DAKOTA STATE BOARD OF ARCHITECTURE,BONNIE STAIGER,STACY KRUMWIEDE STAIGER
North Dakote,ND,2016,NORTH DAKOTA STOCKMEN'S ASSOCIATION,JULIE ELLINGSON
North Dakote,ND,2016,NORTH DAKOTA UNITED,CHAD OBAN
North Dakote,ND,2016,NORTH DAKOTA VETERINARY MEDICAL ASSOCIATION,NANCY KOPP
North Dakote,ND,2016,NORTH DAKOTA WILDLIFE FEDERATION,MICHAEL J DONAHUE
North Dakote,ND,2016,NORTH DAKOTA WOMEN'S NETWORK,RENEE STROMME
North Dakote,ND,2016,NORTHWEST LANDOWNERS ASSOCIATION,MYRON HANSON,THOMAS WHEELER,ROBERT N GRANT,GALAN PETERSON,TROY COONS
North Dakote,ND,2016,NOVARTIS PHARMACEUTICALS CORPORATION,DEE DODGE GEORGE
North Dakote,ND,2016,NU MARK LLC,JOHN OLSON,GARTH ALSTON
North Dakote,ND,2016,"ONEOK, INC.",DANETTE WELSH
North Dakote,ND,2016,OTTER TAIL CORPORATION,JOHN OLSON,LOREN LAUGTUG,MARK BRING,JEREMY RHAM
North Dakote,ND,2016,OTTER TAIL POWER COMPANY,JOHN OLSON,LOREN LAUGTUG,MARK BRING,JEREMY RHAM
North Dakote,ND,2016,PFIZER INC.,KEN TUPA,BRUCE D MURRY,WILLIAM KALANEK,ERICA J CERMAK
North Dakote,ND,2016,PHARMACEUTICAL CARE MANAGEMENT ASSOCIATION (PCMA),ROD ST AUBYN
North Dakote,ND,2016,PHARMACEUTICAL RESEARCH AND MANUFACTURERS OF AMERICA,JOEL GILBERTSON,LEVI ANDRIST
North Dakote,ND,2016,PHILIP MORRIS USA INC.,JOHN OLSON,GARTH ALSTON
North Dakote,ND,2016,"PRAIRIE PUBLIC BROADCASTING, INC.",JACK MCDONALD
North Dakote,ND,2016,PREVENT CHILD ABUSE NORTH DAKOTA,SANDRA TIBKE
North Dakote,ND,2016,PRIME THERAPEUTICS LLC,JACK MCDONALD,DAVID ROOT,ABIGAIL STODDARD
North Dakote,ND,2016,PROFESSIONAL SOIL CLASSIFIERS ASSOCIATION OF NORTH DAKOTA,JACK MCDONALD
North Dakote,ND,2016,PROPERTY CASUALTY INSURERS ASSOCIATION OF AMERICA,PATRICK J WARD,JOHN E WARD
North Dakote,ND,2016,"QEP RESOURCES, INC.",KELLEY HUEMOELLER
North Dakote,ND,2016,RAI SERVICES COMPANY,RAE ANN KELSCH,ALLAN STENEHJEM
North Dakote,ND,2016,SAKAKAWEA MEDICAL CENTER,DARROLD BERTSCH
North Dakote,ND,2016,SANFORD HEALTH,JOHN OLSON,JOEL GILBERTSON,CRAIG LAMBRECHT,LEVI ANDRIST,MARNIE WALTH,DANIEL HANNAHER
North Dakote,ND,2016,SANFORD HEALTH PLAN,LISA CARLSON
North Dakote,ND,2016,SISTERS OF MARY OF THE PRESENTATION HEALTH SYSTEM,SR MARGARET ROSE PFEIFER
North Dakote,ND,2016,SMART TRANSPORTATION DIVISION,JIM CHASE
North Dakote,ND,2016,SOERGEL GROUP INC.,DAVID SOERGEL
North Dakote,ND,2016,STATE ASSOCIATION OF NON PUBLIC SCHOOLS,ROD BACKMAN
North Dakote,ND,2016,STATE BAR ASSOCIATION OF NORTH DAKOTA,ANTHONY J WEILER
North Dakote,ND,2016,STATE FARM INSURANCE COMPANIES,PATRICK J WARD,JOHN E WARD
North Dakote,ND,2016,STATE HISTORICAL SOCIETY OF NORTH DAKOTA,GINA BUCHHOLTZ,VIRGINIA A NELSEN,JON MCMILLAN,MARLO SVEEN,KARL LEMBKE
North Dakote,ND,2016,SUNOVION PHARMACEUTICALS INC.,NANCY MCKEE
North Dakote,ND,2016,SURETY LIFE AND CASUALTY INSURANCE COMPANY,PATRICK J WARD,JOHN E WARD
North Dakote,ND,2016,TARGA RESOURCES CORP,JOEL GILBERTSON,LEVI ANDRIST
North Dakote,ND,2016,TEACHERS INSURANCE AND ANNUITY ASSOCIATION (TIAA),RODERICK CRANE,MARTIN NOVEN
North Dakote,ND,2016,THE ARC OF BISMARCK,NICOLE PESKE
North Dakote,ND,2016,"THE ARC OF NORTH DAKOTA, INC.",NICOLE PESKE
North Dakote,ND,2016,THE COLLEGE BOARD,ASHLEY GIBSON
North Dakote,ND,2016,THE HUMANE SOCIETY OF THE UNITED STATES,TJ JERKE
North Dakote,ND,2016,THE NORTH DAKOTA COUNTY COMMISSIONER'S ASSOCIATION INCORPORATED,MARK A JOHNSON,TERRY O TRAYNOR,AARON BIRST,DONNELL PRESKEY
North Dakote,ND,2016,"THE NORTH DAKOTA HUMANITIES COUNCIL, INCORPORATED",STACY SCHAFFER,BRENNA GERHARDT
North Dakote,ND,2016,THE NORTH DAKOTA PSYCHOLOGICAL ASSOCIATION,BONNIE STAIGER,STACY KRUMWIEDE STAIGER
North Dakote,ND,2016,THE PEW CHARITABLE TRUSTS,JOEL GILBERTSON,CORY FONG,LEVI ANDRIST,SHANE GOETTLE,NATHAN MYSZKA
North Dakote,ND,2016,THE STAIGER CONSULTING GROUP,BONNIE STAIGER,STACY KRUMWIEDE STAIGER
North Dakote,ND,2016,THEODORE ROOSEVELT EXPRESSWAY ASSOCIATION,CAL KLEWIN
North Dakote,ND,2016,TRANSCANADA CORPORATION,TODD D. KRANDA
North Dakote,ND,2016,U.S. SMOKELESS TOBACCO CO,JOHN OLSON,GARTH ALSTON
North Dakote,ND,2016,UBER TECHNOLOGIES INC,SAGAR SHAH
North Dakote,ND,2016,UNIVERSITY OF JAMESTOWN,ROD BACKMAN
North Dakote,ND,2016,UNIVERSITY OF MARY,ROD BACKMAN
North Dakote,ND,2016,UTILITY SHAREHOLDERS OF NORTH DAKOTA,CARLEE MCLEOD
North Dakote,ND,2016,VALLEY PROSPERITY PARTNERSHIP,JOEL GILBERTSON,LEVI ANDRIST
North Dakote,ND,2016,"VERENDRYE ELECTRIC COOPERATIVE, INC.",TOM RAFFERTY
North Dakote,ND,2016,VERIZON COMMUNICATIONS,TODD D. KRANDA
North Dakote,ND,2016,"WAL-MART STORES, INC.",LISA NELSON
North Dakote,ND,2016,"WASTE MANAGEMENT OF NORTH DAKOTA, INC.",TODD D. KRANDA
North Dakote,ND,2016,"WITT O'BRIEN'S, LLC",CORY FONG,SHANE GOETTLE,LACEE ANDERSON
North Dakote,ND,2016,XCEL ENERGY INC.,KATHLEEN A. AAS,MARK R. NISBET
North Dakote,ND,2016,"XEROX BUSINESS SERVICES, LLC",ROD BACKMAN
North Dakote,ND,2016,YMCAS OF NORTH DAKOTA,JACK MCDONALD
