South Dakota,SD,2015,AMERICAN CANCER SOCIETY CANCER ACTION NETWORK,1834.9799999999996,MATT KROGMAN,DEAN KROGMAN,DAVID BENSON
South Dakota,SD,2015,SOUTH DAKOTA FEDERATION,0.0,RACHELLE NORBERG
South Dakota,SD,2015,SOUTH DAKOTA CHAPTER AMERICAN PHYSICAL THERAPY ASSOCIATION,0.0,TIM DOUGHERTY
South Dakota,SD,2015,SOUTH DAKOTA LIVESTOCK AUCTION MARKETS ASSOCIATION,480.0,ROBERT RITER,MARGO NORTHRUP
South Dakota,SD,2015,DE SMET FARM MUTUAL INSURANCE COMPANY OF SOUTH DAK,3004.0,JASON GLODT,MIKE SHAW,WILLIAM POPPEN,ROBERT GRAY,DOUG ABRAHAM
South Dakota,SD,2015,LAKE AREA TECHNICAL INSTITUTE,0.0,RICHARD TIESZEN,WADE FISCHER
South Dakota,SD,2015,"CITIBANK, N.A.",0.0,TIM DOUGHERTY
South Dakota,SD,2015,SOUTH DAKOTA BIOTECHNOLOGY ASSOCIATION,1418.27,JONI JOHNSON
South Dakota,SD,2015,"EAST RIVER ELECTRIC POWER COOPERATIVE, INC",0.0,CHRIS STUDER,ROBERT SAHR
South Dakota,SD,2015,SOUTH DAKOTA FARMERS UNION,0.0,PAUL DENNERT,MATT SIBLEY
South Dakota,SD,2015,ABERDEEN DEVELOPMENT CORPORATION,0.0,MICHAEL BOCKORNY
South Dakota,SD,2015,WELLMARK BLUE CROSS AND BLUE SHIELD,0.0,FRANK STORK,JUSTIN SMITH,DARLA POLLMAN ROGERS
South Dakota,SD,2015,VERMILLION BASIN WATER DEVELOPMENT DISTRICT ,0.0,BRAD PREHEIM
South Dakota,SD,2015,SOUTH DAKOTA LIBRARY ASSOCIATION,0.0,JIM HOOD
South Dakota,SD,2015,M.G. OIL COMPANY,0.0,LARRY MANN
South Dakota,SD,2015,SOUTH DAKOTA WHEAT,0.0,BRIDGER ASSMAN
South Dakota,SD,2015,SOUTH DAKOTA ASSOCIATION OF RURAL WATER SYSTEMS INC,0.0,DENNIS DAVIS
South Dakota,SD,2015,SOUTH DAKOTA ASSOCIATION OF COOPERATIVES,0.0,BRENDA FORMAN
South Dakota,SD,2015,MINNEHAHA COUNTY HIGHWAY DEPARTMENT,10.0,DJ BUTHE
South Dakota,SD,2015,SOUTH DAKOTA HIGH SCHOOL ACTIVITIES ASSOCIATION,396.15999999999997,LINDSEY RITER-RAPP
South Dakota,SD,2015,SOUTH DAKOTA STATE FEDERATION OF LABOR AFL-CIO,0.0,MARK ANDERSON
South Dakota,SD,2015,ASSOCIATED SCHOOL BOARDS OF SOUTH DAKOTA,0.0,RICHARD TIESZEN,WADE POGANY,WADE FISCHER
South Dakota,SD,2015,SOUTH DAKOTA BREASTFEEDING COALITION,0.0,MOLLY MEEHAN-RASBY
South Dakota,SD,2015,CONCERNED WOMEN FOR AMERICA LEGISLATIVE ACTION COM,0.0,LINDA SCHAUER,TERRI JORGENSON,CINDY FLAKOLL
South Dakota,SD,2015,CATHOLIC DIOCESE OF SIOUX FALLS,0.0,TRAVIS BENSON,KELLY BENSON
South Dakota,SD,2015,SOUTH DAKOTA WIND ENERGY ASSOCIATION,0.0,PAUL BACHMAN
South Dakota,SD,2015,SOUTH DAKOTA UNITED SCHOOL ASSOCIATION,2802.0,MITCH RICHTER
South Dakota,SD,2015,SOUTH DAKOTA TRIAL LAWYERS ASSOCIATION,5885.76,ROGER TELLINGHUISEN
South Dakota,SD,2015,SD WILDLIFE FEDERATION CAMO COALITION,0.0,DAVID NAUMAN,CHRIS HESLA
South Dakota,SD,2015,GROTON AREA FIRE PROTECTION & RESCUE,8992.25,KARI BARTLING
South Dakota,SD,2015,WESTERN SOUTH DAKOTA RURAL ELECTRIC COOPERATIVES,553.42,KEN WETZ
South Dakota,SD,2015,WESTERN DAKOTA TECHNICAL INSTITUTE,0.0,RICHARD TIESZEN,WADE FISCHER
South Dakota,SD,2015,SOUTH DAKOTA EMERGENCY MEDICAL SERVICES ASSN. ,456.99,MAYNARD KONECHNE
South Dakota,SD,2015,ROSEBUD ,0.0,MATO  STANDING HIGH
South Dakota,SD,2015,DAKOTACARE,6548.080000000002,PHARM. D. WEISS,DREW DUNCAN,DENNIS DUNCAN,M.D. AMUNDSON
South Dakota,SD,2015,AMERICAN SOCIETY OF FARM MANAGERS & RURAL APPRAISERS,0.0,TERRY LEIBEL
South Dakota,SD,2015,EQUAL JUSTICE USA,0.0,BENJAMIN JONES
South Dakota,SD,2015,TRANSCANADA,3274.039999999999,DREW DUNCAN,DENNIS DUNCAN
South Dakota,SD,2015,"FOGGY NOTION PROPERTIES, LLC",1764.85,TOM NELSON
South Dakota,SD,2015,PFIZER INC.,0.0,MIKE SHAW,JIM DRISCOLL
South Dakota,SD,2015,SOUTH DAKOTA LAND TITLE ASSOCIATION,1000.0,MATTHEW MCCAULLEY,ERIC MATT
South Dakota,SD,2015,SOUTH DAKOTA ASSOCIATION OF SPECIALTY CARE PROVIDE,0.0,MIKE SHAW
South Dakota,SD,2015,POWERTECH (USA ) INC.,0.0,MICHELE BRICH
South Dakota,SD,2015,G.P.ENTERPRISES,0.0,JUSTIN SMITH
South Dakota,SD,2015,SOUTH DAKOTA HOTEL & LODGING ASSOCIATION,0.0,MICHELE BRICH
South Dakota,SD,2015,"SOUTH DAKOTA ONE CALL, PIERRE SD",0.0,LARRY JANES
South Dakota,SD,2015,"ASTRAZENECA PHARMACEUTICALS, LP",0.0,KEVIN JOHNSON,ABIGAIL GOSSMAN
South Dakota,SD,2015,DAKOTA TRUCK UNDERWRITERS/FIRST DAKOTA INDEMNITY COMPANY ,0.0,MYRON RAU
South Dakota,SD,2015,SOUTH DAKOTA ASSOCIATION OF NURSE ANESTHETISTS,0.0,JIM HOOD
South Dakota,SD,2015,SOUTH DAKOTA ASSOCIATION OF COUNTY OFFICIALS,160.0,ROGER TELLINGHUISEN
South Dakota,SD,2015,"WALL DRUG, INC.",240.0,LORIN PANKRATZ
South Dakota,SD,2015,SOUTH DAKOTA STATE'S ATTORNEYS ASSOCIATION,320.0,PAUL BACHAND
South Dakota,SD,2015,MCCROSSAN BOYS RANCH,0.0,BRIAN ROEGIERS
South Dakota,SD,2015,SCHOOL ADMINISTRATORS OF SOUTH DAKOTA,0.0,MICHELLE POWERS,ROBERT MONSON,DR. TIM MITCHELL
South Dakota,SD,2015,THE PEW CHARITABLE TRUSTS,0.0,MATTHEW MCCAULLEY,JEFFREY THIEBERT,RUTH ROSENTHAL,RUTH OLSEN,DIANNA MILLER,ERIC MATT,JOSHUA GOODMAN
South Dakota,SD,2015,LUTHERAN SOCIAL SERVICES,0.0,BETTY OLDENKAMP
South Dakota,SD,2015,AVERA HEALTH PLANS,0.0,RANDY MOSES
