State,StateAbbr,Year,Client,Amount,Lobbyist1,Lobbyist2,Lobbyist3,Lobbyist4,Lobbyist5,Lobbyist6,Lobbyist7,Lobbyist8,Lobbyist9,Lobbyist10,Lobbyist11,Lobbyist12
South Dakota,SD,2015,SD EAGLE FORUM,0.0,KITTY WERTHMANN
South Dakota,SD,2015,ENTERPRISE RENT-A-CAR,320.0,DIANNA MILLER
South Dakota,SD,2015,STATE BAR OF SOUTH DAKOTA,0.0,TOM BARNETT
South Dakota,SD,2015,SOUTH DAKOTA TRUCKING ASSOCIATION,303.42,MYRON RAU,TIM DOUGHERTY
South Dakota,SD,2015,CONSUMER LENDING ALLIANCE INC,0.0,DOUG ABRAHAM
South Dakota,SD,2015,AMERICAN WOOD COUNCIL,0.0,TERRY WEBBER
South Dakota,SD,2015,"SD COUNCIL OF SUBSTANCE ABUSE DIRECTORS, INC",695.5,TERRANCE DOSCH
South Dakota,SD,2015,SOUTH DAKOTA ASSOCIATION OF COUNTY OFFICIALS ,0.0,KRISTIE JACOBSEN
South Dakota,SD,2015,SOUTH DAKOTA HOME BUILDERS ASSOCIATION,0.0,DAVID ASBRIDGE,DARYL CHRISTENSEN
South Dakota,SD,2015,CITY OF RAPID CITY,0.0,BRETT LIMBAUGH
South Dakota,SD,2015,SOUTH DAKOTA ADVOCACY SERVICES,0.0,TIM NEYHART,GAIL EICHSTADT
South Dakota,SD,2015,SD MANUFACTURED HOUSING ASSOCIATION,120.0,JERRY VOGELER
South Dakota,SD,2015,NOVARTIS PHARMACEUTICALS CORPORATION,100.0,DEE DODGE  GEORGE
South Dakota,SD,2015,INDEPENDENT COMMUNITY BANKERS OF SD,2550.859999999999,GREG MCCURRY,MATT KROGMAN,DEAN KROGMAN
South Dakota,SD,2015,MN-SD EQUIPMENT DEALERS ASSOCIATION,1834.9799999999996,RICHARD STROM,DEAN KROGMAN
South Dakota,SD,2015,"SOUTH DAKOTA ASSOCIATION OF PLUMBING-HEATING-COOLING CONTRACTORS, INC.",560.0,ROBERT RITER
South Dakota,SD,2015,LEUKEMIA & LYMPHOMA SOCIETY,0.0,CHRISTINA LEE
South Dakota,SD,2015,SD ASSOCIATION OF TOWNS AND TOWNSHIPS,0.0,MAUREEN WEGENKE,JAMES PUFFER,RICHARD HOWARD,DARWIN BETTMANN
South Dakota,SD,2015,AMERICAN INTERNATIONAL GROUP INC.,0.0,LARRY NELSON
South Dakota,SD,2015,SOUTH DAKOTA ASSOCIATION OF HEALTHCARE ORGANIZATION,0.0,SCOTT DUKE
South Dakota,SD,2015,BAYER CORPORATION,762.7299999999999,CRAIG MISCHO
South Dakota,SD,2015,MOTION PICTURE ASSOCIATION OF AMERICA INC,3377.38,MELISSA PATACK,MIKE SHAW
South Dakota,SD,2015,SOUTH DAKOTA HEAD START ASSOCIATION,272.0,KATHY CRUSE
South Dakota,SD,2015,CENTURYLINK/JEFF CARMON,1935.0,JEFF CARMON
South Dakota,SD,2015,SD STOCKGROWERS' ASSOCIATION,0.0,JEREMIAH M. MURPHY,SILVIA  CHRISTEN
South Dakota,SD,2015,VISITOR INDUSTRY ALLIANCE,1140.0,LORIN PANKRATZ
South Dakota,SD,2015,MID-DAKOTA RURAL WATER SYSTEM INC.,0.0,BRUCE VENNER,BILL SARRINGAR,SUSAN HARGENS,DWIGHT GUTZMER,JUSTIN BELL
South Dakota,SD,2015,SD LIVESTOCK AUCTION MARKETS ASSOCIATION,120.0,JERRY VOGELER
South Dakota,SD,2015,SOUTH DAKOTA FARM BUREAU,0.0,MICHAEL HELD
South Dakota,SD,2015,SD BUDGET & POLICY INSTITUTE,0.0,JOY SMOLNISKY
South Dakota,SD,2015,SPINU COUNTY,0.0,GORDON RICHARD
South Dakota,SD,2015,BASIN ELECTRIC POWER COOPERATIVE,170.0,STEVE TOMAC
South Dakota,SD,2015,NATIONAL AMERICAN UNIVERSITY,560.0,ROBERT RITER
South Dakota,SD,2015,"SOUTH DAKOTA BOWHUNTERS, INC",0.0,ROBERT BARDEN
South Dakota,SD,2015,SOUTH DAKOTA AVIATION ASSOCIATION,0.0,BRITTANY KERR
South Dakota,SD,2015,"PAUL NELSON FARM, INC.",560.0,MATTHEW MCCAULLEY
South Dakota,SD,2015,ROSEBUD SIOUX TRIBE,8221.35,MICHAEL LAPOINTE,ERIC ANTOINE
South Dakota,SD,2015,SOUTH DAKOTA CITIZENS FOR LIBERTY INC.,0.0,BARBARA LANDERS
South Dakota,SD,2015,SOUTH DAKOTA LAND IMPROVEMENT CONTRACTORS,0.0,DEB MORTENSON
South Dakota,SD,2015,COMMUNITY HEALTHCARE ASSOCIATION OF THE DAKOTAS,0.0,JENNIFER STALLEY
South Dakota,SD,2015,SD CATTLEMEN'S ASSOCIATION,0.0,BRENDA FORMAN,JODIE ANDERSON
South Dakota,SD,2015,EXPRESS SCRIPTS HOLDING CO,0.0,MICHELLE MACK,HARRY CHRISTIANSON
South Dakota,SD,2015,CHILD ADVOCACY CENTERS OF SOUTH DAKOTA,0.0,CASEY MURSCHEL
South Dakota,SD,2015,SD FOR BETTER WINE LAWS,984.0,DIANNA MILLER
South Dakota,SD,2015,INDEPENDENT INSURANCE AGENTS OF SOUTH DAKOTA,25.0,JERRY DIAMOND
South Dakota,SD,2015,PROPERTY CASUALTY INSURERS ASSOCIATION OF AMERICA,666.4499999999999,MIKE SHAW,DOUG ABRAHAM
South Dakota,SD,2015,SD VOICES FOR CHILDREN,0.0,MATT KROGMAN
South Dakota,SD,2015,CHECK INTO CASH C/O MULTISTATE ASSOCIATES INC.,0.0,BRETT KOENECKE
South Dakota,SD,2015,"OWNENERGY, INC",0.0,SCOTT KUHLKE
South Dakota,SD,2015,SOUTH DAKOTA BUDGET & POLICY INSTITUTE,229.5,PAUL DENNERT
South Dakota,SD,2015,CELGENE CORPORATION,1872.0,JASON GLODT,ROBERT GRAY,HELEN FITZPATRICK
South Dakota,SD,2015,SOUTH DAKOTA MOTOR VEHICLE RECYCLES ASSOCAITION,0.0,DAVID  NAUMAN
South Dakota,SD,2015,"VALLEY QUEEN CHEESE FACTORY, INC.",0.0,MATTHEW MCCAULLEY
South Dakota,SD,2015,SOUTH DAKOTA ASSOCIATION OF HEALTHCARE ORGANIZATIO,0.0,DARLA POLLMAN ROGERS
South Dakota,SD,2015,BLACK HILLS FOREST RESOURCE ASSOCIATION,0.0,LARRY MANN
South Dakota,SD,2015,BROOKINGS ECONOMIC DEVELOPMENT CORP.,0.0,MATT KROGMAN
South Dakota,SD,2015,SD STUDENT FEDERATION ,0.0,JESSICA PETERSON
South Dakota,SD,2015,SOUTH DAKOTA STATE EMPLOYEES ORGANIZATION,0.0,ERIC OLLILA
South Dakota,SD,2015,MISSOURI RIVER ENERGY SERVICES,0.0,JIM HOOD,DEBORAH BIRGEN
South Dakota,SD,2015,AMERICAN CHEMISTRY COUNCIL,0.0,TIM DOUGHERTY,MARCUS BRANSTAD
South Dakota,SD,2015,LARGE SCHOOL GROUP,1648.0,DIANNA MILLER
South Dakota,SD,2015,ADVANCE AMERICA C/O MULTISTATE ASSOCIATES INC.,726.21,BRETT KOENECKE,CAROL STEWART,SUSAN SCHOOFF
South Dakota,SD,2015,AURORA PLAINS ACADEMY,0.0,JAMES TANKOVICH
South Dakota,SD,2015,SOUTH DAKOTA INDEPENDENT AUTO DEALERS ASSOCIATION,440.0,JERRY VOGELER,LINDSEY RITER-RAPP,ROBERT RITER
South Dakota,SD,2015,OTTER TAIL POWER COMPANY ,0.0,KEVIN KOUBA
South Dakota,SD,2015,SOUTH DAKOTA SHERIFFS ASSOCIATION ,0.0,STACI ACKERMAN
South Dakota,SD,2015,AMERICAN COUNCIL OF LIFE INSURERS ,0.0,JUSTIN SMITH
South Dakota,SD,2015,SOUTH DAKOTA GUN OWNERS,0.0,WELDON TRAVIS LASSETER
South Dakota,SD,2015,SD PETROLEUM AND PROPANE MARKETERS ASSOCIATION,0.0,LARRY MANN,DAWNA LEITZKE
South Dakota,SD,2015,ASSOCIATED GENERAL CONTRACTORS OF SOUTH DAKOTA,0.0,DEB MORTENSON
South Dakota,SD,2015,SOUTH DAKOTA VFW,229.25,DENNIS SHARP,RICK BARG
South Dakota,SD,2015,SD ASSN OF CONSERVATION DISTRICTS ,0.0,CAROLYN RUDEBUSCH,ANGELA EHLERS
South Dakota,SD,2015,NORTHERN PRAIRIES LAND TRUST,0.0,STEVEN SANFORD
South Dakota,SD,2015,SOUTH DAKOTA HEALTH AND EDUCATIONAL FACILITIES AUT,1000.0,MATTHEW MCCAULLEY,DON TEMPLETON,ERIC MATT,DUSTIN CHRISTOPHERSON
South Dakota,SD,2015,RAMKOTA COMPANIES / US HOTEL & RESORT MANAGEMENT,0.0,DAVID SWEET,JOSHUA SCHMALTZ
South Dakota,SD,2015,SD C/T VSOA,0.0,AARON WALBERG,ANGELLA SUTTON,MICHAEL HOLZHAUSER
South Dakota,SD,2015,SOUTH DAKOTA OPPORTUNITY GROUP,0.0,NORBERT (NORBE) BARRIE
South Dakota,SD,2015,AMERICAN EXPRESS,0.0,RICHARD TIESZEN
South Dakota,SD,2015,PARENTS FOR AUTISM INSURANCE REFORM IN SD,103.4,LISA STANLEY
South Dakota,SD,2015,"SD SYNOD, EVANGELICAL LUTHERAN CHURCH IN AMERICA",0.0,BRETT KOENECKE
South Dakota,SD,2015,ADVANTAGE SOUTH DAKOTA,0.0,JULIE JOHNSON
South Dakota,SD,2015,SOUTH DAKOTA TANNING SALON ASSOCIATION,800.0,LINDSEY RITER-RAPP,ROBERT RITER,MARGO NORTHRUP
South Dakota,SD,2015,FIREWORKS UNLIMITED INC.,515.76,JOSHUA ANDERSEN
South Dakota,SD,2015,SOUTH DAKOTA OPTOMETRIC SOCIETY,320.0,LINDSEY RITER-RAPP,ROBERT RITER,DEB MORTENSON
South Dakota,SD,2015,SOUTH DAKOTA ELECTRIC UTILITY COMPANIES,0.0,BRETT KOENECKE,JUSTIN BELL
South Dakota,SD,2015,SD COUNSELING ASSOCIATION,320.0,DIANNA MILLER
South Dakota,SD,2015,AMERICAN CIVIL LIBERTIES UNION ,80.0,HEATHER SMITH,ELIZABETH SKARIN
South Dakota,SD,2015,DAKOTA VALLEY BUSINESS COUNCIL,0.0,BARBARA SLONIKER
South Dakota,SD,2015,ALZHEIMER'S ASSOCIATION SOUTH DAKOTA CHAPTER,0.0,EDITH RENNER,LESLIE MORROW
South Dakota,SD,2015,FRIENDS OF SOUTH DAKOTA PUBLIC BROADCASTING,0.0,RYAN HOWLETT
South Dakota,SD,2015,ELI LILLY & COMPANY,3714.039999999999,SUSAN LANDWEHR,DREW DUNCAN,DENNIS DUNCAN
South Dakota,SD,2015,SOUTH DAKOTA CAMPAIGN FOR HEALTHY FAMILIES,0.0,MITCH RICHTER
South Dakota,SD,2015,STATE FARM INSURANCE COMPANIES ,0.0,RICHARD TIESZEN,CRAIG MATSON
South Dakota,SD,2015,MARCH OF DIMES SD CHAPTER,1082.63,WENDY LEWIS
South Dakota,SD,2015,AMERICAN MASSAGE THERAPY ASSOC-SOUTH DAKOTA CHAPTER,0.0,VALERIE ROWEN
South Dakota,SD,2015,"Summit Area Economic Growth, Inc.",0.0,TIM GAPP
South Dakota,SD,2015,DOUGHERTY & COMPANY,0.0,TOBY MORRIS
South Dakota,SD,2015,MERCK SHARP & DOHME CORP.,0.0,MARTIN MATTHEWS
South Dakota,SD,2015,SOUTH DAKOTA BIRTH MATTERS,0.0,DEBBIE PEASE
South Dakota,SD,2015,SOUTH DAKOTA INSURANCE ALLIANCE,6998.240000000002,CRAIG MATSON,WILLIAM FULLER,EDWIN EVANS,DREW DUNCAN,DENNIS DUNCAN
South Dakota,SD,2015,SOUTH DAKOTANS FOR THE ARTS,0.0,BARRY LEBEAU
South Dakota,SD,2015,REPUBLIC NATIONAL DISTRIBUTING COMPANY,0.0,JEREMIAH M. MURPHY
South Dakota,SD,2015,ROADS ARE VITAL COALITION,0.0,JASON GLODT,ROBERT GRAY
South Dakota,SD,2015,NATIONAL ASSOCIATION OF MUTUAL INSURANCE COMPANIES,0.0,MARK JOHNSTON
South Dakota,SD,2015,IBEW ,0.0,KORY ALLAN RAWSTREN
South Dakota,SD,2015,NATIONAL BASKETBALL PLAYERS ASSOCIATION,0.0,KEVIN GOERING,STEVE GLAZE,JIM PUTNAM
South Dakota,SD,2015,SOUTH DAKOTA MANUFACTURED HOUSING ASSOCIATION,560.0,LINDSEY RITER-RAPP,ROBERT RITER,MARGO NORTHRUP
South Dakota,SD,2015,"RAPID CITY, PIERRE & EASTERN RAILROAD, INC.",1834.9799999999996,DEAN KROGMAN
South Dakota,SD,2015,SOUTH DAKOTA CHRISTIAN HOME EDUCATORS,0.0,MONICA TANNER,RYAN MAURER,MATHEW IRWIN
South Dakota,SD,2015,NFL PLAYERS ASSOCIATION,0.0,KEVIN GOERING,STEVE GLAZE,JIM PUTNAM
South Dakota,SD,2015,REGIONAL HEALTH,224.87,JASON GREEN,MICHAEL DIEDRICH
South Dakota,SD,2015,SD ASSN OF VIDEO LOTTERY ESTABLISHMENTS,0.0,LARRY MANN
South Dakota,SD,2015,SOUTH DAKOTA CITIZENS FOR LIBERTY INC,0.0,TONI WEAVER
South Dakota,SD,2015,SOUTH DAKOTA DAIRY PRODUCERS,0.0,MARVIN POST,BRENDA FORMAN
South Dakota,SD,2015,MINNEHAHA COUNTY COMMISSION,0.0,KENNETH MCFARLAND
South Dakota,SD,2015,AMERICAN COALITION FOR CLEAN COAL ELECTRICITY,975.85,MARK OURADA,ROBERT GRAY
South Dakota,SD,2015,"NICUSA, INC.",0.0,WILLIAM VANCAMP
South Dakota,SD,2015,SOUTH DAKOTA RIGHT TO LIFE,0.0,DEBBIE PEASE
South Dakota,SD,2015,"REGIONAL HEALTH, INC.",0.0,JEREMIAH M. MURPHY
South Dakota,SD,2015,NORTHWEST GF MUTUAL,0.0,BRIAN BOWKER
South Dakota,SD,2015,ABATE,1648.0,DIANNA MILLER
South Dakota,SD,2015,MITCHELL TECHNICAL INSTITUTE,0.0,RICHARD TIESZEN,WADE FISCHER
South Dakota,SD,2015,SDSU JACKRABBIT ADVOCATES,0.0,KEVIN TETZLAFF
South Dakota,SD,2015,BOYS & GIRLS CLUB SOUTH DAKOTA ALLIANCE,0.0,JENNIFER STALLEY
South Dakota,SD,2015,SUSAN G KOMEN SOUTH DAKOTA,626.0,ROD GOEMAN,MARY KOLSRUD
South Dakota,SD,2015,SOUTH DAKOTA SHERIFF'S ASSOCIATION,0.0,RICHARD TIESZEN
South Dakota,SD,2015,GAMING MANAGMENT GROUP,0.0,BRYANT SOBERG,KIRBY MUILENBURG
South Dakota,SD,2015,SOUTH DAKOTA CHAPTER OF ACPA,0.0,LARRY ENGBRECHT
South Dakota,SD,2015,SOUTH DAKOTA BANKERS ASSOCIATION,0.0,BRETT KOENECKE,MICHAEL FEIMER,CURTIS EVERSON,DOUG ABRAHAM
South Dakota,SD,2015,SOUTH DAKOTA DENTAL ASSOCIATION,0.0,BRETT KOENECKE,PAUL KNECHT
South Dakota,SD,2015,COMMUNITY SUPPORT PROVIDERS OF SOUTH DAKOTA,0.0,GERALD TRACY II,BRANDEE SCHREINER,DARYL KILSTROM
South Dakota,SD,2015,MID-DAKOTA RURAL WATER SYSTEM INC,0.0,KURT PFEIFLE
South Dakota,SD,2015,EVERYTOWN FOR GUN SAFETY ACTION FUND ,0.0,MITCH RICHTER,LARRY NELSON
South Dakota,SD,2015,SOUTH DAKOTA VETERINARY MEDICAL ASSOCIATION ,0.0,JENNIFER STALLEY
South Dakota,SD,2015,VERIZON WIRELESS,0.0,DREW DUNCAN,DENNIS DUNCAN
South Dakota,SD,2015,SOUTH DAKOTA RETAILERS ASSOCIATION,0.0,SHAWN LYONS,JIM HOOD,MELISA FOREST
South Dakota,SD,2015,CHRISBRO HOSPITALITY,0.0,HARRY CHRISTIANSON
South Dakota,SD,2015,SOUTH DAKOTA ASSOCIATION OF CRIMINAL DEFENSE LAWYERS,320.0,LINDSEY RITER-RAPP
South Dakota,SD,2015,SOUTH DAKOTA RURAL ELECTRIC ASSOCIATION,540.0,ROBERT RITER,DARLA POLLMAN ROGERS,MARGO NORTHRUP,ED ANDERSON
South Dakota,SD,2015,NHL PLAYERS ASSOCIATION,0.0,KEVIN GOERING,STEVE GLAZE,JIM PUTNAM
South Dakota,SD,2015,ASSOCIATED SCHOOL BOARDS OF SOUTH DAKOTA ,0.0,TYLER  PICKNER,WILLIAM LYNCH,GERRY KAUFMAN,MATT FLETT
South Dakota,SD,2015,AMERICA'S HEALTH INSURANCE PLANS,0.0,DARLA POLLMAN ROGERS
South Dakota,SD,2015,CITY OF SIOUX FALLS,280.0,JERRY MUNDT,MARK  COTTER
South Dakota,SD,2015,SOUTH DAKOTA COLLECTORS ASSOCIATION,8383.060000000003,DEAN KROGMAN,MARK KISELY,DREW DUNCAN,DENNIS DUNCAN
South Dakota,SD,2015,MILLERCOORS LLC,160.0,WILLIAM VAN CAMP
South Dakota,SD,2015,SOUTH DAKOTA ENTERTAINMENT ASSOCIATION,3274.039999999999,KROGMAN DEAN,DREW DUNCAN
South Dakota,SD,2015,SOUTH DAKOTA ASSOCIATION OF REALTORS,0.0,MICHELLE KLEVEN
South Dakota,SD,2015,BALANCED BUDGET AMENDMENT TASK FORCE,0.0,WILLIAM FRUTH
South Dakota,SD,2015,NORTH AMERICAN TITLE LOANS,0.0,HARRY CHRISTIANSON
South Dakota,SD,2015,AMERICAN HEART ASSOCIATION,1245.1100000000001,MEGAN MYERS,DEAN  KROGMAN
South Dakota,SD,2015,CHRISTIAN SCIENCE CHURCH,0.0,DEANNE  FARRAR
South Dakota,SD,2015,3M COMPANY,2346.4000000000005,DAN GARRY,TIM DOUGHERTY
South Dakota,SD,2015,"SOUTH DAKOTA TRUST COMPANY, LLC",440.0,MATTHEW MCCAULLEY,ERIC MATT
South Dakota,SD,2015,SOUTH DAKOTA BEER DISTRIBUTORS ASSOCIATION,1886.9799999999996,LINDSEY RITER-RAPP,ROBERT RITER,NANCEE JOHNSON
South Dakota,SD,2015,"AGC OF SOUTH DAKOTA PIERRE, SD",0.0,TOBY CROW
South Dakota,SD,2015,FARMERS INSURANCE ,593.33,MIKE MORES
South Dakota,SD,2015,SOUTH DAKOTA PHARMACISTS ASSOCIATION,0.0,SUE SCHAEFER
South Dakota,SD,2015,NEXTERA,160.0,WILLIAM VAN CAMP
South Dakota,SD,2015,SIOUX FALLS SCHOOL DISTRICT,0.0,LARRY NELSON
South Dakota,SD,2015,"ENERGY TRANSFER PARTNERS, L.P.",8475.839999999998,BRETT KOENECKE,MIKE SHAW
South Dakota,SD,2015,ALLIANCE OF AUTOMOBILE MANUFACTURERS,1000.0,MATTHEW MCCAULLEY,ERIC MATT
South Dakota,SD,2015,"NATIONAL ASSOCIATION OF VISION CARE PLANS, NAVCP",160.0,WILLIAM VAN CAMP
South Dakota,SD,2015,HARMS OIL COMPANY,0.0,BRETT KOENECKE
South Dakota,SD,2015,SD COLLECTORS ASSOC.,0.0,MATT KROGMAN
South Dakota,SD,2015,"IMAGINE LEARNING INC.,",990.0,MITCH RICHTER,LARRY NELSON
South Dakota,SD,2015,THE AMERICAN LEGION DEPARTMENT OF SOUTH DAKOTA,0.0,KEN ORROCK,ROYCE LOESCH,DENNIS BRENDEN
South Dakota,SD,2015,SOUTH DAKOTA FUNERAL DIRECTOR ASSOCIATION,0.0,JASON GLODT,ROBERT GRAY
South Dakota,SD,2015,POWERTECH USA,0.0,LARRY MANN,MARK HOLLENBECK
South Dakota,SD,2015,BLACK HILLS CORPORATION,0.0,JAFAR KARIM
South Dakota,SD,2015,CGI TECHNOLOGIES & SOLUTIONS INC.,1000.0,MATTHEW MCCAULLEY,ERIC MATT
South Dakota,SD,2015,FAMILY HERITAGE ALLIANCE ACTION,0.0,JENNIFER UTTER,DALE BARTSCHER
South Dakota,SD,2015,SOUTH DAKOTA CORN GROWERS ASSOCIATION,560.0,MATTHEW MCCAULLEY
South Dakota,SD,2015,CONSUMER HEALTH ALLIANCE,297.64,DREW DUNCAN,DENNIS DUNCAN
South Dakota,SD,2015,DAKOTA PLAINS ENERGY,0.0,HEATH JOHNSON
South Dakota,SD,2015,DELTA DENTAL OF SOUTH DAKOTA,0.0,JASON GLODT,ROBERT GRAY
South Dakota,SD,2015,GENTRY FINANCE,320.0,PAUL BACHAND
South Dakota,SD,2015,"SD COUNCIL OF MENTAL HEALTH CENTERS, INC",3808.16,TERRANCE DOSCH
South Dakota,SD,2015,SIOUX FALLS AREA CHAMBER OF COMMERCE,9812.349999999999,JUSTIN SMITH,MARK LEE
South Dakota,SD,2015,"SCIENTIFIC GAMES INTERNATIONAL, INC.",0.0,JUSTIN BELL
South Dakota,SD,2015,CHEYENNE RIVER SIOUX TRIBE,0.0,BARRY LEBEAU
South Dakota,SD,2015,SOUTH DAKOTA SIERRA CLUB,0.0,LARRY NELSON
South Dakota,SD,2015,AFSCME COUNCIL 65,0.0,NATHAN RHAM
South Dakota,SD,2015,LICENSED BEVERAGE DEALERS OF SOUTH DAKOTA,280.0,MATT KROGMAN,CATHY BERG
South Dakota,SD,2015,DAKOTA RURAL ACTION,0.0,SABRINA KING
South Dakota,SD,2015,DE SMET INSURANCE COMPANY OF SOUTH DAKOTA,1952.0,JASON GLODT,MIKE SHAW,WILLIAM POPPEN,ROBERT GRAY,DOUG ABRAHAM
South Dakota,SD,2015,SOUTH DAKOTA CPA SOCIETY ,0.0,LARRY MANN
South Dakota,SD,2015,SOUTH DAKOTA EAGLE FORUM,0.0,RITA HOUGLUM
South Dakota,SD,2015,SOUTH DAKOTA DEFENSE LAWYERS ASSOCIATION,0.0,MARGO NORTHRUP
South Dakota,SD,2015,GENERAL MOTORS LLC,0.0,CHRISTOPHER MOODY,ANDREW BLUNT
South Dakota,SD,2015,NONMEANDERED WATERS OF SOUTH DAKOTA ASSOCIATION,0.0,MIKE SHAW
South Dakota,SD,2015,"CITIGROUP WASHINGTON, INC.",0.0,JAMES BANTHAM
South Dakota,SD,2015,PUETZ CORPORATION,0.0,RICHARD TIESZEN,WADE FISCHER
South Dakota,SD,2015,SOUTH DAKOTA WHEAT INCORPORATED ,0.0,CAREN ASSMAN
South Dakota,SD,2015,SANFORD HEALTH,1500.0,QUINN STEIN,LORIN PANKRATZ,NICK KOTZEA,DANIEL HEINEMANN,HARRY CHRISTIANSON
South Dakota,SD,2015,CITIZENLINK,0.0,JOHN PAULTON
South Dakota,SD,2015,NATIONAL ASSOCIATION OF SOCIAL WORKERS-SOUTH DAKOTA,0.0,JENAE HANSEN
South Dakota,SD,2015,SOUTH DAKOTA ASSOCIATION OF RURAL WATER SYSTEMS,560.0,ROBERT RITER,MARGO NORTHRUP
South Dakota,SD,2015,AFLAC,160.0,ROGER TELLINGHUISEN
South Dakota,SD,2015,NORTHWESTERN ENERGY,0.0,PAMELA BONRUD
South Dakota,SD,2015,"NATIONAL SHOOTING SPORTS FOUNDATION, INC.",0.0,TREVOR SANTOS
South Dakota,SD,2015,UNIVERSITY OF SOUTH DAKOTA ALUMNI ASSOCIATION,6548.079999999998,ROBERT RITER,DENNIS DUNCAN
South Dakota,SD,2015,SD NETWORK AGAINST FAMILY VIOLENCE & SEXUAL ASSAUL,0.0,DIANNA MILLER
South Dakota,SD,2015,MIDCONTINENT COMMUNICATIONS,0.0,DAN NELSON
South Dakota,SD,2015,SOUTH DAKOTA LIONS EYE & TISSUE BANK,0.0,MATTHEW ARNETT,KEN WETZ,KENNETH SNELL,MARCY DIMOND
South Dakota,SD,2015,TEACH FOR AMERICA,1602.0,JAMES CURRAN,MITCH RICHTER,LARRY NELSON
South Dakota,SD,2015,ANHEUSER - BUSCH COMPANIES,0.0,TIM DOUGHERTY
South Dakota,SD,2015,CONCERNED WOMEN FOR AMERICA,0.0,TERRI JORGENSON
South Dakota,SD,2015,AMERICANS UNITED FOR SEPARATION OF CHURCH AND STAT,0.0,AMRITA SINGH
South Dakota,SD,2015,SD FACT,0.0,SARA PARKER,SHARI CROUCH KOSEL
South Dakota,SD,2015,DEADWOOD GAMING ASSOCIATION,866.9300000000001,ROGER TELLINGHUISEN,MIKE RODMAN,CALEB ARCENEAUX
South Dakota,SD,2015,SOUTH DAKOTA CHIROPRACTORS ASSOCIATION,0.0,JIM HOOD
South Dakota,SD,2015,SOUTH DAKOTA NURSES ASSOCIATION,0.0,RACHEL DAY,BRITTANY NOVOTNY
South Dakota,SD,2015,SD POLICE CHIEFS ASSOCIATION,0.0,YVONNE TAYLOR
South Dakota,SD,2015,"AAA COLLECTIONS, INC.",0.0,JUSTIN SMITH
South Dakota,SD,2015,HABITAT FOR HUMANITY - SOUTH DAKOTA,0.0,JULIE JOHNSON
South Dakota,SD,2015,SD MUNICIPAL LEAGUE,0.0,JEFF MEHLHAFF,YVONNE TAYLOR,LARRY NELSON,JIM HOOD
South Dakota,SD,2015,HUMANE SOCIETY OF THE UNITED STATES,722.25,MITCH RICHTER,LARRY NELSON,DARCI ADAMS
South Dakota,SD,2015,PROFESSIONAL APPRAISERS ASSOCIATION OF SD,0.0,RANDY VANCE,CRAIG STEINLEY
South Dakota,SD,2015,DUCKS UNLIMITED,790.5899999999999,CARMEN MILLER,ERIC LINDSTROM,STEVE DONOVAN
South Dakota,SD,2015,MUSIC & VENDING ASSOCIATION OF SOUTH DAKOTA,2240.0,ROBERT RITER
South Dakota,SD,2015,SOUTH DAKOTA ETHANOL PRODUCERS ASSOCIATION,0.0,DIANNA MILLER,HARRY CHRISTIANSON
South Dakota,SD,2015,SOUTH DAKOTA ACADEMY OF PHYSICIAN ASSISTANTS,320.0,PAUL BACHAND
South Dakota,SD,2015,SOUTH DAKOTA YMCA OF THE U.S.A ALLIANCE ,320.0,PAUL BACHAND
South Dakota,SD,2015,WIND ON THE WIRES,0.0,CHRIS KUNKLE
South Dakota,SD,2015,PENNINGTON COUNTY WEED AND PEST,0.0,SCOTT GUFFEEY
South Dakota,SD,2015,EAST DAKOTA WATER DEVELOPMENT DISTRICT,0.0,JAY GILBERTSON
South Dakota,SD,2015,MUSIC AND VENDING ASSOCIATION OF SOUTH DAKOTA,0.0,DEB MORTENSON
South Dakota,SD,2015,WINE INSTITUTE,0.0,JIM HOOD
South Dakota,SD,2015,SOUTH DAKOTA COALITION OF CITIZENS WITH DISABILITIES,0.0,SHELLY PFAFF
South Dakota,SD,2015,NATIONAL RIFLE ASSOCIATION OF AMERICA,0.0,JOHN COMMERFORD
South Dakota,SD,2015,INDIVIOR PLC,0.0,ELIZABETH  ARIANO
South Dakota,SD,2015,SOUTH DAKOTA ASSOCIATION OF COUNTY COMMISSIONERS,150.0,KENNETH MCFARLAND,LORIN PANKRATZ,KRISTIE JACOBSEN
South Dakota,SD,2015,CITY OF DEADWOOD,0.0,CHARLES TURBIVILLE
South Dakota,SD,2015,SOUTH DAKOTA CHAMBER OF COMMERCE & INDUSTRY,0.0,DAVID OWEN
South Dakota,SD,2015,AT&T,160.0,CHERYL RILEY,WILLIAM VAN CAMP
South Dakota,SD,2015,LAMAR ADVERTISING COMPANY,0.0,JUSTIN SMITH
South Dakota,SD,2015,PROPERTY CASUALTY INSURER OF ASSN,0.0,KENTON BRINE
South Dakota,SD,2015,SOUTH DAKOTA NEWSPAPER ASSOCIATION,0.0,JUSTIN SMITH,DAVID BORDEWYK
South Dakota,SD,2015,RAPID CITY AREA CHAMBER OF COMMERCE,1542.88,KATHERINE (KITTY) KINSMAN
South Dakota,SD,2015,"NEXERA ENERGY RESOURCES, LLC",0.0,JULIE VOECK
South Dakota,SD,2015,"WAL-MART STORES, INC.",0.0,RYAN IRSIK
South Dakota,SD,2015,"SOUTH DAKOTA PHARMACISTS ASSOCIATION, COMMERCIAL A",0.0,ROBERT RITER
South Dakota,SD,2015,WHARF RESOURCES U.S.A. INC,0.0,LARRY MANN
South Dakota,SD,2015,SD RETIRED TEACHERS,0.0,HANK KOSTERS
South Dakota,SD,2015,DEADWOOD ECONOMIC DEVELOPMENT CORPORATION,590.0,LORIN PANKRATZ
South Dakota,SD,2015,XCEL ENERGY,0.0,ERIC PAULI
South Dakota,SD,2015,HOME BUILDERS ASSOCIATION OF THE SIOUX EMPIRE,0.0,TIM DOUGHERTY
South Dakota,SD,2015,AMERICAN BOARD OF PHYSICIAN SPECIALTIES,0.0,LINDA MURPHY
South Dakota,SD,2015,CRIME AND JUSTICE INSTITUTE AT CRJ,0.0,BARBARA PIERCE PARKER
South Dakota,SD,2015,LIFESOURCE,540.0,LORIN PANKRATZ
South Dakota,SD,2015,CELGENE,0.0,HELEN FITZGERALD
South Dakota,SD,2015,SOUTH DAKOTA FAMILY POLICY COUNCIL,0.0,MARK CHASE
South Dakota,SD,2015,DAKOTA SPIRIT DISTILLERY,0.0,MICHELE BRICH
South Dakota,SD,2015,FLANDREAU SANTEE SIOUX TRIBE,0.0,SETH PEARMAN
South Dakota,SD,2015,JOE FOSS INSTITUTE,0.0,GEORGIA HANSON
South Dakota,SD,2015,MDU RESOURCES GROUP INC,0.0,GEOFF SIMON
South Dakota,SD,2015,SOUTH DAKOTANS FOR AN ALTERNATIVE TO THE DEATH PENALTY,2344.6099999999997,DENNIS DAVIS
South Dakota,SD,2015,SOUTH DAKOTA ASSOCIATION OF YOUTH CARE PROVIDERS,0.0,JAMES TANKOVICH,BRIAN ROEGIERS,BETTY OLDENKAMP,WILLIAM COLSON
South Dakota,SD,2015,NORTHERN STATE UNIVERSITY FOUNDATION,0.0,JULIE JOHNSON
South Dakota,SD,2015,"GENENTECH, INC., A MEMBER OF THE ROCHE GROUP",673.48,SCOTT SETZEPFANDT
South Dakota,SD,2015,SDSU STUDENTS' ASSOCIATION,0.0,ROBERT MCLEAN,OLIVIA SIGLIN,JACOB  SUTTON,ALLYSON HELMS,CALEB FINCK
South Dakota,SD,2015,SOUTH DAKOTA ASSOCIATION OF REALTORS ,1834.9799999999996,RYAN KROGMAN,DEAN KROGMAN
South Dakota,SD,2015,"SOUTH DAKOTA RURAL BUSINESS COALITION, LLC",440.0,MATTHEW MCCAULLEY,ERIC MATT
South Dakota,SD,2015,SOUTH DAKOTA AUTO DEALERS ASSOCIATION,303.42,MYRON RAU,TIM DOUGHERTY
South Dakota,SD,2015,ALLSTATE INSURANCE COMPANY ,6548.080000000002,DREW DUNCAN,DENNIS DUNCAN
South Dakota,SD,2015,ALTRIA CLIENT SERVICES INC AND ITS AFFILIATES,0.0,TIM DOUGHERTY,GARTH ALSTON
South Dakota,SD,2015,AMERICANS FOR PROSPERITY,1000.0,MATTHEW MCCAULLEY,ERIC MATT,BENJAMIN LEE,CHAD KRIER
South Dakota,SD,2015,HARDING COUNTY,248.72,KATHY GLINES,DEAN WAGNER
South Dakota,SD,2015,STRATEGIC WORKFORCE ADVOCACY COUNCIL,0.0,BOB FAEHN
South Dakota,SD,2015,FARM CREDIT SERVICES OF AMERICA,1080.0,MATTHEW MCCAULLEY,KIM VANNEMAN,JAMES NYGREN,ERIC MATT
South Dakota,SD,2015,AVERA HEALTH,218.26,BOB SUTTON,DEB FISCHER-CLEMENS,TIM DOUGHERTY,CHARLENE BERKE BERKE
South Dakota,SD,2015,NORTH CENTRAL PARALYZED VETERANS OF AMERICA,0.0,TERRY PAULSEN
South Dakota,SD,2015,SOUTH DAKOTA MOTOR VEHICLE RECYCLERS ASSOCIATION,0.0,SHANNON NORDSTROM
South Dakota,SD,2015,SD COALITION FOR RESPONSIBLE TAXATION,0.0,JEREMIAH M. MURPHY
South Dakota,SD,2015,SD MIGRATORY BIRD ASSOCIATION,0.0,STEVE NELSON
South Dakota,SD,2015,"AVANGRID RENEWABLES, LLC",0.0,BRETT KOENECKE,ADAM  SOKOLSKI,JESSE BERMEL
South Dakota,SD,2015,"HY-VEE, INC",0.0,LARRY NELSON
South Dakota,SD,2015,SOUTH DAKOTA STATE MEDICAL ASSOCIATION,0.0,JUSTIN BELL
South Dakota,SD,2015,SOUTH DAKOTA MULTI-HOUSING ASSOCIATION,922.3299999999999,DENISE HANZLIK
South Dakota,SD,2015,HEARTLAND CONSUMER POWER DISTRICT,9825.419999999998,DREW DUNCAN,DENNIS DUNCAN
South Dakota,SD,2015,"LIFESCAPE, INC.",4597.6,ANNE  RIECK MCFARLAND,KIMBERLY MARSO,KATHERINE (KITTY) KINSMAN,ANGIE BROWN
South Dakota,SD,2015,SOUTH DAKOTANS AGAINST COMMON CORE,1350.0,MARY SCHEEL-BUYSSE
South Dakota,SD,2015,SD PORK PRODUCERS,2340.0,LORIN PANKRATZ
South Dakota,SD,2015,GOLDWATER INSTITUTE,0.0,CRAIG  HANDZLIK
South Dakota,SD,2015,SD MUNICIPAL ELECTRIC ASSOCIATION,0.0,JEFF MEHLHAFF,LARRY NELSON
South Dakota,SD,2015,SOUTH DAKOTA EDUCATION ASSOCIATION,0.0,MARK  MICKELSEN,MARY MCCORKLE,SANDRA WALTMAN,ANNE PLOOSTER
South Dakota,SD,2015,BRISTOL-MYERS SQUIBB COMPANY,0.0,JOHN MARCHANT 
South Dakota,SD,2015,SIOUX VALLEY ENERGY,1026.65,CARRIE LAW
South Dakota,SD,2015,WASTE MANAGEMENT OF SOUTH DAKOTA,0.0,RICHARD TIESZEN
South Dakota,SD,2015,MAJOR LEAGUE BASEBALL PLAYERS ASSOCIATION,615.56,KEVIN GOERING,STEVE GLAZE,JIM PUTNAM
South Dakota,SD,2015,NATIONAL FEDERATION OF INDEPENDENT BUSINESS,880.0,LINDSEY RITER-RAPP,ROBERT RITER
South Dakota,SD,2015,SOUTH DAKOTA HEALTH CARE ASSOCIATION,23117.47999999999,MARK DEAK,DREW DUNCAN,DENNIS DUNCAN
South Dakota,SD,2015,ABERDEEN HOTEL ALLIANCE,160.0,JULIE JOHNSON
South Dakota,SD,2015,SD STATE MEDICAL ASSOC.,1764.9799999999996,MATT KROGMAN,DEAN KROGMAN
South Dakota,SD,2015,NAIFA-SD,53.04,ADAM WEEMAN,DARLA POLLMAN ROGERS
South Dakota,SD,2015,PHARMACEUTICAL RESEARCH AND MANUFACTURERS OF AMERI,7428.080000000002,DREW DUNCAN,DENNIS DUNCAN
South Dakota,SD,2015,ENERGY TRANSFER EQUITY,0.0,GREGORY  BRAZAITIS
South Dakota,SD,2015,SD ASSOCIATION OF HEALTHCARE ORGANIZATIONS,0.0,WENDY MEAD,GILBERT JOHNSON,REBEKAH CRADDUCK,ANGIE BAKKE
South Dakota,SD,2015,STUDENTS FOR CONCEALED CARRY,0.0,JOE BLISS
South Dakota,SD,2015,SOUTHEAST TECHNICAL INSTITUTE ,0.0,RICHARD TIESZEN,JEFFREY HOLCOMB,WADE FISCHER
South Dakota,SD,2015,CREDIT UNION ASSOCIATION OF THE DAKOTAS,0.0,TIM DOUGHERTY
South Dakota,SD,2015,LEWIS & CLARK REGIONAL WATER SYSTEM,0.0,TROY LARSON
South Dakota,SD,2015,SOUTH DAKOTA DIVISION IZAAK WALTON LEAGUE OF AMERI,0.0,PAUL LEPISTO
South Dakota,SD,2015,BMWED,0.0,TIMOTHY EVEN
South Dakota,SD,2015,SOUTH DAKOTA TEEN COURT ASSOCIATION,0.0,JENNIFER STALLEY
South Dakota,SD,2015,WANNABEE BEEKEEPERS,0.0,TINA MULALLY
South Dakota,SD,2015,CHIESMAN CENTER FOR DEMOCRACY,0.0,ROBERT TIMM
South Dakota,SD,2015,BNSF RAILWAY COMPANY,0.0,TIM DOUGHERTY
South Dakota,SD,2015,SD HISTORICAL SOCIETY FOUNDATION,0.0,MICHAEL  LEWIS
South Dakota,SD,2015,SOUTH DAKOTA CAPTIVE INSURANCE COUNCIL,1000.0,MATTHEW MCCAULLEY,ERIC MATT
South Dakota,SD,2015,RAI SERVICES COMPANY,1000.0,MATTHEW MCCAULLEY,ERIC MATT
South Dakota,SD,2015,SD SOCIETY OF HUMAN RESOURCE MANAGERS,0.0,JULIE JOHNSON
South Dakota,SD,2015,SOUTH DAKOTA TELECOMMUNICATIONS ASSOCIATION,50.0,GREG DEAN,DARLA POLLMAN ROGERS
South Dakota,SD,2015,SOUTH DAKOTA DESIGN PROFESSIONALS COALITION,0.0,JUSTIN BELL
South Dakota,SD,2015,SD SOYBEAN ASSOCIATION,540.0,LORIN PANKRATZ
South Dakota,SD,2015,AARP SOUTH DAKOTA,0.0,ERIK NELSON
South Dakota,SD,2015,CGI TECHNOLOGIES AND SOLUTIONS INC,0.0,JOHN STEPHAN,TED LONDON,BRYCE BERG
South Dakota,SD,2015,"PHEASANTS FOREVER, INC.",389.11,DAVID NOMSEN
