State,Year,Name,Active,Industry,Number of Lobbyists
ARIZONA,2006,2ND SPOKEN VOICE,no,,1
ARIZONA,2006,3M CO,yes,MISCELLANEOUS MANUFACTURING & DISTRIBUTING,2
ARIZONA,2006,49ER MINERALS INC,no,,2
ARIZONA,2006,7-ELEVEN,yes,OIL & GAS,2
ARIZONA,2006,A G EDWARDS & SONS INC,yes,,3
ARIZONA,2006,A T STILL UNIVERSITY,no,EDUCATION,4
ARIZONA,2006,A-55 LP,no,,1
ARIZONA,2006,AAA CAB SERVICE,no,MISCELLANEOUS TRANSPORT,1
ARIZONA,2006,AARP,yes,ELDERLY/SOCIAL SECURITY,1
ARIZONA,2006,ABBOTT LABORATORIES,yes,PHARMACEUTICALS & HEALTH PRODUCTS,6
ARIZONA,2006,ABITIBI CONSOLIDATED INC,no,,3
ARIZONA,2006,ABRAMS AIRBORNE MANUFACTURING INC,no,,1
ARIZONA,2006,ACCENTURE,yes,,4
ARIZONA,2006,ACCIPITER COMMUNICATIONS INC,no,,1
ARIZONA,2006,ACLU OF ARIZONA,yes,OTHER/SINGLE ISSUE GROUPS,1
ARIZONA,2006,ACTIVATOR HEALTH CENTERS PC,no,,1
ARIZONA,2006,ACTIVATOR METHODS INTERNATIONAL,no,,3
ARIZONA,2006,ADELITAS DEL VALLE,no,,1
ARIZONA,2006,ADVANCE CERAMICS RESEARCH,no,,1
ARIZONA,2006,ADVANCED CORRECTIONAL MANAGEMENT LLC,no,,1
ARIZONA,2006,ADVANTAGE CAPITAL MANAGEMENT CORP,yes,SECURITIES & INVESTMENT,2
ARIZONA,2006,ADVOCATES FOR SCHOOL CHOICE,yes,,2
ARIZONA,2006,AEA ARIZONA,no,,2
ARIZONA,2006,AETNA,yes,INSURANCE,1
ARIZONA,2006,AGRI-BUSINESS COUNCIL OF AZ INC,no,,1
ARIZONA,2006,AGUILA IRRIGATION DISTRICT,no,,3
ARIZONA,2006,AIRCRAFT OWNERS & PILOT ASSOCIATION,yes,AIR TRANSPORT,1
ARIZONA,2006,AIZ CORR PEACE OFFICERS ASSOCIATION,no,,3
ARIZONA,2006,ALCOR LIFE EXTENSION FOUNDATION,no,,2
ARIZONA,2006,ALECA AKA AZ LOCAL EXCHANGE CARRIERS ASSOC,no,,2
ARIZONA,2006,ALGODON CENTER LLLP,no,,6
ARIZONA,2006,ALL ARIZONAS SCHOOL RETIREES ASSN,no,,8
ARIZONA,2006,ALLERGAN,yes,PHARMACEUTICALS & HEALTH PRODUCTS,1
ARIZONA,2006,ALLIANCE BEVERAGE DISTRIBUTING,no,,4
ARIZONA,2006,ALLIANCE FOR MARRIAGE FOUNDATION,yes,,1
ARIZONA,2006,ALLIANCE OF AUTOMOBILE MANUFACTURERS,yes,AUTOMOTIVE,1
ARIZONA,2006,ALLIED WASTE INDUSTRIES INC,yes,,1
ARIZONA,2006,ALLSTATE INSURANCE,yes,INSURANCE,3
ARIZONA,2006,ALLTEL COMMUNICATIONS,no,,1
ARIZONA,2006,ALZHEIMERS ASSOCIATION,yes,HEALTH & WELFARE POLICY,6
ARIZONA,2006,AMBULATORY & URGENT CARE ASSN OF AZ,no,,9
ARIZONA,2006,AMD INC,no,,2
ARIZONA,2006,AMERICAN ACADEMY OF PEDIATRICS-AZ CHAPTER,no,,5
ARIZONA,2006,AMERICAN ASSN FOR NUDE RECREATION (AANR),no,,2
ARIZONA,2006,AMERICAN ASSN OF UNIVERSITY WOMEN,no,,2
ARIZONA,2006,AMERICAN ASSOCIATION OF PUBLISHERS,yes,PRINTING & PUBLISHING,1
ARIZONA,2006,AMERICAN BROTHERHOOD AIMED TOWARD EDUCATION (ABATE) INC,no,,2
ARIZONA,2006,AMERICAN CANCER SOCIETY,yes,HEALTH & WELFARE POLICY,4
ARIZONA,2006,AMERICAN COUNCIL OF ENGINEERING COMPANIES OF AZ (ACEC / AZ),no,,3
ARIZONA,2006,AMERICAN COUNCIL OF LIFE INSURERS,yes,INSURANCE,3
ARIZONA,2006,AMERICAN DIABETES ASSOCIATION,yes,HEALTH & WELFARE POLICY,1
ARIZONA,2006,AMERICAN ENTREPRENEURS,no,,1
ARIZONA,2006,AMERICAN EXPRESS,yes,"MISCELLANEOUS FINANCE, INSURANCE & REAL ESTATE",6
ARIZONA,2006,AMERICAN FAMILY LIFE ASSURANCE CO / AFLAC,yes,INSURANCE,4
ARIZONA,2006,AMERICAN GREYHOUND RACING,yes,GAMBLING & CASINOS,2
ARIZONA,2006,AMERICAN HEART ASSOCIATION,yes,HEALTH & WELFARE POLICY,2
ARIZONA,2006,AMERICAN HOME INSPECTION ASSOCIATION,yes,REAL ESTATE,1
ARIZONA,2006,AMERICAN INSTITUTE OF ARCHITECTS ARIZONA,yes,CONSTRUCTION SERVICES,5
ARIZONA,2006,AMERICAN INSURANCE ASSOCIATION,yes,INSURANCE,3
ARIZONA,2006,AMERICAN INTERNATIONAL GROUP,yes,"MISCELLANEOUS FINANCE, INSURANCE & REAL ESTATE",4
ARIZONA,2006,AMERICAN LEGION DEPARTMENT OF ARIZONA,no,,6
ARIZONA,2006,AMERICAN LIFE STAR,no,,4
ARIZONA,2006,AMERICAN LUNG ASSOCIATION,yes,HEALTH & WELFARE POLICY,3
ARIZONA,2006,AMERICAN PARK N SWAP INC,no,,3
ARIZONA,2006,AMERICAN RESORT DEVELOPMENT ASSOCIATION,yes,,1
ARIZONA,2006,AMERICAN SUBCONTRACTORS ASSOCIATION OF ARIZONA,no,,3
ARIZONA,2006,AMERICAN TRAFFIC SOLUTIONS,yes,MISCELLANEOUS TRANSPORT,2
ARIZONA,2006,AMERICANS FOR TAX REFORM,yes,,2
ARIZONA,2006,AMERICANS UNITED FOR SEPARATION OF CHURCH & STATE,yes,,1
ARIZONA,2006,AMERICAS HEALTH INSURANCE PLANS,yes,INSURANCE,3
ARIZONA,2006,AMERICROWN,no,,1
ARIZONA,2006,AMIGOS TRADE ASSOCIATION,no,,1
ARIZONA,2006,AMITY INC,no,,2
ARIZONA,2006,AMPHITHEATER SCHOOL DISTRICT NO 10,no,,36
ARIZONA,2006,AMYLIN PHARMACEUTICALS,yes,PHARMACEUTICALS & HEALTH PRODUCTS,3
ARIZONA,2006,ANA ADVERTISING SERVICES INC,no,,2
ARIZONA,2006,ANHEUSER-BUSCH,yes,"BEER, WINE & LIQUOR",3
ARIZONA,2006,ANIMAL DEFENSE LEAGUE OF ARIZONA,yes,ANIMAL RIGHTS,3
ARIZONA,2006,ANTI DEFAMATION LEAGUE AZ OFFICE,no,,1
ARIZONA,2006,ANY RAT RESCUE,no,,1
ARIZONA,2006,APACHE COUNTY,no,,3
ARIZONA,2006,APACHE JUNCTION CITY OF,no,,18
ARIZONA,2006,APACHE JUNCTION FIRE DISTRICT,no,,1
ARIZONA,2006,APACHE NITROGEN PRODUCTS INC,no,,3
ARIZONA,2006,APIPA,no,,4
ARIZONA,2006,APOLLO GROUP,yes,EDUCATION,10
ARIZONA,2006,APOTHECARY SHOPS,no,,1
ARIZONA,2006,APPLE INC,yes,COMPUTER EQUIPMENT & SERVICES,3
ARIZONA,2006,AREA AGENCY ON AGING REGION ONE INC,no,,1
ARIZONA,2006,ARIZONA ACADEMY OF FAMILY PHYSICIANS,yes,HEALTH PROFESSIONALS,2
ARIZONA,2006,ARIZONA ADVOCAY GROUP LLC,no,,1
ARIZONA,2006,ARIZONA ASSISTED LIVING FEDERATION OF AMERICA,yes,,2
ARIZONA,2006,ARIZONA ASSOCIATION OF CHIEFS OF POLICE,no,,6
ARIZONA,2006,ARIZONA ASSOCIATION OF HOMES & HOUSING FOR THE AGING,yes,HOSPITALS & NURSING HOMES,6
ARIZONA,2006,ARIZONA ASSOCIATION OF INDUSTRIES,yes,BUSINESS ASSOCIATIONS,3
ARIZONA,2006,ARIZONA ASSOCIATION OF REALTORS,yes,REAL ESTATE,10
ARIZONA,2006,ARIZONA AUTOMOTIVE RECYCLERS ASSOCIATION,no,,1
ARIZONA,2006,ARIZONA BANKERS ASSOCIATION,yes,COMMERCIAL BANKS,7
ARIZONA,2006,ARIZONA BUILDING OFFICIALS,no,,1
ARIZONA,2006,ARIZONA CATTLEMENS ASSOCIATION,yes,LIVESTOCK,3
ARIZONA,2006,ARIZONA CHAMBER OF COMMERCE,yes,BUSINESS ASSOCIATIONS,9
ARIZONA,2006,ARIZONA CONFERENCE OF POLICE & SHERIFFS,yes,,2
ARIZONA,2006,ARIZONA DENTAL ASSOCIATION,yes,HEALTH PROFESSIONALS,6
ARIZONA,2006,ARIZONA DENTAL INSURANCE SERVICE INC,no,,7
ARIZONA,2006,ARIZONA FARM BUREAU,yes,FARM BUREAU,11
ARIZONA,2006,ARIZONA FOOD MARKETING ALLIANCE,yes,FOOD PROCESSING & SALES,2
ARIZONA,2006,ARIZONA FOUNDATION FOR WOMEN,no,,1
ARIZONA,2006,ARIZONA GEOLOGICAL SURVEY (SEE OLD # 900097),no,,1
ARIZONA,2006,ARIZONA HEALTH CARE ASSOCIATION,yes,,3
ARIZONA,2006,ARIZONA HOSPITAL & HEALTHCARE ASSOCIATION,yes,HOSPITALS & NURSING HOMES,7
ARIZONA,2006,ARIZONA HOTEL & LODGING ASSOCIATION,yes,LODGING & TOURISM,2
ARIZONA,2006,ARIZONA HUMAN RIGHTS FUND,yes,GAY/LESBIAN RIGHTS & ISSUES,2
ARIZONA,2006,ARIZONA INDEPENDENT AUTOMOBILE DEALERS ASSOCIATION,no,,1
ARIZONA,2006,ARIZONA LEAGUE OF CONSERVATION VOTERS,yes,,4
ARIZONA,2006,ARIZONA LICENSED BEVERAGE ASSOCIATION,yes,"BEER, WINE & LIQUOR",5
ARIZONA,2006,ARIZONA MEDICAL ASSOCIATION,yes,HEALTH PROFESSIONALS,3
ARIZONA,2006,ARIZONA OSTEOPATHIC MEDICAL ASSOCIATION,yes,HEALTH PROFESSIONALS,10
ARIZONA,2006,ARIZONA PHYSICAL THERAPY ASSOCIATION,yes,HEALTH PROFESSIONALS,6
ARIZONA,2006,ARIZONA POLICE ASSOCIATION,no,,6
ARIZONA,2006,ARIZONA PSYCHOLOGICAL ASSOCIATION,yes,HEALTH PROFESSIONALS,2
ARIZONA,2006,ARIZONA PUBLIC EMPLOYEES COUNCIL 97,yes,PUBLIC SECTOR UNIONS,1
ARIZONA,2006,ARIZONA PUBLIC INTEREST RESEARCH GROUP,yes,CONSUMER GROUPS,1
ARIZONA,2006,ARIZONA PUBLIC SERVICE,yes,ELECTRIC UTILITIES,6
ARIZONA,2006,ARIZONA REPUBLICAN PARTY,yes,PARTY COMMITTEES,2
ARIZONA,2006,ARIZONA RESTAURANT & HOSPITALITY ASSOCIATION,yes,FOOD & BEVERAGE,2
ARIZONA,2006,ARIZONA ROCK PRODUCTS ASSOCIATION,yes,BUILDING MATERIALS & EQUIPMENT,2
ARIZONA,2006,ARIZONA SERVICE EMPLOYEES,no,,2
ARIZONA,2006,ARIZONA SOCIETY OF CPAS,yes,ACCOUNTANTS,4
ARIZONA,2006,ARIZONA SOLAR ENERGY INDUSTRIES ASSOCIATION,no,,3
ARIZONA,2006,ARIZONA STATE AFL-CIO,yes,GENERAL TRADE UNIONS,2
ARIZONA,2006,ARIZONA STATE LODGE FRATERNAL ORDER OF POLICE,yes,PUBLIC SECTOR UNIONS,11
ARIZONA,2006,ARIZONA STATE RETIRED EMPLOYEES ASSOCIATION,no,,1
ARIZONA,2006,ARIZONA THOROUGHBRED DEALERS ASSOCIATION,yes,GAMBLING & CASINOS,2
ARIZONA,2006,ARIZONA WATER INSTITUTE,no,,1
ARIZONA,2006,ARIZONANS FOR ELECTRIC CHOICE & COMPETITION,no,,2
ARIZONA,2006,ARIZONANS FOR NON-SMOKERS RIGHTS,no,,1
ARIZONA,2006,ARSENIC REMEDIATION COALITION LLC,no,,1
ARIZONA,2006,ASARCO LLC,yes,,10
ARIZONA,2006,ASSN FOR BETTER CONSTRUCTION,no,,1
ARIZONA,2006,ASSN OF ARIZONA FOOD BANKS,no,,2
ARIZONA,2006,ASSN OF AZ CHARTER SCHOOLS,no,,3
ARIZONA,2006,ASSOC & SOCIETY INSURANCE CORP,no,,1
ARIZONA,2006,ASSOCIATED GENERAL CONTRACTORS-AZ CHAPTER,no,,5
ARIZONA,2006,ASSOCIATED HIGHWAY PATROLMEN OF ARIZONA,yes,PUBLIC SECTOR UNIONS,4
ARIZONA,2006,ASSOCIATION FOR CAREER TECHNICAL EDUCATION OF AZ ACTEAZ,no,,7
ARIZONA,2006,ASTRAZENECA,yes,PHARMACEUTICALS & HEALTH PRODUCTS,2
ARIZONA,2006,AT&T,yes,TELECOM SERVICES & EQUIPMENT,6
ARIZONA,2006,AUCTION RON BRUNK INC,no,,1
ARIZONA,2006,AUDUBON ARIZONA / NATL AUD SOC,no,,1
ARIZONA,2006,AUTOMOTIVE SERVICE ASSOCIATION OF AZ,no,,1
ARIZONA,2006,AVAYA INC,yes,TELECOM SERVICES & EQUIPMENT,2
ARIZONA,2006,AVIS BUDGET GROUP,yes,AUTOMOTIVE,1
ARIZONA,2006,AVONDALE CITY OF,no,,8
ARIZONA,2006,AZ ACTION FOR THE ARTS,no,,4
ARIZONA,2006,AZ ACUPUNCTURE BOARD OF EXAMINERS,no,,1
ARIZONA,2006,AZ ADVOCACY NETWORK,no,,2
ARIZONA,2006,AZ AGRIBUSINESS & EQUINE CENTER,no,,1
ARIZONA,2006,AZ AGRICULTURAL AVIATION ASSOCIATION,no,,1
ARIZONA,2006,AZ AIDS POLICY ALLIANCE (AZ APA),no,,1
ARIZONA,2006,AZ AIRPORTS ASSOCIATION,no,,6
ARIZONA,2006,AZ ALLIANCE FOR ARTS EDUCATION,no,,2
ARIZONA,2006,AZ ALLIANCE FOR RETIRED AMERICANS,no,,1
ARIZONA,2006,AZ ALZHEIMERS RESEARCH CENTER INC,no,,4
ARIZONA,2006,AZ AMBULANCE ASSN,no,,3
ARIZONA,2006,AZ AMERICAN WATER CO,no,,9
ARIZONA,2006,AZ ARCHAEOLOGY SOCIETY INC,no,,1
ARIZONA,2006,AZ ASSN FOR ECONOMIC DEVELOPMENT,no,,1
ARIZONA,2006,AZ ASSN MANUFACTURED HOME OWNERS,no,,1
ARIZONA,2006,AZ ASSN OF ADVOCATES OF PROPERTY TAX ANALYSTS,no,,3
ARIZONA,2006,AZ ASSN OF ASSESSING OFFICERS,no,,1
ARIZONA,2006,AZ ASSN OF COMMUNITY HEALTH CENTERS,no,,3
ARIZONA,2006,AZ ASSN OF COMMUNITY MANAGERS (AACM),no,,13
ARIZONA,2006,AZ ASSN OF CONSERVATION DISTRICTS,no,,2
ARIZONA,2006,AZ ASSN OF DEFENSE COUNSEL,no,,2
ARIZONA,2006,AZ ASSN OF HEALTH UNDERWRITERS,no,,3
ARIZONA,2006,AZ ASSN OF LAWYERS FOR INJURED WORKERS,no,,8
ARIZONA,2006,AZ ASSN OF MORTGAGE BROKERS,no,,4
ARIZONA,2006,AZ ASSN OF NURSE ANESTHETISTS,no,,1
ARIZONA,2006,AZ ASSN OF PROVIDERS FOR PEOPLE WITH DISABILITIES,no,,2
ARIZONA,2006,AZ ASSN OF SUPERIOR COURT CLERKS,no,,3
ARIZONA,2006,AZ ASSOCIATION FOR HOME CARE,no,,4
ARIZONA,2006,AZ ASSOCIATION OF AREA AGENCIES ON AGING,no,,6
ARIZONA,2006,AZ ASSOCIATION OF CHIROPRACTIC,yes,HEALTH PROFESSIONALS,4
ARIZONA,2006,AZ ASSOCIATION OF COUNTIES,no,,12
ARIZONA,2006,AZ ASSOCIATION OF LICENSED PRIVATE INVESTIGATORS,no,,2
ARIZONA,2006,AZ ASSOCIATION OF SCHOOL BUSINESS OFFICIALS,no,,2
ARIZONA,2006,AZ ASTHMA COALITION,no,,3
ARIZONA,2006,AZ ATTORNEY GENERALS OFFICE,no,,15
ARIZONA,2006,AZ ATTORNEYS FOR CRIMINAL JUSTICE,no,,21
ARIZONA,2006,AZ AUTO GLASS ASSOCIATION,no,,2
ARIZONA,2006,AZ AUTOMATIC MERCHANDISING COUNCIL,no,,2
ARIZONA,2006,AZ AUTOMOBILE ASSOCIATION (AAA),no,,2
ARIZONA,2006,AZ AUTOMOBILE DEALERS ASSOCIATION,yes,,3
ARIZONA,2006,AZ AUTOMOBILE THEFT AUTHORITY,no,,17
ARIZONA,2006,AZ BIOMEDICAL RESEARCH COMMISSION,no,,3
ARIZONA,2006,AZ BOARD OF APPRAISAL,no,,1
ARIZONA,2006,AZ BOARD OF BARBERS,no,,4
ARIZONA,2006,AZ BOARD OF BEHAVIORAL HEALTH EXAMINERS,no,,2
ARIZONA,2006,AZ BOARD OF COSMETOLOGY,no,,1
ARIZONA,2006,AZ BOARD OF EXECUTIVE CLEMENCY,no,,2
ARIZONA,2006,AZ BOARD OF FINGERPRINTING,no,,1
ARIZONA,2006,AZ BOARD OF HOMEOPATHIC MEDICAL EXAMINERS,no,,1
ARIZONA,2006,AZ BOARD OF OSTEOPATHIC EXAMINERS IN MEDICINE & SURGERY,no,,1
ARIZONA,2006,AZ BOARD OF REGENTS,no,,5
ARIZONA,2006,AZ BRIDGE TO INDEPENDENT LIVING (ABIL),no,,5
ARIZONA,2006,AZ BROADCASTERS ASSN,no,,1
ARIZONA,2006,AZ BUILDERS ALLIANCE,no,,1
ARIZONA,2006,AZ BUILDING OWNERS & MANAGERS ASSOC,no,,3
ARIZONA,2006,AZ BUSINESS & EDUCATION COALITION,no,,2
ARIZONA,2006,AZ CAPITOL TIMES / AZ NEWS SERVICE,no,,1
ARIZONA,2006,AZ CAPTIVE INSURANCE ASSN,no,,4
ARIZONA,2006,AZ CARDINALS,no,,7
ARIZONA,2006,AZ CATHOLIC CONFERENCE,no,,1
ARIZONA,2006,AZ CEMETERY ASSOCIATION,yes,,1
ARIZONA,2006,AZ CENTER FOR DISABILITY LAW,no,,5
ARIZONA,2006,AZ CENTER FOR LAW IN THE PUBLIC INTEREST,no,,3
ARIZONA,2006,AZ CENTER FOR TAXPAYER RIGHTS,no,,1
ARIZONA,2006,AZ CHAMBER EXECUTIVES,no,,1
ARIZONA,2006,AZ CHAPTER AMERICAN COLLEGE EMERGENCY PHYSICIANS (AZACEP),no,,1
ARIZONA,2006,AZ CHAPTER NATIONAL ELECTRICAL CONTRACTORS ASSOCIATION,no,,1
ARIZONA,2006,AZ CHAPTER NATIONAL SAFETY COUNCIL,no,,3
ARIZONA,2006,AZ CHAPTER NATL ASSOC OF INDUSTRIAL & OFFICE PROPERTIES,no,,7
ARIZONA,2006,AZ CHAPTER OF THE NATIONAL ACADEMY OF ELDER LAW ATTORNEYS C / O CATHERINE LEAS,no,,12
ARIZONA,2006,AZ CHAPTER PARALYZED VETERANS OF AMERICA,no,,1
ARIZONA,2006,AZ CHILD CARE ASSOCIATION,no,,2
ARIZONA,2006,AZ CHIROPRACTIC SOCIETY,no,,2
ARIZONA,2006,AZ CITIZENS DEFENSE LEAGUE INC,no,,3
ARIZONA,2006,AZ CITIZENS FOR THE ARTS,no,,2
ARIZONA,2006,AZ CLEAN FUELS YUMA LLC,no,,2
ARIZONA,2006,AZ CLEAN POWER ALLIANCE,no,,2
ARIZONA,2006,AZ COALITION AGAINST DOMESTIC VIOLENCE,no,,1
ARIZONA,2006,AZ COALITION FOR AFFORDABLE ACCOUNTING,no,,1
ARIZONA,2006,AZ COALITION TO END HOMELESSNESS,no,,5
ARIZONA,2006,AZ COLLECTORS ASSOCIATION,no,,3
ARIZONA,2006,AZ COLLISION CRAFTSMENS ASSN,no,,1
ARIZONA,2006,AZ COMMERCIAL MORTGAGE LENDERS ASSN,no,,2
ARIZONA,2006,AZ COMMISSION FOR POSTSECONDARY EDUCATION,no,,1
ARIZONA,2006,AZ COMMISSION FOR THE DEAF & HARD OF HEARING,no,,4
ARIZONA,2006,AZ COMMISSION OF INDIAN AFFAIRS,no,,1
ARIZONA,2006,AZ COMMISSION ON THE ARTS,no,,1
ARIZONA,2006,AZ COMMISSION ON UNIFORM STATE LAWS,no,,5
ARIZONA,2006,AZ COMMON SENSE INC,no,,2
ARIZONA,2006,AZ COMMUNITY ACTION ASSN,no,,1
ARIZONA,2006,AZ COMMUNITY ASSN BAR ASSN,no,,1
ARIZONA,2006,AZ COMMUNITY COLLEGE ASSOCIATION,no,,3
ARIZONA,2006,AZ COMMUNITY FINANCIAL SERVICES ASSN,no,,1
ARIZONA,2006,AZ COMPETITIVE POWER ALLIANCE,no,,1
ARIZONA,2006,AZ COMPETITIVE TELECOMMUNICATIONS COALITION,no,,2
ARIZONA,2006,AZ CONCRETE CONTRACTORS ASSOC (NEW NUMBER),no,,1
ARIZONA,2006,AZ CONFEDERATION OF MOTORCYCLE CLUBS,no,,2
ARIZONA,2006,AZ CONSORTIUM FOR CHILDREN CHRONIC ILLNESS (ACCCI),no,,2
ARIZONA,2006,AZ CONTRACTORS ASSOCIATION,yes,,3
ARIZONA,2006,AZ CORPORATION COMMISSION,no,,17
ARIZONA,2006,AZ COTTON GROWERS ASSOCIATION,yes,,1
ARIZONA,2006,AZ COTTON RESEARCH & PROTECTION COUNCIL,no,,2
ARIZONA,2006,AZ COUNCIL OF HUMAN SERVICES PROVIDERS,no,,5
ARIZONA,2006,AZ COUNSELORS ASSOCIATION,no,,1
ARIZONA,2006,AZ COURT REPORTERS ASSOCIATION,yes,,1
ARIZONA,2006,AZ CREDIT UNION LEAGUE INC,yes,,6
ARIZONA,2006,AZ CRIMINAL JUSTICE COMMISSION,no,,2
ARIZONA,2006,AZ CROP PROTECTION ASSN,no,,3
ARIZONA,2006,AZ DEPARTMENT OF HOMELAND SECURITY,no,,2
ARIZONA,2006,AZ DEPARTMENT OF HOUSING,no,,6
ARIZONA,2006,AZ DEPARTMENT OF VETERANS SERVICES,no,,2
ARIZONA,2006,AZ DEPT OF ADMINISTRATION,no,,4
ARIZONA,2006,AZ DEPT OF AGRICULTURE,no,,10
ARIZONA,2006,AZ DEPT OF COMMERCE,no,,5
ARIZONA,2006,AZ DEPT OF CORRECTIONS,no,,3
ARIZONA,2006,AZ DEPT OF ECONOMIC SECURITY,no,,7
ARIZONA,2006,AZ DEPT OF EDUCATION,no,,43
ARIZONA,2006,AZ DEPT OF EMERGENCY & MILITARY AFFAIRS,no,,6
ARIZONA,2006,AZ DEPT OF ENVIRONMENTAL QUALITY,no,,3
ARIZONA,2006,AZ DEPT OF FINANCIAL INSTITUTIONS,no,,6
ARIZONA,2006,AZ DEPT OF GAMING,no,,7
ARIZONA,2006,AZ DEPT OF HEALTH SERVICES,no,,6
ARIZONA,2006,AZ DEPT OF INSURANCE,no,,2
ARIZONA,2006,AZ DEPT OF JUVENILE CORRECTIONS,no,,5
ARIZONA,2006,AZ DEPT OF LIQUOR LICENSES & CONTROL,no,,4
ARIZONA,2006,AZ DEPT OF PUBLIC SAFETY,no,,36
ARIZONA,2006,AZ DEPT OF RACING,no,,4
ARIZONA,2006,AZ DEPT OF REAL ESTATE,no,,1
ARIZONA,2006,AZ DEPT OF REVENUE,no,,10
ARIZONA,2006,AZ DEPT OF TRANSPORTATION,no,,21
ARIZONA,2006,AZ DEPT OF WATER RESOURCES,no,,3
ARIZONA,2006,AZ DEPT OF WEIGHTS & MEASURES,no,,1
ARIZONA,2006,AZ DIAMONDBACKS,no,,2
ARIZONA,2006,AZ DISTANCE EDUCATION ASSN,no,,2
ARIZONA,2006,AZ EARLY CHILDHOOD DEVELOPMENT & HEALTH BOARD,no,,2
ARIZONA,2006,AZ EDUCATION ASSOCIATION,yes,,7
ARIZONA,2006,AZ ELECTRIC POWER COOPERATIVE INC,no,,20
ARIZONA,2006,AZ EMERGENCY NURSES ASSN,no,,9
ARIZONA,2006,AZ EMPLOYERS FOR IMMIGRATION REFORM,no,,9
ARIZONA,2006,AZ EXPOSITION & STATE FAIR,no,,2
ARIZONA,2006,AZ FAMILIES FOR HOME EDUCATION,no,,1
ARIZONA,2006,AZ FAMILY PLANNING COUNCIL,no,,1
ARIZONA,2006,AZ FEDERATION OF BUSINESS & PROFESSIONAL WOMEN INC,no,,1
ARIZONA,2006,AZ FEDERATION OF TAXPAYERS ASSOCIATION,no,,2
ARIZONA,2006,AZ FILM & MEDIA COALITION,no,,1
ARIZONA,2006,AZ FINANCIAL SERVICES ASSN,no,,1
ARIZONA,2006,AZ FIRE DISTRICT ASSOCIATION,no,,3
ARIZONA,2006,AZ FLOODPLAIN MANAGEMENT ASSN,no,,2
ARIZONA,2006,AZ FOUNDATION FOR BEHAVIORAL HEALTH,no,,1
ARIZONA,2006,AZ FOUNDATION FOR LEGAL SERVICES & EDUCATION,no,,2
ARIZONA,2006,AZ FREE ENTERPRISE CLUB,no,,1
ARIZONA,2006,AZ FUELING FACILITIES CORPORATION,no,,1
ARIZONA,2006,AZ FUNERAL DIRECTORS ASSOCIATION,no,,6
ARIZONA,2006,AZ GAME & FISH DEPT,no,,4
ARIZONA,2006,AZ GOVERNORS OFFICE,no,,25
ARIZONA,2006,AZ HEALTH CARE COST CONTAINMENT SYSTEM,no,,6
ARIZONA,2006,AZ HEALTH FACILITIES AUTHORITY,no,,2
ARIZONA,2006,AZ HEART FOUNDATION,no,,2
ARIZONA,2006,AZ HERITAGE ALLIANCE,no,,15
ARIZONA,2006,AZ HIGHER EDUCATION LOAN AUTHORITY (AHELA),no,,1
ARIZONA,2006,AZ HISTORICAL FOUNDATION,no,,4
ARIZONA,2006,AZ HISTORICAL SOCIETY,no,,6
ARIZONA,2006,AZ HOME INSPECTORS COALITION,no,,2
ARIZONA,2006,AZ HOMEOPATHIC & INTEGRATIVE MEDICAL ASSOCIATION,yes,,4
ARIZONA,2006,AZ HORSEMENS BENEVOLENT & PROTECTIVE ASSN INC,no,,5
ARIZONA,2006,AZ HOUSING COMMISSION,no,,2
ARIZONA,2006,AZ HOUSING FINANCE AUTHORITY,no,,3
ARIZONA,2006,AZ HUMANE SOCIETY,no,,7
ARIZONA,2006,AZ INDIAN GAMING ASSN,no,,2
ARIZONA,2006,AZ INTERLOCK DISTRIBUTORS ASSN,no,,1
ARIZONA,2006,AZ INTERSCHOLASTIC ASSN,no,,2
ARIZONA,2006,AZ INVESTMENT COUNCIL,no,,2
ARIZONA,2006,AZ INVESTORS LENDERS & TRUSTEES ASSOC,no,,1
ARIZONA,2006,AZ JUDGES ASSN,no,,1
ARIZONA,2006,AZ JUDICIAL COUNCIL,no,,6
ARIZONA,2006,AZ JUSTICE OF THE PEACE ASSOCIATION,no,,1
ARIZONA,2006,AZ KIDNEY FOUNDATION,no,,3
ARIZONA,2006,AZ LAND & RANCHES INC,no,,1
ARIZONA,2006,AZ LAND DEVELOPMENT INC,no,,3
ARIZONA,2006,AZ LANDSCAPE CONTRACTORS ASSN,no,,1
ARIZONA,2006,AZ LIBRARY ASSOCIATION,no,,2
ARIZONA,2006,AZ LOCAL GOVERNMENT EMPLOYEE BENEFIT TRUST,no,,2
ARIZONA,2006,AZ MASSAGE THERAPY ASSOCIATION,no,,6
ARIZONA,2006,AZ MEDICAL BOARD,no,,2
ARIZONA,2006,AZ MINING ASSOCIATION,yes,,5
ARIZONA,2006,AZ MORTGAGE LENDERS ASSOCIATION,no,,6
ARIZONA,2006,AZ MULTIHOUSING ASSOCIATION,yes,,4
ARIZONA,2006,AZ MUNICIPAL POWER USERS ASSN,no,,2
ARIZONA,2006,AZ MUNICIPAL WATER USERS ASSN,no,,5
ARIZONA,2006,AZ NATIONAL ORGANIZATION FOR WOMEN (NOW),no,,2
ARIZONA,2006,AZ NATUROPATHIC MEDICAL ASSN,no,,2
ARIZONA,2006,AZ NAVIGABLE STREAM ADJUDICATION COMM,no,,1
ARIZONA,2006,AZ NEWSPAPERS ASSN,no,,6
ARIZONA,2006,AZ NURSERY ASSOCIATION,no,,1
ARIZONA,2006,AZ NURSES ASSOCIATION,yes,,6
ARIZONA,2006,AZ OFF-HWY VEHICLE COALITION,no,,2
ARIZONA,2006,AZ OFFICE OF TOURISM,no,,1
ARIZONA,2006,AZ OPTHALMOLOGICAL SOCIETY,no,,1
ARIZONA,2006,AZ OPTOMETRIC ASSN,no,,6
ARIZONA,2006,AZ OSTEOPOROSIS COALITION,no,,2
ARIZONA,2006,AZ PARENT TEACHER ASSN (PTA),no,,3
ARIZONA,2006,AZ PARTNERS FOR ABSTINENCE EDUCATION INC,no,,1
ARIZONA,2006,AZ PAWN BROKERS ASSN,no,,1
ARIZONA,2006,AZ PAYPHONE ASSN,no,,3
ARIZONA,2006,AZ PEACE OFFICER STANDARDS / TRAINING BOARD (AZ POST),no,,1
ARIZONA,2006,AZ PEST MANAGEMENT ASSOCIATION,no,,2
ARIZONA,2006,AZ PETROLEUM MARKETERS ASSN,no,,1
ARIZONA,2006,AZ PHARMACY ALLIANCE,no,,11
ARIZONA,2006,AZ PLANNING ASSOCIATION,no,,1
ARIZONA,2006,AZ PODIATRIC MEDICAL ASSOCIATION,yes,,4
ARIZONA,2006,AZ PORTLAND CEMENT CO,no,,1
ARIZONA,2006,AZ POWER AUTHORITY,no,,4
ARIZONA,2006,AZ POWERSPORT INDUSTRY ASSOCIATION,no,,5
ARIZONA,2006,AZ PRIVATE SCHOOL ASSOCIATION,yes,,2
ARIZONA,2006,AZ PRODUCTION CAPITOL LLC,no,,2
ARIZONA,2006,AZ PROFESSIONAL TOWING & RECOVERY ASSN INC,no,,9
ARIZONA,2006,AZ PROPANE GAS ASSOCIATION,no,,2
ARIZONA,2006,AZ PROSECUTING ATTORNEYS ADVISORY COUNCIL,no,,2
ARIZONA,2006,AZ PSYCHIATRIC SOCIETY,no,,5
ARIZONA,2006,AZ PUBLIC DEFENDERS ASSOCIATION,no,,2
ARIZONA,2006,AZ PUBLIC HEALTH ASSOCIATION,no,,4
ARIZONA,2006,AZ PUBLIC SERVICE COMPANY (APS),no,,28
ARIZONA,2006,AZ RACETRACK ALLIANCE,no,,1
ARIZONA,2006,AZ RADIATION REGULATORY AGENCY,no,,3
ARIZONA,2006,AZ RADIOLOGICAL SOCIETY,yes,HEALTH PROFESSIONALS,7
ARIZONA,2006,AZ RAIL PASSENGER ASSOCIATION,no,,2
ARIZONA,2006,AZ REAL ESTATE INVESTORS ASSOC,no,,2
ARIZONA,2006,AZ RECREATIONAL VEHICLE DEALERS ASSN,no,,4
ARIZONA,2006,AZ REGISTRAR OF CONTRACTORS,no,,8
ARIZONA,2006,AZ RETAILERS ASSOCIATION,yes,RETAIL SALES,2
ARIZONA,2006,AZ RETIREE HEALTH CARE CONSORTIUM,no,,2
ARIZONA,2006,AZ ROOFING CONTRACTORS ASSN,no,,1
ARIZONA,2006,AZ RURAL SCHOOLS ASSOCIATION,no,,1
ARIZONA,2006,AZ RURAL WATER ASSN,no,,1
ARIZONA,2006,AZ SCHOLARSHIP FUND INC,no,,1
ARIZONA,2006,AZ SCHOOL ADMINISTRATORS ASSOC,no,,2
ARIZONA,2006,AZ SCHOOL BOARDS ASSOCIATION,no,,11
ARIZONA,2006,AZ SCHOOL FACILITIES BOARD,no,,2
ARIZONA,2006,AZ SCHOOL HEALTH INSURANCE PROGRAM,no,,5
ARIZONA,2006,AZ SCHOOL RISK RETENTION TRUST,no,,5
ARIZONA,2006,AZ SCHOOL-BASED HEALTH CARE COUNCIL,no,,1
ARIZONA,2006,AZ SCRAP RECYCLERS ASSOC,no,,3
ARIZONA,2006,AZ SECRETARY OF STATE,no,,6
ARIZONA,2006,AZ SELF-INSURERS ASSOC,no,,1
ARIZONA,2006,AZ SELF-STORAGE ASSOCIATION,no,,3
ARIZONA,2006,AZ SHORT LINE RAILROAD ASSN,no,,1
ARIZONA,2006,AZ SMALL BUSINESS ASSN,no,,3
ARIZONA,2006,AZ SMALL UTILITIES ASSOCIATION,no,,4
ARIZONA,2006,AZ SOCIETY FOR RESPIRATORY CARE,no,,4
ARIZONA,2006,AZ SOCIETY OF COSMETIC SURGEONS,no,,1
ARIZONA,2006,AZ SOCIETY OF PATHOLOGISTS,no,,2
ARIZONA,2006,AZ SOLAR ENERGY ASSN,no,,1
ARIZONA,2006,AZ SPEECH-LANGUAGE-HEARING ASSOCIATION,no,,1
ARIZONA,2006,AZ SPORTS & TOURISM AUTHORITY (AZSTA),no,,1
ARIZONA,2006,AZ SPORTSERVICE INC,no,,1
ARIZONA,2006,AZ SPORTSMEN FOR WILDLIFE,no,,4
ARIZONA,2006,AZ STATE ASSN OF PHYSICIAN ASSISTANTS,no,,1
ARIZONA,2006,AZ STATE AUCTIONEERS ASSOCIATION,no,,1
ARIZONA,2006,AZ STATE BLDG & CONSTRUCTION TRADES COUNCIL,no,,1
ARIZONA,2006,AZ STATE BOARD FOR CHARTER SCHOOLS,no,,2
ARIZONA,2006,AZ STATE BOARD FOR PRIVATE POSTSECONDARY ED,no,,1
ARIZONA,2006,AZ STATE BOARD FUNERAL DIR & EMBALMERS,no,,8
ARIZONA,2006,AZ STATE BOARD OF ACCOUNTANCY,no,,9
ARIZONA,2006,AZ STATE BOARD OF ACCUPATIONAL THERAPY,no,,5
ARIZONA,2006,AZ STATE BOARD OF ATHLETIC TRAINING,no,,4
ARIZONA,2006,AZ STATE BOARD OF CHIROPRACTIC EXAMINERS,no,,8
ARIZONA,2006,AZ STATE BOARD OF DENTAL EXAMINERS,no,,2
ARIZONA,2006,AZ STATE BOARD OF DISPENSING OPTICIANS,no,,1
ARIZONA,2006,AZ STATE BOARD OF EDUCATION,no,,3
ARIZONA,2006,AZ STATE BOARD OF OPTOMETRY,no,,6
ARIZONA,2006,AZ STATE BOARD OF PHARMACY,no,,1
ARIZONA,2006,AZ STATE BOARD OF PHYSICAL THERAPY EXAMINERS,no,,2
ARIZONA,2006,AZ STATE BOARD OF PODIATRY EXAMINERS,no,,2
ARIZONA,2006,AZ STATE BOARD OF PSYCHOLOGIST EXAMINERS,no,,2
ARIZONA,2006,AZ STATE BOARD OF TECHNICAL REGISTRATION,no,,2
ARIZONA,2006,AZ STATE CONTRACTORS COALITION (ASCC),no,,3
ARIZONA,2006,AZ STATE DENTAL HYGIENISTS ASSOCIATION,yes,,9
ARIZONA,2006,AZ STATE HUMAN RESOURCES MANAGEMENT ASSN,no,,1
ARIZONA,2006,AZ STATE LAND DEPARTMENT,no,,6
ARIZONA,2006,AZ STATE LOTTERY,no,,3
ARIZONA,2006,AZ STATE MINE INSPECTOR,no,,1
ARIZONA,2006,AZ STATE PARKS,no,,3
ARIZONA,2006,AZ STATE PERSONNEL BOARD,no,,3
ARIZONA,2006,AZ STATE RETIREMENT SYSTEM,no,,4
ARIZONA,2006,AZ STATE RIFLE & PISTOL ASSN,no,,3
ARIZONA,2006,AZ STATE SCHOOLS FOR DEAF & BLIND,no,,1
ARIZONA,2006,AZ STATE SOCIETY OF ENROLLED AGENTS,no,,1
ARIZONA,2006,AZ STATE TREASURERS OFFICE,no,,3
ARIZONA,2006,AZ STATE UNIVERSITY,no,,6
ARIZONA,2006,AZ STATE UNIVERSITY RETIREES ASSN,no,,6
ARIZONA,2006,AZ STATE VETERINARY MEDICAL EXAMINING BOARD,no,,1
ARIZONA,2006,AZ STRUCTURAL PEST CONTROL COMMISSION,no,,2
ARIZONA,2006,AZ STUDENTS ASSN,no,,2
ARIZONA,2006,AZ TAX RESEARCH ASSN,no,,4
ARIZONA,2006,AZ TECHNOLOGY COUNCIL,yes,,1
ARIZONA,2006,AZ TELECOMMUNICATIONS & INFORMATION COUNCIL,no,,1
ARIZONA,2006,AZ TELEPHONE CO,no,,1
ARIZONA,2006,AZ THEATRE OWNERS ASSN,no,,1
ARIZONA,2006,AZ TOURISM ALLIANCE,no,,2
ARIZONA,2006,AZ TRANSIT ASSOCIATION,no,,1
ARIZONA,2006,AZ TRAVEL INDUSTRY ASSN (ATIA),no,,1
ARIZONA,2006,AZ TRAVEL PARKS ASSN,no,,1
ARIZONA,2006,AZ TRIAL LAWYERS ASSOCIATION,yes,,39
ARIZONA,2006,AZ TRUCKING ASSOCIATION,no,,2
ARIZONA,2006,AZ TRUSTEE ASSN,no,,1
ARIZONA,2006,AZ VETERINARY MEDICAL ASSOCIATION,yes,,6
ARIZONA,2006,AZ WATER CO,no,,1
ARIZONA,2006,AZ WATER CONSORTIUM,no,,2
ARIZONA,2006,AZ WATER WELL ASSOCIATION,no,,2
ARIZONA,2006,AZ WESTERN COLLEGE,no,,1
ARIZONA,2006,AZ WHEAT GROWERS ASSN,no,,1
ARIZONA,2006,AZ WILDLIFE FEDERATION,no,,8
ARIZONA,2006,AZ WINE GROWERS ASSN,no,,7
ARIZONA,2006,AZ WING CIVIL AIR PATROL,no,,3
ARIZONA,2006,AZ-NM CABLE COMMUNICATIONS ASSN,no,,1
ARIZONA,2006,AZTEC LAND & CATTLE CO LTD,no,,1
ARIZONA,2006,B P AMOCO-WEST COAST EXTERNAL AFFAIRS,no,,2
ARIZONA,2006,BAIRD WILLLIAMS & GREER LLP,no,,2
ARIZONA,2006,BALSZ SCHOOL DISTRICT 31,no,,4
ARIZONA,2006,BANK OF AMERICA,yes,COMMERCIAL BANKS,3
ARIZONA,2006,BANNER HEALTH ARIZONA,no,,18
ARIZONA,2006,BARRETT-JACKSON AUCTION COMPANY LLC,no,,1
ARIZONA,2006,BAYER AG,yes,PHARMACEUTICALS & HEALTH PRODUCTS,2
ARIZONA,2006,BEER & WINE DISTRIBUTORS OF ARIZONA,yes,"BEER, WINE & LIQUOR",1
ARIZONA,2006,BELLA VISTA WATER CO,no,,1
ARIZONA,2006,BHHS LEGACY FOUNDATION,no,,2
ARIZONA,2006,BHP COPPER INC,no,,10
ARIZONA,2006,BISBEE CITY OF,no,,1
ARIZONA,2006,BLACKWATER COMMUNITY SCHOOL,no,,2
ARIZONA,2006,BLOOD SYSTEMS INC,no,,5
ARIZONA,2006,BLUE CROSS & BLUE SHIELD OF AZ,yes,,11
ARIZONA,2006,BNSF RAILWAY,yes,RAILROADS,3
ARIZONA,2006,BOEING CO,yes,AIR TRANSPORT,2
ARIZONA,2006,BOYS & GIRLS CLUBS OF AMERICA,no,NONPROFIT INSTITUTIONS,1
ARIZONA,2006,BRADSHAW PUBLIC RELATIONS CO,no,,1
ARIZONA,2006,BRONLEN FINANCIAL GROUP LLC,no,,1
ARIZONA,2006,BROPHY COMMUNITY FOUNDATION,no,,3
ARIZONA,2006,BRUNDAGE MANAGEMENT,yes,BUSINESS SERVICES,1
ARIZONA,2006,BUCKEYE TOWN OF,no,,2
ARIZONA,2006,BUCKEYE WATER CONSERVATION & DRAINAGE DIST,no,,1
ARIZONA,2006,BUDGET RENTAL CAR,no,,1
ARIZONA,2006,BULLHEAD CITY,no,,3
ARIZONA,2006,BURCH & CRACCHIOLO PA,no,,6
ARIZONA,2006,BURNS & ASSOCS INC,no,,1
ARIZONA,2006,CALJET OF AMERICA LLC,no,,2
ARIZONA,2006,CAMP VERDE TOWN OF,no,,11
ARIZONA,2006,CAPITOL BANCORP LTD,no,,1
ARIZONA,2006,CARE 1ST HEALTH PLAN OF ARIZONA INC,no,,1
