State,Year,Name,Active,Industry,Number of Lobbyists
ARIZONA,2011,AMAZON.COM,yes,RETAIL SALES,4
ARIZONA,2011,AMBULATORY & URGENT CARE ASSN OF AZ,no,,9
ARIZONA,2011,AMERESCO,yes,MISCELLANEOUS ENERGY,3
ARIZONA,2011,AMERICAN ACADEMY OF PEDIATRICS-AZ CHAPTER,no,,5
ARIZONA,2011,AMERICAN ASSN FOR NUDE RECREATION (AANR),no,,2
ARIZONA,2011,AMERICAN BOARD FOR CERTIFICATION OF TEACHER,no,,2
ARIZONA,2011,AMERICAN BROTHERHOOD AIMED TOWARD EDUCATION (ABATE) INC,no,,2
ARIZONA,2011,AMERICAN CANCER SOCIETY,yes,HEALTH & WELFARE POLICY,4
ARIZONA,2011,AMERICAN COALITION FOR CLEAN COAL ELECTRICITY,yes,MINING,1
ARIZONA,2011,AMERICAN CONGRESS OF OBSTETRICIANS & GYNECOLOGIST,no,,1
ARIZONA,2011,AMERICAN COUNCIL OF ENGINEERING COMPANIES OF AZ (ACEC / AZ),no,,3
ARIZONA,2011,AMERICAN COUNCIL OF LIFE INSURERS,yes,INSURANCE,3
ARIZONA,2011,AMERICAN DIABETES ASSOCIATION,yes,HEALTH & WELFARE POLICY,1
ARIZONA,2011,AMERICAN EXPRESS,yes,"MISCELLANEOUS FINANCE, INSURANCE & REAL ESTATE",2
ARIZONA,2011,AMERICAN FAMILY LIFE ASSURANCE CO / AFLAC,yes,INSURANCE,5
ARIZONA,2011,AMERICAN FEDERATION FOR CHILDREN,yes,PUBLIC EDUCATION POLICY,4
ARIZONA,2011,AMERICAN GREYHOUND RACING,yes,GAMBLING & CASINOS,2
ARIZONA,2011,AMERICAN HEART ASSOCIATION,yes,HEALTH & WELFARE POLICY,4
ARIZONA,2011,AMERICAN INSTITUTE OF ARCHITECTS ARIZONA,yes,CONSTRUCTION SERVICES,10
ARIZONA,2011,AMERICAN INSURANCE ASSOCIATION,yes,INSURANCE,3
ARIZONA,2011,AMERICAN INTERNATIONAL GROUP INC AIG,no,,4
ARIZONA,2011,AMERICAN LEGION DEPARTMENT OF ARIZONA,no,,9
ARIZONA,2011,AMERICAN LIFE STAR,no,,5
ARIZONA,2011,AMERICAN LUNG ASSOCIATION,yes,HEALTH & WELFARE POLICY,3
ARIZONA,2011,AMERICAN MAGLEV TECHNOLOGY (AMT),no,,2
ARIZONA,2011,AMERICAN MEDICAL COLLEGE OF HOMEOPATHY,no,,2
ARIZONA,2011,AMERICAN MEDICAL RESPONSE,yes,HEALTH SERVICES,1
ARIZONA,2011,AMERICAN PARK N SWAP INC,no,,2
ARIZONA,2011,AMERICAN RESORT DEVELOPMENT ASSOCIATION,yes,,3
ARIZONA,2011,AMERICAN SUBCONTRACTORS ASSOCIATION OF ARIZONA,no,,3
ARIZONA,2011,AMERICAN TRAFFIC SOLUTIONS,yes,MISCELLANEOUS TRANSPORT,3
ARIZONA,2011,AMERICANS FOR PROSPERITY AZ,no,,3
ARIZONA,2011,AMERICANS FOR TAX REFORM,yes,,2
ARIZONA,2011,AMERICANS UNITED FOR SEPARATION OF CHURCH & STATE,yes,,2
ARIZONA,2011,AMERICAS HEALTH INSURANCE PLANS,yes,INSURANCE,3
ARIZONA,2011,AMERICROWN,no,,1
ARIZONA,2011,AMERIGROUP CORP,yes,HEALTH SERVICES,2
ARIZONA,2011,AMIGOS TRADE ASSOCIATION,no,,1
ARIZONA,2011,AMITY INC,no,,2
ARIZONA,2011,AMPHITHEATER SCHOOL DISTRICT NO 10,no,,37
ARIZONA,2011,ANA ADVERTISING SERVICES INC,no,,2
ARIZONA,2011,ANHEUSER-BUSCH,yes,"BEER, WINE & LIQUOR",3
ARIZONA,2011,ANIMAL DEFENSE LEAGUE OF ARIZONA,yes,ANIMAL RIGHTS,3
ARIZONA,2011,APACHE COUNTY,no,,3
ARIZONA,2011,APACHE JUNCTION UNIFIED SCHOOL DISTRICT,no,,3
ARIZONA,2011,"APACHE JUNCTION, CITY OF",no,,6
ARIZONA,2011,APACHE NITROGEN PRODUCTS INC,no,,3
ARIZONA,2011,APIPA,no,,3
ARIZONA,2011,APOLLO GROUP,yes,EDUCATION,15
ARIZONA,2011,"APOTHECARY SHOP OF DEER VALLEY, INC.",no,,1
ARIZONA,2011,APPLE INC,yes,COMPUTER EQUIPMENT & SERVICES,1
ARIZONA,2011,ARAMARK CORP,yes,MISCELLANEOUS SERVICES,5
ARIZONA,2011,ARC OF ARIZONA INC,no,,4
ARIZONA,2011,"ARCHITECTURE, DAVID HUNT",no,,1
ARIZONA,2011,ARCUS PRIVATE CAPITAL SOLUTIONS LLC,no,,1
ARIZONA,2011,AREA AGENCY ON AGING REGION ONE INC,no,,1
ARIZONA,2011,AREVA INC,yes,,3
ARIZONA,2011,ARIZONA ACADEMY OF FAMILY PHYSICIANS,yes,HEALTH PROFESSIONALS,2
ARIZONA,2011,ARIZONA ASSISTED LIVING FEDERATION OF AMERICA,yes,HOSPITALS & NURSING HOMES,3
ARIZONA,2011,ARIZONA ASSOCIATION OF CHIEFS OF POLICE,no,,7
ARIZONA,2011,ARIZONA ASSOCIATION OF REALTORS,yes,REAL ESTATE,8
ARIZONA,2011,ARIZONA BAIL BONDSMEN ASSOCIATION,no,,1
ARIZONA,2011,ARIZONA BANKERS ASSOCIATION,yes,COMMERCIAL BANKS,3
ARIZONA,2011,ARIZONA CHAMBER OF COMMERCE,yes,BUSINESS ASSOCIATIONS,8
ARIZONA,2011,ARIZONA CHARTER SCHOOLS ASSOCIATION,yes,,2
ARIZONA,2011,ARIZONA CLEAN & BEAUTIFUL,no,,2
ARIZONA,2011,ARIZONA COLLECTORS ASSOCIATION,no,,1
ARIZONA,2011,ARIZONA CONCERNS OF POLICE SURVIVORS,no,,4
ARIZONA,2011,ARIZONA CONFERENCE OF POLICE & SHERIFFS,yes,PUBLIC SECTOR UNIONS,1
ARIZONA,2011,ARIZONA CORRECTIONAL PEACE OFFICERS ASSOCIATION,yes,PUBLIC SECTOR UNIONS,6
ARIZONA,2011,ARIZONA CREDITORS BAR ASSOCIATION,no,,1
ARIZONA,2011,ARIZONA DENTAL ASSOCIATION,yes,HEALTH PROFESSIONALS,3
ARIZONA,2011,ARIZONA EDUCATION NETWORK,no,,6
ARIZONA,2011,ARIZONA FARM BUREAU,yes,FARM BUREAU,14
ARIZONA,2011,ARIZONA FIRE CHIEFS ASSOC,no,,1
ARIZONA,2011,ARIZONA FOOD MARKETING ALLIANCE,yes,FOOD PROCESSING & SALES,2
ARIZONA,2011,ARIZONA FOUNDATION FOR WOMEN,no,,1
ARIZONA,2011,ARIZONA GEOLOGICAL SURVEY,no,,1
ARIZONA,2011,ARIZONA GRAIN INC,yes,AGRICULTURAL SERVICES & PRODUCTS,1
ARIZONA,2011,ARIZONA GRAIN RESEARCH & PROMOTION COUNCIL,no,,1
ARIZONA,2011,ARIZONA HEALTH CARE ASSOCIATION,yes,HOSPITALS & NURSING HOMES,3
ARIZONA,2011,ARIZONA HOSPITAL & HEALTHCARE ASSOCIATION,yes,HOSPITALS & NURSING HOMES,7
ARIZONA,2011,ARIZONA HOTEL & LODGING ASSOCIATION,yes,LODGING & TOURISM,3
ARIZONA,2011,ARIZONA HUMAN RIGHTS FUND,yes,HUMAN RIGHTS,8
ARIZONA,2011,ARIZONA INDEPENDENT AUTOMOBILE DEALERS ASSOCIATION,no,,1
ARIZONA,2011,ARIZONA LEAGUE OF CONSERVATION VOTERS,yes,PRO-ENVIRONMENTAL POLICY,1
ARIZONA,2011,ARIZONA LICENSED BEVERAGE ASSOCIATION,yes,"BEER, WINE & LIQUOR",5
ARIZONA,2011,ARIZONA MEDICAL ASSOCIATION,yes,HEALTH PROFESSIONALS,3
ARIZONA,2011,ARIZONA MEDICAL MARIJUANA ASSOCIATION,no,,1
ARIZONA,2011,ARIZONA OSTEOPATHIC MEDICAL ASSOCIATION,yes,HEALTH PROFESSIONALS,8
ARIZONA,2011,"ARIZONA PARKING SOLUTIONS, INC.",no,,1
ARIZONA,2011,ARIZONA PERINATAL TRUST,no,,1
ARIZONA,2011,ARIZONA PEST PROFESSIONAL ORGANIZATION,no,,1
ARIZONA,2011,ARIZONA PHYSICAL THERAPY ASSOCIATION,yes,HEALTH PROFESSIONALS,1
ARIZONA,2011,ARIZONA POLICE ASSOCIATION,no,,4
ARIZONA,2011,ARIZONA PORK COUNCIL,yes,LIVESTOCK,1
ARIZONA,2011,ARIZONA PSYCHOLOGICAL ASSOCIATION,yes,HEALTH PROFESSIONALS,2
ARIZONA,2011,ARIZONA PUBLIC EMPLOYEES COUNCIL 97,yes,PUBLIC SECTOR UNIONS,2
ARIZONA,2011,ARIZONA PUBLIC INTEREST RESEARCH GROUP,yes,CONSUMER GROUPS,3
ARIZONA,2011,ARIZONA PUBLIC SERVICE,yes,ELECTRIC UTILITIES,10
ARIZONA,2011,ARIZONA REPUBLICAN PARTY,yes,PARTY COMMITTEES,3
ARIZONA,2011,ARIZONA RESTAURANT & HOSPITALITY ASSOCIATION,yes,FOOD & BEVERAGE,2
ARIZONA,2011,ARIZONA ROCK PRODUCTS ASSOCIATION,yes,BUILDING MATERIALS & EQUIPMENT,2
ARIZONA,2011,ARIZONA SERVICE EMPLOYEES,no,,1
ARIZONA,2011,ARIZONA SMALL BUSINESS ASSOCIATION,no,,1
ARIZONA,2011,ARIZONA SOCIETY OF ANESTHESIOLOGISTS,no,,1
ARIZONA,2011,ARIZONA SOCIETY OF CPAS,yes,ACCOUNTANTS,8
ARIZONA,2011,ARIZONA SOLAR ENERGY INDUSTRIES ASSOCIATION,no,MISCELLANEOUS ENERGY,2
ARIZONA,2011,ARIZONA STATE AFL-CIO,yes,GENERAL TRADE UNIONS,4
ARIZONA,2011,ARIZONA STATE LODGE FRATERNAL ORDER OF POLICE,yes,PUBLIC SECTOR UNIONS,19
ARIZONA,2011,ARIZONA THOROUGHBRED DEALERS ASSOCIATION,yes,GAMBLING & CASINOS,2
ARIZONA,2011,ARIZONA VETERANS' EDUCATION FOUNDATION,no,,3
ARIZONA,2011,ARIZONA WATER QUALITY ASSOCIATION,no,,2
ARIZONA,2011,ARIZONA WILDLIFE FEDERATION,yes,,1
ARIZONA,2011,ARIZONANS FOR ELECTRIC CHOICE & COMPETITION,no,,2
ARIZONA,2011,ARIZONANS FOR GUN SAFETY,no,,2
ARIZONA,2011,ARIZONANS FOR NON-SMOKERS RIGHTS,no,,1
ARIZONA,2011,ARIZONANS FOR PREVENTION,no,,1
ARIZONA,2011,ARIZONANS FOR TRIBAL GOVT GAMING,no,,3
ARIZONA,2011,"ARNETT,, WILLIAM & ASH, FRED",no,,2
ARIZONA,2011,ASARCO LLC,yes,MINING,11
ARIZONA,2011,ASSESSMENT TECHNOLOGY INC,no,,1
ARIZONA,2011,ASSET ASSISTANCE CO LLC,no,,1
ARIZONA,2011,ASSN FOR PROFESSIONALS IN INFECTION CONTROL & EPIDEMIOLOGY,no,,6
ARIZONA,2011,ASSN OF AESTHETIC PROFESSIONALS,no,,2
ARIZONA,2011,ASSN OF ARIZONA FOOD BANKS,no,,2
ARIZONA,2011,ASSOC & SOCIETY INSURANCE CORP,no,,1
ARIZONA,2011,ASSOCIA,no,,1
ARIZONA,2011,ASSOCIATED GENERAL CONTRACTORS-AZ CHAPTER,no,,3
ARIZONA,2011,ASSOCIATED HIGHWAY PATROLMEN OF ARIZONA,yes,PUBLIC SECTOR UNIONS,5
ARIZONA,2011,ASSOCIATION FOR CAREER TECHNICAL EDUCATION OF AZ ACTEAZ,no,,11
ARIZONA,2011,ASTRAZENECA,yes,PHARMACEUTICALS & HEALTH PRODUCTS,1
ARIZONA,2011,AT&T,yes,TELECOM SERVICES & EQUIPMENT,3
ARIZONA,2011,AUCTION RON BRUNK INC,no,,1
ARIZONA,2011,AUDUBON ARIZONA / NATL AUD SOC,no,,1
ARIZONA,2011,AUGUSTA RESOURCE CORPORATION,no,,6
ARIZONA,2011,AUTO CITI TOWING,no,,1
ARIZONA,2011,AUTOMOTIVE SERVICE ASSOCIATION OF AZ,no,,1
ARIZONA,2011,AVAYA INC,yes,TELECOM SERVICES & EQUIPMENT,2
ARIZONA,2011,AVENTIS PHARMACEUTICALS,yes,PHARMACEUTICALS & HEALTH PRODUCTS,4
ARIZONA,2011,AVIS BUDGET GROUP,yes,AUTOMOTIVE,1
ARIZONA,2011,AVONDALE LIVE STUDIOS,no,,3
ARIZONA,2011,"AVONDALE, CITY OF",no,,7
ARIZONA,2011,AZ ACTION FOR THE ARTS,no,,3
ARIZONA,2011,AZ ACUPUNCTURE BOARD OF EXAMINERS,no,,1
ARIZONA,2011,AZ ADVOCACY NETWORK,no,,2
ARIZONA,2011,AZ AGENTS ALLIANCE,no,,3
ARIZONA,2011,AZ AGRIBUSINESS & EQUINE CENTER,no,,1
ARIZONA,2011,AZ AGRICULTURAL AVIATION ASSOCIATION,no,,1
ARIZONA,2011,AZ AIRPORTS ASSOCIATION,no,,6
ARIZONA,2011,AZ ALARM ASSOCIATION,no,,5
ARIZONA,2011,AZ ALLIANCE FOR RETIRED AMERICANS,no,,2
ARIZONA,2011,AZ ALZHEIMER'S RESEARCH CENTER INC,no,,3
ARIZONA,2011,AZ AMBULANCE ASSN,no,,2
ARIZONA,2011,AZ AMERICAN WATER CO,no,,8
ARIZONA,2011,AZ ARCHAEOLOGY SOCIETY INC,no,,1
ARIZONA,2011,AZ ASSN FOR ECONOMIC DEVELOPMENT,no,,3
ARIZONA,2011,AZ ASSN MANUFACTURED HOME OWNERS,no,,4
ARIZONA,2011,AZ ASSN OF ADVOCATES OF PROPERTY TAX ANALYSTS,no,,3
ARIZONA,2011,AZ ASSN OF COMMUNITY HEALTH CENTERS,no,,2
ARIZONA,2011,AZ ASSN OF COMMUNITY MANAGERS (AACM),no,,12
ARIZONA,2011,AZ ASSN OF CONSERVATION DISTRICTS,no,,1
ARIZONA,2011,AZ ASSN OF DEFENSE COUNSEL,no,,2
ARIZONA,2011,AZ ASSN OF HEALTH PLANS INC,no,,1
ARIZONA,2011,AZ ASSN OF HEALTH UNDERWRITERS,no,,6
ARIZONA,2011,AZ ASSN OF INDEPENDENT PARALEGALS,no,,2
ARIZONA,2011,AZ ASSN OF LAWYERS FOR INJURED WORKERS,no,,8
ARIZONA,2011,AZ ASSN OF NURSE ANESTHETISTS,no,,1
ARIZONA,2011,AZ ASSN OF PROVIDERS FOR PEOPLE WITH DISABILITIES,no,,1
ARIZONA,2011,AZ ASSN OF SUPERIOR COURT CLERKS,no,,3
ARIZONA,2011,AZ ASSOCIATION OF AREA AGENCIES ON AGING,no,,1
ARIZONA,2011,AZ ASSOCIATION OF CHIROPRACTIC,yes,HEALTH PROFESSIONALS,4
ARIZONA,2011,AZ ASSOCIATION OF COUNTIES,no,,11
ARIZONA,2011,AZ ASSOCIATION OF SCHOOL BUSINESS OFFICIALS,no,,2
ARIZONA,2011,AZ ASTHMA COALITION,no,,3
ARIZONA,2011,AZ ATHLETIC TRAINERS ASSN,no,,3
ARIZONA,2011,AZ ATTORNEY GENERAL'S OFFICE,no,,18
ARIZONA,2011,AZ ATTORNEYS FOR CRIMINAL JUSTICE,no,,18
ARIZONA,2011,AZ AUTOMATIC MERCHANDISING COUNCIL,no,,2
ARIZONA,2011,AZ AUTOMOBILE ASSOCIATION (AAA),no,,2
ARIZONA,2011,AZ AUTOMOBILE DEALERS ASSOCIATION,yes,,5
ARIZONA,2011,AZ AUTOMOBILE THEFT AUTHORITY,no,,17
ARIZONA,2011,AZ AUTOMOTIVE WHOLESALERS ASSOCIATION,no,,2
ARIZONA,2011,AZ BAIL BOND AGENTS ASSOC,no,,1
ARIZONA,2011,AZ BIOINDUSTRY ASSN,no,,2
ARIZONA,2011,AZ BIOMEDICAL RESEARCH COMMISSION,no,,3
ARIZONA,2011,AZ BOARD OF APPRAISAL,no,,1
ARIZONA,2011,AZ BOARD OF BARBERS,no,,4
ARIZONA,2011,AZ BOARD OF BEHAVIORAL HEALTH EXAMINERS,no,,2
ARIZONA,2011,AZ BOARD OF COSMETOLOGY,no,,1
ARIZONA,2011,AZ BOARD OF EXECUTIVE CLEMENCY,no,,4
ARIZONA,2011,AZ BOARD OF FINGERPRINTING,no,,1
ARIZONA,2011,AZ BOARD OF HOMEOPATHIC MEDICAL EXAMINERS,no,,1
ARIZONA,2011,AZ BOARD OF OSTEOPATHIC EXAMINERS IN MEDICINE & SURGERY,no,,3
ARIZONA,2011,AZ BOARD OF REGENTS,no,,3
ARIZONA,2011,AZ BRIDGE TO INDEPENDENT LIVING (ABIL),no,,5
ARIZONA,2011,AZ BROADCASTERS ASSN,no,,1
ARIZONA,2011,AZ BUILDERS' ALLIANCE,no,,3
ARIZONA,2011,AZ BUILDING OWNERS & MANAGERS ASSOC,no,,1
ARIZONA,2011,AZ BUSINESS & EDUCATION COALITION,no,,2
ARIZONA,2011,AZ CACTUS LEAGUE COALITION,no,,4
ARIZONA,2011,AZ CAPITOL TIMES / AZ NEWS SERVICE,no,,2
ARIZONA,2011,AZ CAPTIVE INSURANCE ASSN,no,,3
ARIZONA,2011,AZ CARDINALS,no,,7
ARIZONA,2011,AZ CATHOLIC CONFERENCE,no,,1
ARIZONA,2011,AZ CATTLEMEN'S ASSN,no,,3
ARIZONA,2011,AZ CENTER FOR DISABILITY LAW,no,,5
ARIZONA,2011,AZ CENTER FOR LAW IN THE PUBLIC INTEREST,no,,3
ARIZONA,2011,AZ CHAPTER AMERICAN COLLEGE EMERGENCY PHYSICIANS (AZACEP),no,,1
ARIZONA,2011,AZ CHAPTER NATIONAL ELECTRICAL CONTRACTORS ASSOCIATION,no,,1
ARIZONA,2011,AZ CHAPTER NATIONAL SAFETY COUNCIL,no,,4
ARIZONA,2011,AZ CHAPTER NATL ASSOC OF INDUSTRIAL & OFFICE PROPERTIES,no,,4
ARIZONA,2011,AZ CHAPTER OF THE NATIONAL ACADEMY OF ELDER LAW ATTORNEYS,no,,10
ARIZONA,2011,AZ CHILD CARE ASSOCIATION,no,,2
ARIZONA,2011,AZ CHIROPRACTIC SOCIETY,no,,5
ARIZONA,2011,AZ CITIZENS DEFENSE LEAGUE INC,no,,2
ARIZONA,2011,AZ CLEAN FUELS YUMA LLC,no,,2
ARIZONA,2011,AZ COALITION AGAINST DOMESTIC VIOLENCE,no,,2
ARIZONA,2011,AZ COALITION TO END HOMELESSNESS,no,,5
ARIZONA,2011,AZ COMMERCIAL MORTGAGE LENDERS ASSN,no,,4
ARIZONA,2011,AZ COMMISSION FOR THE DEAF & HARD OF HEARING,no,,3
ARIZONA,2011,AZ COMMISSION OF INDIAN AFFAIRS,no,,1
ARIZONA,2011,AZ COMMISSION ON THE ARTS,no,,1
ARIZONA,2011,AZ COMMISSION ON UNIFORM STATE LAWS,no,,5
ARIZONA,2011,AZ COMMON SENSE INC,no,,2
ARIZONA,2011,AZ COMMUNITY ACTION ASSN,no,,1
ARIZONA,2011,AZ COMMUNITY COLLEGE PRESIDENT'S COUNCIL,no,,1
ARIZONA,2011,AZ COMPETITIVE POWER ALLIANCE,no,,1
ARIZONA,2011,AZ CONCRETE CONTRACTORS ASSN,no,,1
ARIZONA,2011,AZ CONFEDERATION OF MOTORCYCLE CLUBS,no,,3
ARIZONA,2011,AZ CONSORTIUM FOR CHILDREN CHRONIC ILLNESS (ACCCI),no,,1
ARIZONA,2011,AZ CONTRACTORS ASSOCIATION,yes,,3
ARIZONA,2011,AZ CORPORATION COMMISSION,no,,17
ARIZONA,2011,AZ COTTON GROWERS ASSOCIATION,yes,,1
ARIZONA,2011,AZ COTTON RESEARCH & PROTECTION COUNCIL,no,,2
ARIZONA,2011,AZ COUNCIL OF HUMAN SERVICES PROVIDERS,no,,4
ARIZONA,2011,AZ COURT REPORTERS ASSOCIATION,yes,,3
ARIZONA,2011,AZ CREDIT UNION LEAGUE INC,yes,,7
ARIZONA,2011,AZ CRIMINAL JUSTICE COMMISSION,no,,2
ARIZONA,2011,AZ CROP PROTECTION ASSN,no,,2
ARIZONA,2011,AZ DEPARTMENT OF HOMELAND SECURITY,no,,2
ARIZONA,2011,AZ DEPARTMENT OF HOUSING,no,,6
ARIZONA,2011,AZ DEPARTMENT OF VETERANS SERVICES,no,,1
ARIZONA,2011,AZ DEPT OF ADMINISTRATION,no,,5
ARIZONA,2011,AZ DEPT OF AGRICULTURE,no,,8
ARIZONA,2011,AZ DEPT OF COMMERCE,no,,4
ARIZONA,2011,AZ DEPT OF CORRECTIONS,no,,4
ARIZONA,2011,AZ DEPT OF ECONOMIC SECURITY,no,,7
ARIZONA,2011,AZ DEPT OF EDUCATION,no,,46
ARIZONA,2011,AZ DEPT OF EMERGENCY & MILITARY AFFAIRS,no,,6
ARIZONA,2011,AZ DEPT OF ENVIRONMENTAL QUALITY,no,,3
ARIZONA,2011,AZ DEPT OF FINANCIAL INSTITUTIONS,no,,3
ARIZONA,2011,AZ DEPT OF FIRE BLDG & LIFE SAFETY,no,,3
ARIZONA,2011,AZ DEPT OF GAMING,no,,9
ARIZONA,2011,AZ DEPT OF HEALTH SERVICES,no,,6
ARIZONA,2011,AZ DEPT OF INSURANCE,no,,4
ARIZONA,2011,AZ DEPT OF JUVENILE CORRECTIONS,no,,6
ARIZONA,2011,AZ DEPT OF LIQUOR LICENSES & CONTROL,no,,2
ARIZONA,2011,AZ DEPT OF PUBLIC SAFETY,no,,12
ARIZONA,2011,AZ DEPT OF RACING,no,,4
ARIZONA,2011,AZ DEPT OF REAL ESTATE,no,,3
ARIZONA,2011,AZ DEPT OF REVENUE,no,,13
ARIZONA,2011,AZ DEPT OF TRANSPORTATION,no,,16
ARIZONA,2011,AZ DEPT OF WATER RESOURCES,no,,5
ARIZONA,2011,AZ DEPT OF WEIGHTS & MEASURES,no,,3
ARIZONA,2011,AZ DIAMONDBACKS,no,,3
ARIZONA,2011,AZ EARLY CHILDHOOD DEVELOPMENT & HEALTH BOARD,no,,9
ARIZONA,2011,AZ EDUCATION ASSOCIATION,yes,,7
ARIZONA,2011,AZ ELECTRIC POWER COOPERATIVE INC,no,,16
ARIZONA,2011,AZ EMERGENCY NURSES ASSN,no,,20
ARIZONA,2011,AZ EXPOSITION & STATE FAIR,no,,2
ARIZONA,2011,AZ FAIRS ASSN,no,,1
ARIZONA,2011,AZ FAMILIES FOR HOME EDUCATION,no,,1
ARIZONA,2011,AZ FAMILY PLANNING COUNCIL,no,,2
ARIZONA,2011,AZ FIDUCIARIES ASSN,no,,5
ARIZONA,2011,AZ FIRE DISTRICT ASSOCIATION,no,,3
ARIZONA,2011,AZ FLOODPLAIN MANAGEMENT ASSN,no,,3
ARIZONA,2011,AZ FOUNDATION FOR BEHAVIORAL HEALTH,no,,1
ARIZONA,2011,AZ FOUNDATION FOR LEGAL SERVICES & EDUCATION,no,,1
ARIZONA,2011,AZ FREE ENTERPRISE CLUB,no,,2
ARIZONA,2011,AZ FUELING FACILITIES CORPORATION,no,,2
ARIZONA,2011,"AZ FUNERAL, CEMETERY & CREMATION ASSOCIATION",no,,1
ARIZONA,2011,AZ GAME & FISH DEPT,no,,5
ARIZONA,2011,AZ GOVERNOR'S OFFICE,no,,30
ARIZONA,2011,AZ GROWTH FOUNDATION,no,,2
ARIZONA,2011,AZ HEALTH CARE COST CONTAINMENT SYSTEM,no,,4
ARIZONA,2011,AZ HEALTH FACILITIES AUTHORITY,no,,2
ARIZONA,2011,AZ HEART FOUNDATION,no,,1
ARIZONA,2011,AZ HERITAGE ALLIANCE,no,,23
ARIZONA,2011,AZ HISTORICAL FOUNDATION,no,,3
ARIZONA,2011,AZ HISTORICAL SOCIETY,no,,8
ARIZONA,2011,AZ HOME INSPECTORS COALITION,no,,3
ARIZONA,2011,AZ HOMEOPATHIC & INTEGRATIVE MEDICAL ASSOCIATION,yes,,3
ARIZONA,2011,AZ HORSE COUNCIL,no,,1
ARIZONA,2011,AZ HOUSING ALLIANCE,no,,1
ARIZONA,2011,AZ HOUSING ASSOCIATION,no,,5
ARIZONA,2011,AZ HOUSING COMMISSION,no,,5
ARIZONA,2011,AZ HOUSING FINANCE AUTHORITY,no,,6
ARIZONA,2011,AZ INDIAN GAMING ASSN,no,,3
ARIZONA,2011,AZ INTERLOCK DISTRIBUTORS ASSN,no,,1
ARIZONA,2011,AZ INTERSCHOLASTIC ASSN,no,,4
ARIZONA,2011,AZ INVESTMENT COUNCIL,no,,1
ARIZONA,2011,AZ INVESTORS LENDERS & TRUSTEES ASSOC,no,,1
ARIZONA,2011,AZ JUDGES ASSN,no,,1
ARIZONA,2011,AZ JUDICIAL COUNCIL,no,,7
ARIZONA,2011,AZ JUSTICE OF THE PEACE ASSOCIATION,no,,1
ARIZONA,2011,AZ LANDSCAPE CONTRACTORS ASSN,no,,1
ARIZONA,2011,AZ LIBRARY ASSOCIATION,no,,2
ARIZONA,2011,AZ LOCAL GOVERNMENT EMPLOYEE BENEFIT TRUST,no,,1
ARIZONA,2011,AZ MEDICAL BOARD,no,,2
ARIZONA,2011,AZ MINING ASSOCIATION,yes,,9
ARIZONA,2011,AZ MORTGAGE LENDERS ASSOCIATION,no,,9
ARIZONA,2011,AZ MULTIHOUSING ASSOCIATION,yes,,1
ARIZONA,2011,AZ MUNICIPAL POWER USERS ASSN,no,,2
ARIZONA,2011,AZ MUNICIPAL WATER USERS ASSN,no,,5
ARIZONA,2011,AZ NATIONAL ORGANIZATION FOR WOMEN (NOW),no,,2
ARIZONA,2011,AZ NATUROPATHIC MEDICAL ASSN,no,,3
ARIZONA,2011,AZ NAVIGABLE STREAM ADJUDICATION COMM,no,,1
ARIZONA,2011,AZ NEWSPAPERS ASSN,no,,4
ARIZONA,2011,AZ NURSERY ASSOCIATION,no,,1
ARIZONA,2011,AZ NURSES ASSOCIATION,yes,,6
ARIZONA,2011,AZ OFF-HWY VEHICLE COALITION,no,,2
ARIZONA,2011,AZ OFFICE OF PEST MANAGEMENT,no,,2
ARIZONA,2011,AZ OFFICE OF TOURISM,no,,2
ARIZONA,2011,AZ OPHTHALMOLOGICAL SOCIETY,no,,7
ARIZONA,2011,AZ OPTOMETRIC ASSN,no,,7
ARIZONA,2011,AZ OSTEOPOROSIS COALITION,no,,2
ARIZONA,2011,AZ PARENT TEACHER ASSN (PTA),no,,4
ARIZONA,2011,AZ PARENTS FOR PUBLIC EDUCATION,no,,10
ARIZONA,2011,AZ PARTNERS FOR ABSTINENCE EDUCATION INC,no,,2
ARIZONA,2011,AZ PAWN BROKERS ASSN,no,,1
ARIZONA,2011,AZ PEACE OFFICER STANDARDS / TRAINING BOARD (AZ POST),no,,1
ARIZONA,2011,AZ PETROLEUM MARKETERS ASSN,no,,2
ARIZONA,2011,AZ PHARMACY ALLIANCE,no,,6
ARIZONA,2011,AZ PLANNING ASSOCIATION,no,,1
ARIZONA,2011,AZ PODIATRIC MEDICAL ASSOCIATION,yes,,6
ARIZONA,2011,AZ POWER AUTHORITY,no,,7
ARIZONA,2011,AZ PRIVATE SCHOOL ASSOCIATION,yes,,2
ARIZONA,2011,AZ PROPANE GAS ASSOCIATION,no,,2
ARIZONA,2011,AZ PROSECUTING ATTORNEYS ADVISORY COUNCIL,no,,2
ARIZONA,2011,AZ PSYCHIATRIC SOCIETY,no,,6
ARIZONA,2011,AZ PUBLIC DEFENDER'S ASSOCIATION,no,,1
ARIZONA,2011,AZ PUBLIC HEALTH ASSOCIATION,no,,1
ARIZONA,2011,AZ PUBLIC SERVICE COMPANY (APS),no,,50
ARIZONA,2011,AZ RACETRACK COALITION,no,,10
ARIZONA,2011,AZ RADIATION REGULATORY AGENCY,no,,1
ARIZONA,2011,AZ RAIL PASSENGER ASSOCIATION,no,,2
ARIZONA,2011,AZ REAL ESTATE INVESTORS ASSOC,no,,2
ARIZONA,2011,AZ RECREATIONAL VEHICLE DEALERS ASSN,no,,4
ARIZONA,2011,AZ REGISTRAR OF CONTRACTORS,no,,2
ARIZONA,2011,AZ RENTAL PROPERTY OWNERS & LANDLORDS ASSOC,no,,1
ARIZONA,2011,AZ RETAILERS ASSOCIATION,yes,RETAIL SALES,3
ARIZONA,2011,AZ ROOFING CONTRACTORS ASSN,no,,1
ARIZONA,2011,AZ RURAL SCHOOLS ASSOCIATION,no,,1
ARIZONA,2011,AZ RURAL WATER ASSN,no,,1
ARIZONA,2011,AZ SCHOOL ADMINISTRATORS ASSOC,no,,4
ARIZONA,2011,AZ SCHOOL BOARDS ASSOCIATION,no,,9
ARIZONA,2011,AZ SCHOOL FACILITIES BOARD,no,,2
ARIZONA,2011,AZ SCHOOL RISK RETENTION TRUST,no,,5
ARIZONA,2011,AZ SCHOOL-BASED HEALTH CARE COUNCIL,no,,2
ARIZONA,2011,AZ SCIENCE CENTER,no,,1
ARIZONA,2011,AZ SCRAP RECYCLERS ASSOC,no,,1
ARIZONA,2011,AZ SECRETARY OF STATE,no,,10
ARIZONA,2011,AZ SELF-INSURERS ASSOC,no,,1
ARIZONA,2011,AZ SELF-STORAGE ASSOCIATION,no,,3
ARIZONA,2011,AZ SOCIETY OF COSMETIC SURGEONS,no,,1
ARIZONA,2011,AZ SPEECH-LANGUAGE-HEARING ASSOCIATION,no,,1
ARIZONA,2011,AZ SPORTS & TOURISM AUTHORITY (AZSTA),no,,2
ARIZONA,2011,AZ SPORTSERVICE INC,no,,1
ARIZONA,2011,AZ SPORTSMEN FOR WILDLIFE,no,,1
ARIZONA,2011,AZ STATE ASSN OF PHYSICIAN ASSISTANTS,no,,1
ARIZONA,2011,AZ STATE AUCTIONEERS ASSOCIATION,no,,1
ARIZONA,2011,AZ STATE BLDG & CONSTRUCTION TRADES COUNCIL,no,,1
ARIZONA,2011,AZ STATE BOARD FOR CHARTER SCHOOLS,no,,2
ARIZONA,2011,AZ STATE BOARD FOR PRIVATE POSTSECONDARY ED,no,,2
ARIZONA,2011,AZ STATE BOARD FUNERAL DIR & EMBALMERS,no,,8
ARIZONA,2011,AZ STATE BOARD OF ACCOUNTANCY,no,,9
ARIZONA,2011,AZ STATE BOARD OF ATHLETIC TRAINING,no,,4
ARIZONA,2011,AZ STATE BOARD OF CHIROPRACTIC EXAMINERS,no,,5
ARIZONA,2011,AZ STATE BOARD OF DENTAL EXAMINERS,no,,2
ARIZONA,2011,AZ STATE BOARD OF DISPENSING OPTICIANS,no,,1
ARIZONA,2011,AZ STATE BOARD OF EDUCATION,no,,5
ARIZONA,2011,AZ STATE BOARD OF NURSING,no,,1
ARIZONA,2011,AZ STATE BOARD OF OCCUPATIONAL THERAPY,no,,5
ARIZONA,2011,AZ STATE BOARD OF OPTOMETRY,no,,4
ARIZONA,2011,AZ STATE BOARD OF PHARMACY,no,,1
ARIZONA,2011,AZ STATE BOARD OF PHYSICAL THERAPY EXAMINERS,no,,2
ARIZONA,2011,AZ STATE BOARD OF PODIATRY EXAMINERS,no,,2
ARIZONA,2011,AZ STATE BOARD OF PSYCHOLOGIST EXAMINERS,no,,2
ARIZONA,2011,AZ STATE BOARD OF TECHNICAL REGISTRATION,no,,3
ARIZONA,2011,AZ STATE CONTRACTORS COALITION (ASCC),no,,3
ARIZONA,2011,AZ STATE DENTAL HYGIENISTS ASSOCIATION,yes,,2
ARIZONA,2011,AZ STATE IMPACT AID ASSOCIATION,no,,1
ARIZONA,2011,AZ STATE LAND DEPARTMENT,no,,2
ARIZONA,2011,AZ STATE LOTTERY,no,,4
ARIZONA,2011,AZ STATE MINE INSPECTOR,no,,1
ARIZONA,2011,AZ STATE PARKS,no,,2
ARIZONA,2011,AZ STATE PARKS FOUNDATION,no,,1
ARIZONA,2011,AZ STATE PERSONNEL BOARD,no,,3
ARIZONA,2011,AZ STATE RETIRED EMPLOYEES ASSN,no,,1
ARIZONA,2011,AZ STATE RETIREMENT SYSTEM,no,,4
ARIZONA,2011,AZ STATE RIFLE & PISTOL ASSN,no,,4
ARIZONA,2011,AZ STATE SCHOOLS FOR DEAF & BLIND,no,,2
ARIZONA,2011,AZ STATE TREASURER'S OFFICE,no,,4
ARIZONA,2011,AZ STATE UNIVERSITY,no,,5
ARIZONA,2011,AZ STATE UNIVERSITY RETIREES ASSN,no,,5
ARIZONA,2011,AZ STATE VETERINARY MEDICAL EXAMINING BOARD,no,,2
ARIZONA,2011,AZ STUDENTS ASSN,no,,10
ARIZONA,2011,AZ TAX RESEARCH ASSN,no,,7
ARIZONA,2011,AZ TECHNOLOGY COUNCIL,yes,,2
ARIZONA,2011,AZ TELECOMMUNICATIONS & INFORMATION COUNCIL,no,,1
ARIZONA,2011,AZ THEATRE OWNERS ASSN,no,,1
ARIZONA,2011,AZ TITLE LOAN ASSN,no,,1
ARIZONA,2011,AZ TOURISM ALLIANCE,no,,2
ARIZONA,2011,AZ TRANSIT ASSOCIATION,no,,1
ARIZONA,2011,AZ TRIAL LAWYERS ASSOCIATION,yes,,55
ARIZONA,2011,AZ TRUCKING ASSOCIATION,no,,2
ARIZONA,2011,AZ TRUSTEE ASSN,no,,2
ARIZONA,2011,AZ VETERINARY MEDICAL ASSOCIATION,yes,,5
ARIZONA,2011,AZ WATER BANK AUTHORITY,no,,7
ARIZONA,2011,AZ WATER COMPANY,no,,1
ARIZONA,2011,AZ WATER WELL ASSOCIATION,no,,2
ARIZONA,2011,AZ WESTERN COLLEGE,no,,1
ARIZONA,2011,AZ WHEAT GROWERS ASSN,no,,1
ARIZONA,2011,AZ WINE GROWERS ASSN,no,,5
ARIZONA,2011,AZ WING CIVIL AIR PATROL,no,,2
ARIZONA,2011,AZ WOMEN'S ALLIANCE,no,,1
ARIZONA,2011,AZ-COUNCIL OF ADMINISTRATORS OF SPECIAL EDUCATION (AZCASE),no,,6
ARIZONA,2011,AZ-COUNCIL OF EXCEPTIONAL CHILDREN (AZCEC),no,,3
ARIZONA,2011,AZ-NM CABLE COMMUNICATIONS ASSN,no,,1
ARIZONA,2011,"AZPROPERTYCO HOLDINGS, LLC",no,,1
ARIZONA,2011,AZTEC LAND & CATTLE CO LTD,no,,2
ARIZONA,2011,B J ALAN CO DBA PHANTOM FIREWORKS,yes,CHEMICAL & RELATED MANUFACTURING,1
ARIZONA,2011,B P AMOCO-WEST COAST EXTERNAL AFFAIRS,no,,1
ARIZONA,2011,BALLARD SPAHR ANDREWS & INGERSOLL,yes,LAWYERS & LOBBYISTS,26
ARIZONA,2011,BALSZ SCHOOL DISTRICT 31 (NEW NUMBER),no,,3
ARIZONA,2011,BANK OF AMERICA,yes,COMMERCIAL BANKS,3
ARIZONA,2011,BANKRUPTCY TRUSTEE'S ASSN OF ARIZONA,no,,2
ARIZONA,2011,BANNER HEALTH ARIZONA,no,,23
ARIZONA,2011,BARRETT-JACKSON AUCTION COMPANY LLC,no,,1
ARIZONA,2011,BARRY GOLDWATER INSTITUTE FOR PUBLIC POLICY RESEARCH,no,,1
ARIZONA,2011,BAYER AG,yes,PHARMACEUTICALS & HEALTH PRODUCTS,2
ARIZONA,2011,BEECHWOOD CAPITAL GROUP,no,,1
ARIZONA,2011,BEER & WINE DISTRIBUTORS OF ARIZONA,yes,"BEER, WINE & LIQUOR",2
ARIZONA,2011,BELRON US INC,no,AUTOMOTIVE,3
ARIZONA,2011,BHHS LEGACY FOUNDATION,no,,2
ARIZONA,2011,BIOACCEL,no,,1
ARIZONA,2011,"BISBEE, CITY OF",no,,2
ARIZONA,2011,BLACK BOX NETWORK SERVICES,no,,1
ARIZONA,2011,BLACK BOX NETWORK SERVICES,no,,1
ARIZONA,2011,BLACKWATER COMMUNITY SCHOOL,no,,2
ARIZONA,2011,BLOOD SYSTEMS INC,no,,5
ARIZONA,2011,BLUE CROSS & BLUE SHIELD OF AZ,yes,,11
ARIZONA,2011,BNSF RAILWAY,yes,RAILROADS,4
ARIZONA,2011,BOEING CO,yes,AIR TRANSPORT,2
ARIZONA,2011,BORDER ACTION NETWORK,no,,3
ARIZONA,2011,BOYS & GIRLS CLUBS OF AMERICA,no,NONPROFIT INSTITUTIONS,2
ARIZONA,2011,BRADSHAW PUBLIC RELATIONS CO,no,,1
ARIZONA,2011,BRIDGEPOINT EDUCATION,yes,EDUCATION,2
ARIZONA,2011,BRIGHTSOURCE ENERGY INC,yes,MISCELLANEOUS ENERGY,1
ARIZONA,2011,BROCADE,no,,1
ARIZONA,2011,BROOKLINE COLLEGE,yes,EDUCATION,5
ARIZONA,2011,BROPHY COMMUNITY FOUNDATION,no,,3
ARIZONA,2011,BRUCE A BODNER CO,no,,3
ARIZONA,2011,BRUNDAGE MANAGEMENT,yes,BUSINESS SERVICES,1
ARIZONA,2011,BUCKEYE ELEMENTARY SCHOOL DIST #33,no,,1
ARIZONA,2011,BUCKEYE VALLEY CHAMBER OF COMMERCE,no,,1
ARIZONA,2011,BUCKEYE WATER CONSERVATION & DRAINAGE DIST,no,,1
ARIZONA,2011,"BUCKEYE, TOWN OF",no,,1
ARIZONA,2011,BUDGET RENTAL CAR,no,,1
ARIZONA,2011,BUILDING OWNERS & MANAGERS ASSOCIATION OF GREATER PHOENIX (BOMA),no,,1
ARIZONA,2011,BULLHEAD CITY,no,,6
ARIZONA,2011,BURCH & CRACCHIOLO PA,no,,6
ARIZONA,2011,CA TECHNOLOGIES,yes,COMPUTER EQUIPMENT & SERVICES,1
ARIZONA,2011,CALGON CARBON CORPORATION,yes,,1
ARIZONA,2011,CALJET OF AMERICA LLC,no,,2
ARIZONA,2011,CALL MD,no,,1
ARIZONA,2011,CALPORTLAND CO,no,,1
ARIZONA,2011,CAMELBACK RANCH SPRING TRAINING LLC,no,,2
ARIZONA,2011,"CAMP VERDE, TOWN OF",no,,6
ARIZONA,2011,CANCER TREATMENT CENTERS OF AMERICA,yes,HOSPITALS & NURSING HOMES,5
ARIZONA,2011,CAPITAL CONSULTANTS MANAGEMENT CORPORATION,no,,1
ARIZONA,2011,CAPITOL BANCORP LTD,no,,1
ARIZONA,2011,CARDINAL CAPITAL MANAGEMENT INC,no,,3
ARIZONA,2011,CARE FOR KIDS OF AZ LLC,no,,3
ARIZONA,2011,"CAREFREE, TOWN OF",no,,1
ARIZONA,2011,CARONDELET HEALTH NETWORK,yes,HEALTH SERVICES,1
ARIZONA,2011,"CASA GRANDE, CITY OF",no,,10
ARIZONA,2011,CASH AMERICA INTERNATIONAL,yes,PAYDAY/TITLE LOANS,2
ARIZONA,2011,CATALINA FOOTHILLS UNIFIED SCHOOL DISTRICT 16,no,,2
ARIZONA,2011,CATALYST PAPER (SNOWFLAKE) INC,no,,3
ARIZONA,2011,CATHOLIC HEALTH CARE WEST,yes,HEALTH SERVICES,26
ARIZONA,2011,"CAVE CREEK, TOWN OF",no,,1
ARIZONA,2011,CENTENE CORP,yes,HEALTH SERVICES,7
ARIZONA,2011,CENTENNIAL LEASING & SALES OF AZ LLC,no,,5
ARIZONA,2011,CENTER FOR ARIZONA POLICY,yes,CHRISTIAN CONSERVATIVE,4
ARIZONA,2011,CENTER FOR BIOLOGICAL DIVERSITY,yes,PRO-ENVIRONMENTAL POLICY,7
